sentence_id,Someone,somewhere,title,article_link,Someone_first_index,Someone_last_index,somewhere_first_index,somewhere_last_index,sentence_text,paragraph_text,url
870248,John Mungo - Park,a boarder,John Mungo-Park,https://en.wikipedia.org/wiki?curid=29483505,0,3,7,8,"John Mungo - Park was educated as a boarder at Liverpool College , where he was a successful athlete and sportsman .","John Mungo-Park was educated as a boarder at Liverpool College, where he was a successful athlete and sportsman. 'Mungo' had been a family forename for many generations, and he used the surname Mungo-Park from his schooldays onward.",https://en.wikipedia.org/wiki?curid=29483505
870248,John Mungo - Park,Liverpool College,John Mungo-Park,https://en.wikipedia.org/wiki?curid=29483505,0,3,10,11,"John Mungo - Park was educated as a boarder at Liverpool College , where he was a successful athlete and sportsman .","John Mungo-Park was educated as a boarder at Liverpool College, where he was a successful athlete and sportsman. 'Mungo' had been a family forename for many generations, and he used the surname Mungo-Park from his schooldays onward.",https://en.wikipedia.org/wiki?curid=29483505
870550,He,Christ Church,"Charles Adderley, 1st Baron Norton",https://en.wikipedia.org/wiki?curid=2341698,0,0,4,5,"He was educated at Christ Church , Oxford , where he graduated with a Bachelor of Arts in 1838 .","Charles Bowyer Adderley was the eldest son of Charles Clement Adderley (d. 1818), offspring of an old Staffordshire family, and his wife, daughter of Sir Edmund Cradock-Hartopp, 1st Baronet. Adderley inherited Hams Hall, Warwickshire, and the valuable estates of his great-uncle, Charles Bowyer Adderley, in 1826. He was educated at Christ Church, Oxford, where he graduated with a Bachelor of Arts in 1838.",https://en.wikipedia.org/wiki?curid=2341698
872038,He,the Perse,Peter Scupham,https://en.wikipedia.org/wiki?curid=23607778,0,0,4,5,"He was educated at the Perse , Cambridge and St. George 's , Harpenden .","Scupham was born in Liverpool. He was educated at the Perse, Cambridge and St. George's, Harpenden. After National Service with the RAOC he studied at Emmanuel College, Cambridge. He taught at Skegness Grammar School, and then became Head of English at St. Christopher School, Letchworth. His first marriage was to Carola Nance Braunholtz, the daughter of Hermann Braunholtz, CBE, Keeper of the Ethnographical Collections at the British Museum, with whom he had four children. He is now married to Margaret Steward. Together they have restored a small derelict Elizabethan Manor house in Norfolk, where they have put on plays and created a garden. With John Mole he founded The Mandeville Press, a small press using traditional letterpress methods of printing. The Press produced hand-set editions of work by Geoffrey Grigson, Anthony Hecht, John Fuller and many others. Its archive is now in the British Library. For many years he has run an antiquarian book business - Mermaid Books - with Margaret Steward, specialising in English Literature, and trading by printed catalogue. As of 2020, Mermaid Books appears to be in hiatus, and possibly no longer trading.",https://en.wikipedia.org/wiki?curid=23607778
879359,He,the village school,John Nixon (mining engineer),https://en.wikipedia.org/wiki?curid=2341515,0,0,4,6,"He was educated at the village school and at Dr. Bruce 's academy at Newcastle - on - Tyne , famous as the training - place of many great engineers .","He was born at Barlow, Gateshead, the only son of a tenant farmer of that village. He was educated at the village school and at Dr. Bruce's academy at Newcastle-on-Tyne, famous as the training-place of many great engineers. Leaving school at the age of fourteen, Nixon was set to farmwork for a time, and shortly after was apprenticed to Joseph Gray of Garesfield, the Marquis of Bute's chief mining engineer. On the expiry of his indentures he became for two years overman at the Garesfield colliery. At the end of this time, in 1839, he undertook a survey of the underground workings of the Dowlais Company in South Wales. Some years later he accepted the appointment of mining engineer to an English company working a coal and iron field at Languin near Nantes. He perceived, however, that the enterprise was destined to fail, and did not hesitate to inform his employers of his opinion. After labouring for some time to carry on a hopeless concern he returned to England.",https://en.wikipedia.org/wiki?curid=2341515
886104,He,Harrow School,"Sir William Church, 1st Baronet",https://en.wikipedia.org/wiki?curid=39599600,0,0,4,5,"He was educated at Harrow School , where he was captain of the cricket team and then went to Oxford University followed by a placement at St Bartholomew ’s Hospital .","Church was born in 1837, the son of John Church. He was educated at Harrow School, where he was captain of the cricket team and then went to Oxford University followed by a placement at St Bartholomew’s Hospital. He was appointed a Physician to the St Bartholomew's Hospital and to the Royal General Dispensary.",https://en.wikipedia.org/wiki?curid=39599600
889086,He,Christchurch Boys ' High School,Dave Batten,https://en.wikipedia.org/wiki?curid=24220826,0,0,4,8,He was educated at Christchurch Boys ' High School .,"Born in Christchurch on 13 December 1926, Batten was the son of Rawhiti Eric (Raj) Batten and Maudie Batten (née Burnett). He was educated at Christchurch Boys' High School. In 1954 he married Barbara Alice Jones in Christchurch; the couple went on to have two children but later divorced. In 1980 he married Joan Elizabeth Le Cren (née Cornish).",https://en.wikipedia.org/wiki?curid=24220826
891820,he,the domain school,Matsudaira Katamori,https://en.wikipedia.org/wiki?curid=1393990,16,16,20,22,"Interested to further Katamori 's education , Katataka then sent his heir to Aizu , where he was educated in the domain school , Nisshinkan .","Matsudaira Katamori was born in the Yotsuya district of Edo, on February 15, 1836, at the residence of the Takasu Domain He was the seventh son of Matsudaira Yoshitatsu, ""daimyō"" of Takasu, born by one of Yoshitatsu's concubines, a woman of the Komori family whose name is believed by some scholars to be Komori Chiyo (she was also known by her Buddhist name, Zenkyō-in.) Katamori, or as he was first known, Keinosuke (), had an eventful childhood. Though the Takasu domain was small, it had a high level of prestige due to its status as a branch family of the Tokugawa clan (through the gosanke house of Owari). Furthermore, in the history of the Takasu-Matsudaira line, there were ""daimyōs"" who had been adopted from senior branches of the Tokugawa clan, such as Mito. Consequently, Katamori was in a very good position to be adopted out to a senior member of the Tokugawa house. This opportunity presented itself in the form of Matsudaira Katataka, the 8th generation lord of the Aizu domain. Yoshitatsu readily approved of the adoption, not only because Katataka was the lord of a more senior house with a distinguished history and lineage, but the fact that Katataka was his birth brother must have also entered into the equation. Consequently, the young Keinosuke was adopted by Katataka, and married Katataka's daughter Toshihime, in 1856. Following his adoption, Keinosuke assumed the name ""Katamori"", which made use of one of the characters from his adoptive father's name. He was presented to the reigning shōgun, Tokugawa Ieyoshi, as well as to Ii Naosuke, four months after his adoption, and at the end of the year was invested with the court title of ""Wakasa no Kami"" (), which was traditionally held by the heir to the house of Aizu. Interested to further Katamori's education, Katataka then sent his heir to Aizu, where he was educated in the domain school, Nisshinkan.",https://en.wikipedia.org/wiki?curid=1393990
894194,He,the Royal Grammar School,Robert Burns Dick,https://en.wikipedia.org/wiki?curid=60390237,0,0,4,7,He was educated in the Royal Grammar School and went on to go to Art School .,Burns Dick was born in Stirling but moved to Newcastle as a child where his father worked in the brewing trade. He was educated in the Royal Grammar School and went on to go to Art School. He went on to be articled to William Lister Newcombe.,https://en.wikipedia.org/wiki?curid=60390237
895325,He,North Strathfield Public School,Lerryn Mutton,https://en.wikipedia.org/wiki?curid=27933503,0,0,4,7,He was educated at North Strathfield Public School and Fort Street Boys High School before working in his father 's building business .,"Mutton was born in Concord, the son of Brice Mutton (member for Concord in 1949) and Lilian Taylor. He was educated at North Strathfield Public School and Fort Street Boys High School before working in his father's building business. He served in the RAAF from 1942 to 1946, seeing action as a pilot in Labuan and Borneo. He married Mavis Tucker on 29 October 1949, with whom he had four children. In 1953 he was elected to Concord Council, serving until 1968 (as Mayor from 1961 to 1962). He was also active in the local Liberal Party.",https://en.wikipedia.org/wiki?curid=27933503
895631,He,Winchester College,Alex Chalk,https://en.wikipedia.org/wiki?curid=46643722,0,0,5,6,"He was privately educated at Winchester College before studying Modern History at Magdalen College , Oxford .","Chalk was born on the 8 August 1976 in the village of Foxcote, Gloucestershire, England, where he also grew up. He was privately educated at Winchester College before studying Modern History at Magdalen College, Oxford. Chalk's parents are Gilbert John Chalk and Gillian Frances Audrey Blois.",https://en.wikipedia.org/wiki?curid=46643722
896013,Cook,The King 's School,Lucas Cook,https://en.wikipedia.org/wiki?curid=33880715,0,0,4,7,"Cook was educated at The King 's School , Canterbury and Brasenose College , Oxford .","Cook was educated at The King's School, Canterbury and Brasenose College, Oxford. After a curacy at All Saints, Bradford, he held incumbencies at St Mark's, Low Moor and Skipton before his years as an Archdeacon.",https://en.wikipedia.org/wiki?curid=33880715
896280,"Many of the prominent leaders of the independence movement in the early twentieth century , including Anagarika Dharmapala , E. W. Perera , Sir James Peiris , Sir Ponnambalam Arunachalam , Sir Ponnambalam Ramanathan and C. A. Hewavitharne , were educated",the Colombo Academy,"Royal College, Colombo",https://en.wikipedia.org/wiki?curid=30857412,0,40,42,44,"Many of the prominent leaders of the independence movement in the early twentieth century , including Anagarika Dharmapala , E. W. Perera , Sir James Peiris , Sir Ponnambalam Arunachalam , Sir Ponnambalam Ramanathan and C. A. Hewavitharne , were educated at the Colombo Academy .","Many of the prominent leaders of the independence movement in the early twentieth century, including Anagarika Dharmapala, E. W. Perera, Sir James Peiris, Sir Ponnambalam Arunachalam, Sir Ponnambalam Ramanathan and C. A. Hewavitharne, were educated at the Colombo Academy.",https://en.wikipedia.org/wiki?curid=30857412
898370,he,his parents ' secular outlook,Béla Kun,https://en.wikipedia.org/wiki?curid=179859,7,7,1,5,"Despite his parents ' secular outlook , he was educated at the Silvania Főgimnázium in Zilah ( present - day Silvania National College , Zalău ) and a famous Reformed "" kollegium "" ( grammar school ) in the city of Kolozsvár ( now Cluj - Napoca , Romania ) .","Béla Kohn, later known as Béla Kun, was born on 20 February 1886 in the village of Lele, located near Szilágycseh, Transylvania, Kingdom of Hungary (today part of Hodod, Romania). His father, Samu Kohn was a lapsed Jewish village notary, while his mother, Róza Goldberger, was a Jewish convert to Protestantism. Despite his parents' secular outlook, he was educated at the Silvania Főgimnázium in Zilah (present-day Silvania National College, Zalău) and a famous Reformed ""kollegium"" (grammar school) in the city of Kolozsvár (now Cluj-Napoca, Romania).",https://en.wikipedia.org/wiki?curid=179859
898370,he,the Silvania Főgimnázium,Béla Kun,https://en.wikipedia.org/wiki?curid=179859,7,7,11,13,"Despite his parents ' secular outlook , he was educated at the Silvania Főgimnázium in Zilah ( present - day Silvania National College , Zalău ) and a famous Reformed "" kollegium "" ( grammar school ) in the city of Kolozsvár ( now Cluj - Napoca , Romania ) .","Béla Kohn, later known as Béla Kun, was born on 20 February 1886 in the village of Lele, located near Szilágycseh, Transylvania, Kingdom of Hungary (today part of Hodod, Romania). His father, Samu Kohn was a lapsed Jewish village notary, while his mother, Róza Goldberger, was a Jewish convert to Protestantism. Despite his parents' secular outlook, he was educated at the Silvania Főgimnázium in Zilah (present-day Silvania National College, Zalău) and a famous Reformed ""kollegium"" (grammar school) in the city of Kolozsvár (now Cluj-Napoca, Romania).",https://en.wikipedia.org/wiki?curid=179859
899940,He,Streete Preparatory School,Arnold Cooke,https://en.wikipedia.org/wiki?curid=2523781,0,0,4,6,"He was educated at Streete Preparatory School , Repton School and at Gonville & Caius College , Cambridge , where he read History taking Part 1 of his Tripos in 1927 and gaining his B.A. , but he changed to read music where his composition teacher was E. J. Dent .","Cooke was born at Gomersal, West Riding of Yorkshire into a family of carpet manufacturers. As a child Cooke learned the piano and later the cello and was already composing by the age of 7 or 8. He was educated at Streete Preparatory School, Repton School and at Gonville & Caius College, Cambridge, where he read History taking Part 1 of his Tripos in 1927 and gaining his B.A., but he changed to read music where his composition teacher was E. J. Dent. At Cambridge, Cooke continued to play the cello in the CUMS orchestra and in a string quartet. He was President of the Cambridge Musical Society from 1927 to 1928. In 1929, he gained his Music degree and went to Berlin where he studied composition and piano at the Berlin University of the Arts under Paul Hindemith. He later became Musical Director of the Festival Theatre at Cambridge, and in 1933 was appointed a professor at the Royal Manchester College of Music (now merged into the Royal Northern College of Music). He moved to London in 1938 to further his career.",https://en.wikipedia.org/wiki?curid=2523781
909219,He,Christian Brothers High School,Laurie McGinty,https://en.wikipedia.org/wiki?curid=27933406,0,0,4,7,"He was educated at Christian Brothers High School at Lewisham and St Joseph 's College at Hunters Hill before studying at the University of Sydney , where he received a Bachelor of Laws in 1944 , having worked as an assessor for the Taxation Department from 1939 to 1942 .","McGinty was born in Orange to Laurence Russell Leonard McGinty and Ellen Margaret Elizabeth Magee. He was educated at Christian Brothers High School at Lewisham and St Joseph's College at Hunters Hill before studying at the University of Sydney, where he received a Bachelor of Laws in 1944, having worked as an assessor for the Taxation Department from 1939 to 1942. He enlisted in the army in 1942, shortly afterwards transferring to the Royal Australian Navy, eventually becoming a lieutenant. After his return he was a legal officer with T.S. Skillman and Company from 1947 until 1955, when he was admitted as a solicitor. He was elected to Willoughby Council in 1957 and was Mayor from 1960 to 1967. He was also active in the local Liberal Party.",https://en.wikipedia.org/wiki?curid=27933406
909386,The middle of seven children,Bedford School,George Crichton Wells,https://en.wikipedia.org/wiki?curid=38783715,0,4,9,10,The middle of seven children he was educated at Bedford School before gaining a scholarship to Cambridge .,"George Wells was the son of Sir Richard Wells, 1st Baronet and Mary Dorothy Maltby. The middle of seven children he was educated at Bedford School before gaining a scholarship to Cambridge. At university he excelled at rugby, swimming, diving and rowing.",https://en.wikipedia.org/wiki?curid=38783715
909386,he,Bedford School,George Crichton Wells,https://en.wikipedia.org/wiki?curid=38783715,5,5,9,10,The middle of seven children he was educated at Bedford School before gaining a scholarship to Cambridge .,"George Wells was the son of Sir Richard Wells, 1st Baronet and Mary Dorothy Maltby. The middle of seven children he was educated at Bedford School before gaining a scholarship to Cambridge. At university he excelled at rugby, swimming, diving and rowing.",https://en.wikipedia.org/wiki?curid=38783715
911803,Morrow,common school,James Morrow (Manitoba politician),https://en.wikipedia.org/wiki?curid=2523652,0,0,4,5,"Morrow was educated at common school , and worked as a farmer .","Morrow was born to William Morrow and Nancy Booth, an Irish family in Mille-Isles, Canada East (now Quebec). His father was a member of the 11th Argenteuil Rangers during the Fenian raids of 1866. Morrow was educated at common school, and worked as a farmer. He moved to Manitoba in 1879, and served as councillor and reeve of the Rural Municipality of Louise for ten years. Morrow married Mary A. McDougall in 1883. In religion, he was a Presbyterian.",https://en.wikipedia.org/wiki?curid=2523652
912259,He,Charterhouse School,Ulric Oliver Thynne,https://en.wikipedia.org/wiki?curid=31446489,0,0,4,5,"He was educated at Charterhouse School , Godalming , Surrey , England and at the Royal Military College , Sandhurst , Berkshire , England .","Thynne was born on 6 July 1871. He was the son of Rt. Hon. Lord Henry Frederick Thynne and Lady Ulrica Frederica Jane St. Maur Seymour.  He was educated at Charterhouse School, Godalming, Surrey, England and at the Royal Military College, Sandhurst, Berkshire, England.",https://en.wikipedia.org/wiki?curid=31446489
923493,He,Llandovery College,David Davies (textile merchant),https://en.wikipedia.org/wiki?curid=27343207,0,0,4,5,He was educated at Llandovery College,"David Sanders Davies was the son of John Owen Davies He was educated at Llandovery College In 1886,he married Jane Emily Gee and they made their home at Dolgelly in Merionethshire. They had one daughter who married Lt-Col J E Lewis DSO.",https://en.wikipedia.org/wiki?curid=27343207
928180,He,Winchester College,"John Rolle, 1st Baron Rolle",https://en.wikipedia.org/wiki?curid=5412865,0,0,4,5,"He was educated at Winchester College and Emmanuel College , Cambridge , and became a country gentleman in Devon .","He was educated at Winchester College and Emmanuel College, Cambridge, and became a country gentleman in Devon. He lived at Tidwell, within the family owned manor of East Budleigh on the south Devon coast, certainly between 1786 and 1796. The estate of Tidwell had been purchased by the Walrond family in about 1730, and hence it may have been the property of Rolle's first wife Maria Walrond. This Georgian country house is now a hotel, in the renamed parish of Budleigh Salterton. When his uncle John Rolle Walter died in November 1779, he was put forward to take up his seat in parliament. At this time, the seat of Devon was controlled by a group of large landowners principally in the families of Courtenay of Powderham, Bampfylde of Poltimore and Rolle, who had so many supporters that no other challenge was possible. Due to the prohibitive expense of mounting an opposition, the county had not seen a contested election since 1712. Rolle was duly elected unopposed on 4 January 1780.",https://en.wikipedia.org/wiki?curid=5412865
928394,She,Chapter High School,Kelly Tolhurst,https://en.wikipedia.org/wiki?curid=46643495,0,0,5,7,She was educated locally at Chapter High School .,"Tolhurst was born in Rochester; her father was a local boat builder, Morris Tolhurst. She was educated locally at Chapter High School. From 2008, she ran a marine survey business, called Tolhurst Associates, with her father, with employment in marketing previous to this point.",https://en.wikipedia.org/wiki?curid=46643495
928656,He,Central High School,Robert Yorke Hedges,https://en.wikipedia.org/wiki?curid=53660379,0,0,4,6,"He was educated at Central High School then Victoria University of Manchester and completed his studies with Bachelor of Laws ,","Hedges was born on 6 August 1903. He was educated at Central High School then Victoria University of Manchester and completed his studies with Bachelor of Laws, Between 1926 and 1927, he studied at Harvard then went to Geneva where he obtained Diplôme de Hautes Études Internationales. He also obtained LL.M and LL.D. by Manchester University.",https://en.wikipedia.org/wiki?curid=53660379
931407,He,Swinton Parish School,Charles Tweedie,https://en.wikipedia.org/wiki?curid=59536038,0,0,4,6,He was educated at Swinton Parish School and then George Watson 's College in Edinburgh .,He was educated at Swinton Parish School and then George Watson's College in Edinburgh. He won the Sibbald Scholarship to study mathematics and physics at the University of Edinburgh. Here he was trusted enough by Professor George Chrystal to assist with the editing of Chrystal's textbook on algebra. Tweedie graduated with an MA BSc with honours in 1890. He won the Bruce of Grangehill Bursary which allowed him to undertake postgraduate study at the University of Göttingen 1890/91 and University of Berlin 1891/92.,https://en.wikipedia.org/wiki?curid=59536038
932293,Corregido,the República de Honduras National School,Elena Corregido,https://en.wikipedia.org/wiki?curid=17613382,0,0,4,9,Corregido was educated at the República de Honduras National School and graduated as a chemistry teacher at the Universidad Nacional del Nordeste .,Corregido was educated at the República de Honduras National School and graduated as a chemistry teacher at the Universidad Nacional del Nordeste. She became a teaching assistant and teacher.,https://en.wikipedia.org/wiki?curid=17613382
934845,Henderson,King 's College,Alexander Henderson (priest),https://en.wikipedia.org/wiki?curid=47739635,0,0,4,6,"Henderson was educated at King 's College , Aberdeen and ordained in 1842 .","Henderson was educated at King's College, Aberdeen and ordained in 1842. After a curacy in Leith he spent the rest of his career in Hamilton.",https://en.wikipedia.org/wiki?curid=47739635
938964,He,Eton College,"Sir Herbert Croft, 9th Baronet",https://en.wikipedia.org/wiki?curid=29553575,0,0,4,5,"He was educated at Eton College and at Merton College , Oxford graduating BA in 1860 and MA in 1864 .","Croft was the son of Sir Archer Denman Croft, 8th Baronet and his wife Julia Barbara Corbet, widow of Athelstan Corbet and daughter of General Garstin. He was educated at Eton College and at Merton College, Oxford graduating BA in 1860 and MA in 1864. He was called to the bar at the Inner Temple in 1861 and went the Oxford Circuit. He inherited the baronetcy on the death of his father in 1865.",https://en.wikipedia.org/wiki?curid=29553575
939884,She,New York City,Francine Larrimore,https://en.wikipedia.org/wiki?curid=26022188,0,0,4,6,She was educated in New York City .,"Born in Verdun, France, Larrimore came to the United States when a child. She was educated in New York City. Her parents were J. Louis La Remee and Sarah Adler, a sister of the Yiddish stage star Jacob Adler and not to be confused with Jacob's third wife also named Sara. Jacob's children Stella and Luther are her cousins. Her sister Stella Larrimore (1905–1960) was married to the stage and screen star Robert Warwick.",https://en.wikipedia.org/wiki?curid=26022188
940673,Heap,Oakham School,Tom Heap,https://en.wikipedia.org/wiki?curid=42094086,0,0,4,5,"Heap was educated at Oakham School , a boarding and day independent school in the market town of Oakham in Rutland in central England , where he was trained to abseil by the Lieutenant M.B. Rochester of the Combined Cadet Force ( CCF ) , and won a Bronze Duke of Edinburgh 's Award in 1980 .","Heap was educated at Oakham School, a boarding and day independent school in the market town of Oakham in Rutland in central England, where he was trained to abseil by the Lieutenant M.B. Rochester of the Combined Cadet Force (CCF), and won a Bronze Duke of Edinburgh's Award in 1980.",https://en.wikipedia.org/wiki?curid=42094086
944038,He,astronomy,Thomas Brisbane,https://en.wikipedia.org/wiki?curid=320928,0,0,4,4,He was educated in astronomy and mathematics at the University of Edinburgh .,"Brisbane was born at Brisbane House in Noddsdale, near Largs in Ayrshire, Scotland, the son of Sir Thomas Brisbane and his wife Eleanora. He was educated in astronomy and mathematics at the University of Edinburgh. He joined the British Army's 38th (1st Staffordshire) Regiment of Foot in 1789 and had a distinguished in Flanders, the West Indies, Spain and North America. He served under the Duke of Wellington, and in 1813 he was promoted to major general. He saw much action during the Peninsular War, including leading a brigade in the 3rd Division that broke through at the Battle of Vitoria. He continued as a brigade commander in the War of 1812, where in 1814 he led a brigade at the Battle of Plattsburgh, which Brisbane claimed they could have won if they had been allowed to launch a full infantry attack.",https://en.wikipedia.org/wiki?curid=320928
