sentence_id,Someone,somewhere,title,article_link,Someone_first_index,Someone_last_index,somewhere_first_index,somewhere_last_index,sentence_text,paragraph_text,url
13214,He,University College,Buckston Browne,https://en.wikipedia.org/wiki?curid=4629934,0,0,4,5,He was educated at University College London .,"Browne was born in Manchester, the son of physician Dr. Henry Browne. He was educated at University College London.",https://en.wikipedia.org/wiki?curid=4629934
16128,who,Britain,Margaret Mercer Elphinstone,https://en.wikipedia.org/wiki?curid=39112389,26,26,31,31,"On 20 June 1817 , at Edinburgh , Margaret married Charles Joseph , comte de Flahaut , aide - de - camp to Napoleon Bonaparte , who had been educated in Britain , where he took refuge during the Bourbon Restoration .","On 20 June 1817, at Edinburgh, Margaret married Charles Joseph, comte de Flahaut, aide-de-camp to Napoleon Bonaparte, who had been educated in Britain, where he took refuge during the Bourbon Restoration. The countess held a prominent place in society since her husband held office under Louis-Philippe and later under Napoleon III, and was ambassador at Vienna, and (1860) to the Court of St. James's (London), and finally resided at Paris as Grand Chancellor of the Légion d'honneur. The countess, who was one of the lady patronesses of Almack's and who was a prominent member of polite society, took part in all his social and political work. She was a prolific and perspicacious letter writer, and much of her correspondence is held in the Archives nationales, Paris.",https://en.wikipedia.org/wiki?curid=39112389
21536,she,home,Martha Fowke,https://en.wikipedia.org/wiki?curid=49885276,15,15,19,19,"Born in Hertfordshire on 1 May 1689 to a family of Roman Catholic gentry , she was educated at home and at boarding school .","Martha Fowke, later Martha Sansom, (1 May 1689 – 1736) was an English poet associated chiefly with the circle about Aaron Hill. She was the daughter of Major Thomas Fowke and his wife Mary (née Cullen). Born in Hertfordshire on 1 May 1689 to a family of Roman Catholic gentry, she was educated at home and at boarding school. Her mother was less supportive of her daughter's writing than her father. Fowke lived in London after her mother died in 1705 but moved to East Anglia in 1730 with her husband, Arnold Sansom, whom she had married around 1721. Their marriage was not happy.",https://en.wikipedia.org/wiki?curid=49885276
23728,he,Harbour Grace,George Sweeney (politician),https://en.wikipedia.org/wiki?curid=26018834,4,4,8,9,"Born in Carbonear , he was educated in Harbour Grace and at the Carbonear District Vocational School .","Born in Carbonear, he was educated in Harbour Grace and at the Carbonear District Vocational School. Before entering politics, Sweeney was an electrician and a community college instructor. He served as government whip and was a member of the provincial cabinet, serving as Minister of Government Services and Lands.",https://en.wikipedia.org/wiki?curid=26018834
26499,Bruford,Thorn Park School,Robert Bruford,https://en.wikipedia.org/wiki?curid=31441804,15,15,19,21,"The son of a farmer and Justice of the Peace also named Robert Bruford , Bruford was educated at Thorn Park School in Teignmouth and Fullands School in Taunton , but went to work on the farm and in the brewery business owned by the family at an early age .","The son of a farmer and Justice of the Peace also named Robert Bruford, Bruford was educated at Thorn Park School in Teignmouth and Fullands School in Taunton, but went to work on the farm and in the brewery business owned by the family at an early age. He assumed full control of the business in 1896. At the Bath and West of England Agricultural Show in Newport, Monmouthshire in June 1907, his two-year-old bull 'Pound Bellringer' was reckoned the leader in its class, and he won prizes in other years as well. As with many farms in the area, the family held a farm tenancy rather than owning the land themselves. Bruford became a Director of the Taunton Gas Company Ltd, and of the West Somerset Bacon and Dairy Company Ltd.",https://en.wikipedia.org/wiki?curid=31441804
31052, ,the University of Prague,William Taussig,https://en.wikipedia.org/wiki?curid=31442257,1,1,5,8,"He
 was educated at the University of Prague , and after completing
 the classical course , turned his attention
 to the study of medicine , devoting himself
 chiefly to chemistry .","Taussig was born in the city of Prague, the third city of the Austrian Empire, and the commercial and manufacturing center of Bohemia. He was educated at the University of Prague, and after completing the classical course, turned his attention to the study of medicine, devoting himself chiefly to chemistry. In 1847, he emigrated to the United States, and for a year was employed in New York City as an analytical chemist.",https://en.wikipedia.org/wiki?curid=31442257
31552,She,private teachers,Harriet Williams Russell Strong,https://en.wikipedia.org/wiki?curid=25570052,0,0,4,5,"She was educated by private teachers and at Young Ladies Seminary at Benicia , California .","Harriet Williams Russell was born in Buffalo, New York, fourth daughter of Henry Pierrepont and Mary Guest (Musier) Russell. She was educated by private teachers and at Young Ladies Seminary at Benicia, California.",https://en.wikipedia.org/wiki?curid=25570052
31596,He,Kilkenny College,"Sir Edward Loftus, 1st Baronet",https://en.wikipedia.org/wiki?curid=45351942,0,0,4,5,He was educated at Kilkenny College .,"Loftus was the illegitimate son of Nicholas Loftus, 1st Viscount Loftus by a woman with the surname of Phillips. He was educated at Kilkenny College. Loftus served as the Member of Parliament for Jamestown in the Irish House of Commons between 1761 and 1768. On 16 July 1768, he was created a baronet, of Mount Loftus in the Baronetage of Ireland. He was High Sheriff of Tyrone in 1777 and High Sheriff of Wexford in 1784.",https://en.wikipedia.org/wiki?curid=45351942
32183,He,Shrewsbury School,John Sayer (cricketer),https://en.wikipedia.org/wiki?curid=60238962,0,0,4,5,"He was educated at Shrewsbury School , before enlisting in the Royal Navy as part of the Fleet Air Arm .","Sayer was born at Hong Kong. He was educated at Shrewsbury School, before enlisting in the Royal Navy as part of the Fleet Air Arm. He served during the Second World War in 811 Squadron, flying Fairey Swordfish in mining and torpedo operations against German occupied ports in Belgium, France and the Netherlands. He was based firstly at RNAS Lee-on-Solent, before moving to RAF Thorney Island. He later served aboard in November 1942, from which he flew anti-U-boat missions during the Battle of the Atlantic, with Sayer piloting Vought Chesapeake dive bombers in 1943. Later in 1943, he undertook duties as an air gunnery officer, which lasted until 1945. Shortly after the war, he served aboard in the Mediterranean aboard the light aircraft carrier , flying the Fairey Firefly.",https://en.wikipedia.org/wiki?curid=60238962
33028,He,Eton,"Edward Bridges, 1st Baron Bridges",https://en.wikipedia.org/wiki?curid=3327763,0,0,4,4,"He was educated at Eton and Magdalen College , Oxford .","Bridges was born on 4 August 1892 in Yattendon in Berkshire. He was the son of Robert Bridges, later Poet Laureate, and Mary Monica Waterhouse, daughter of the architect Alfred Waterhouse. He was educated at Eton and Magdalen College, Oxford.",https://en.wikipedia.org/wiki?curid=3327763
34937,He,Cleveland Institute of Music,Dennis Eberhard,https://en.wikipedia.org/wiki?curid=14525754,0,0,4,7,"He was educated at Cleveland Institute of Music , Kent State University , the University of Illinois at Urbana – Champaign and the Chopin Institute in Warsaw , Poland .","He was educated at Cleveland Institute of Music, Kent State University, the University of Illinois at Urbana–Champaign and the Chopin Institute in Warsaw, Poland. His teachers included: Marie Martin, Frederic Coulter, Salvatore Martirano, Wlodzimierz Kotonski, Gordon Momma and Herbert Brün.",https://en.wikipedia.org/wiki?curid=14525754
36984,He,high school,Howard Johnson (lyricist),https://en.wikipedia.org/wiki?curid=539840,0,0,4,5,He was educated in high school and in private music study .,"Songwriter, author and lyricist, Johnson was born in Waterbury, Connecticut, and died in New York, New York. He was educated in high school and in private music study. Johnson was a pianist in Boston theatres, and then a staff writer for a New York publishing company. During World War I, he served in the United States Navy.",https://en.wikipedia.org/wiki?curid=539840
37765,He,Millfield,Christopher Hellings,https://en.wikipedia.org/wiki?curid=61702370,0,0,4,4,"He was educated at Millfield , before going up to Loughborough University to study mechanical engineering .","Hellings was born at Taunton in January 1980. He was educated at Millfield, before going up to Loughborough University to study mechanical engineering. While studying at Loughborough, he made a single first-class appearance for the British Universities cricket team against the touring New Zealanders at Oxford in 1999. Batting twice in the match, he was run out in the British Universities first-innings for 13 runs, while in their second-innings he was dismissed for the same score by Nathan Astle. After graduating from Loughborough, he worked for Credit Suisse, before founding the consultancy company Bailrigg+.",https://en.wikipedia.org/wiki?curid=61702370
37834,He,Felsted School,C. V. Durell,https://en.wikipedia.org/wiki?curid=11908350,0,0,4,5,"He was educated at Felsted School and Clare College , Cambridge ( 1900–1904 ) , where he gained a first class in part two of the mathematics tripos and was seventh wrangler .","A son of John Vavasor Durell (1837–1923), Rector of Fulbourn, Cambridgeshire, and his wife Ellen Annie Carlyon, Durell had four older brothers. He was educated at Felsted School and Clare College, Cambridge (1900–1904), where he gained a first class in part two of the mathematics tripos and was seventh wrangler.",https://en.wikipedia.org/wiki?curid=11908350
43878,Green,Jewish origin,Jonathon Green,https://en.wikipedia.org/wiki?curid=20291259,4,4,1,2,"Of Jewish origin , Green was educated at Bedford School ( 1961–1965 ) and Brasenose College , Oxford ( 1966–1969 ) where he read history .","Of Jewish origin, Green was educated at Bedford School (1961–1965) and Brasenose College, Oxford (1966–1969) where he read history.",https://en.wikipedia.org/wiki?curid=20291259
43878,Green,Bedford School,Jonathon Green,https://en.wikipedia.org/wiki?curid=20291259,4,4,8,9,"Of Jewish origin , Green was educated at Bedford School ( 1961–1965 ) and Brasenose College , Oxford ( 1966–1969 ) where he read history .","Of Jewish origin, Green was educated at Bedford School (1961–1965) and Brasenose College, Oxford (1966–1969) where he read history.",https://en.wikipedia.org/wiki?curid=20291259
48625,he,Laval University,Louis-Alfred-Adhémar Rivet,https://en.wikipedia.org/wiki?curid=12857120,6,6,10,11,"Born in Joliette , Quebec , he was educated at Laval University where he received a B.A and LL.B. He was a practicing lawyer in the law firm of Rivet , Robillard & Tetrault .","Born in Joliette, Quebec, he was educated at Laval University where he received a B.A and LL.B. He was a practicing lawyer in the law firm of Rivet, Robillard & Tetrault. He was elected to the House of Commons of Canada for Hochelaga in a 1904 by-election, after the sitting MP, Joseph Alexandre Camille Madore, appointed Puisne Judge of the Supreme Court of Quebec. A Liberal, he was re-elected in 1904 and 1908. He was defeated in 1911.",https://en.wikipedia.org/wiki?curid=12857120
48625,he,a practicing lawyer,Louis-Alfred-Adhémar Rivet,https://en.wikipedia.org/wiki?curid=12857120,6,6,21,23,"Born in Joliette , Quebec , he was educated at Laval University where he received a B.A and LL.B. He was a practicing lawyer in the law firm of Rivet , Robillard & Tetrault .","Born in Joliette, Quebec, he was educated at Laval University where he received a B.A and LL.B. He was a practicing lawyer in the law firm of Rivet, Robillard & Tetrault. He was elected to the House of Commons of Canada for Hochelaga in a 1904 by-election, after the sitting MP, Joseph Alexandre Camille Madore, appointed Puisne Judge of the Supreme Court of Quebec. A Liberal, he was re-elected in 1904 and 1908. He was defeated in 1911.",https://en.wikipedia.org/wiki?curid=12857120
49911,He,Harrow School,William Wells (1818–1889),https://en.wikipedia.org/wiki?curid=29487886,0,0,4,5,"He was educated at Harrow School and at Balliol College , Oxford , and served in the 1st Life Guards from 1839 until 1843 .","Wells was the son of Captain William Wells, R.N. and his wife Lady Elizabeth Proby, daughter of John Proby, 1st Earl of Carysfort, and grandson of Vice-Admiral Thomas Wells, of Holme, whose father, William, had inherited the estate from his wife's uncle, Thomas Truman, in 1768. He was educated at Harrow School and at Balliol College, Oxford, and served in the 1st Life Guards from 1839 until 1843. In 1826 he inherited Holmewood Hall in Huntingdonshire from his father. He also inherited the Redleaf estate in Kent from his great-uncle William.",https://en.wikipedia.org/wiki?curid=29487886
50688,Titterrell,the Hugh Christie Technology College,Andy Titterrell,https://en.wikipedia.org/wiki?curid=1966433,0,0,4,8,Titterrell was educated at the Hugh Christie Technology College in Tonbridge and Sevenoaks School and started playing rugby union at the age of seven at Sevenoaks which also nurtured England prop David Flatman and Sevens specialist Tony Roques .,Titterrell was educated at the Hugh Christie Technology College in Tonbridge and Sevenoaks School and started playing rugby union at the age of seven at Sevenoaks which also nurtured England prop David Flatman and Sevens specialist Tony Roques.,https://en.wikipedia.org/wiki?curid=1966433
51484,Newcombe,Queens ' College,Richard Newcombe (priest),https://en.wikipedia.org/wiki?curid=53665410,0,0,4,6,"Newcombe was educated at Queens ' College , Cambridge .","Newcombe was educated at Queens' College, Cambridge. He held incumbencies at Llanrhyddlad, Llanfwrog and Clocaenog.",https://en.wikipedia.org/wiki?curid=53665410
53893,He,St. Joseph 's College,Joseph Holt,https://en.wikipedia.org/wiki?curid=1412477,0,0,4,7,"He was educated at St. Joseph 's College in Bardstown , Kentucky and Centre College in Danville , Kentucky .","Joseph Holt was born in Breckinridge County, Kentucky, on January 6, 1807. He was educated at St. Joseph's College in Bardstown, Kentucky and Centre College in Danville, Kentucky. He settled in Elizabethtown, Kentucky, and set up a law office in town. He married Mary Harrison and moved to Louisville, Kentucky, in 1832. There, he became assistant editor of the ""Louisville Public Advertiser"" and the Commonwealth's Attorney from 1833 to 1835. Holt moved to Port Gibson, Mississippi, and practiced law there as well as in Natchez, Mississippi and Vicksburg, Mississippi. Holt and his wife contracted tuberculosis. Mary died of it, and Joseph returned to Louisville to recuperate.",https://en.wikipedia.org/wiki?curid=1412477
59397,He,Leipzig,Emil Friedrich Kautzsch,https://en.wikipedia.org/wiki?curid=8136372,0,0,4,4,"He was educated at Leipzig , in whose theological faculty he was appointed privatdozent ( 1869 ) and professor ( 1871 ) .","He was educated at Leipzig, in whose theological faculty he was appointed privatdozent (1869) and professor (1871). Subsequently he held chairs at Basel (1872–80), where he received an honorary Swiss citizenship and made friends with Friedrich Nietzsche, after which he moved to Tübingen (1880–88) until receiving a professorship at Halle in 1888.",https://en.wikipedia.org/wiki?curid=8136372
60464,He,the University of Notre Dame,Abraham González (governor),https://en.wikipedia.org/wiki?curid=1003172,0,0,4,8,"He was educated at the University of Notre Dame , in Notre Dame , Indiana .","González was born on his family's estates in Basúchil, in Guerrero Municipality, Chihuahua. He was a member of one of the richest and best-educated families in the state (the González family was believed to be descended from European nobility). He was educated at the University of Notre Dame, in Notre Dame, Indiana. His paternal line is from Teocaltiche, Jalisco belonging to the González de Hermosillo y Gómez Rendón family with Y-DNA matches with other González de Hermosillo families of Jalisco.",https://en.wikipedia.org/wiki?curid=1003172
60553,Jin,China University of Geosciences,Jin Yuzhang,https://en.wikipedia.org/wiki?curid=1966405,0,0,4,7,Jin was educated at China University of Geosciences .,"Jin was educated at China University of Geosciences. After graduation he worked at the Qinghai Bureau of Geology and Mineral Resources from 1968 to 1985, before returning to Beijing to work at the Chongwen district Bureau of Environmental Protection.",https://en.wikipedia.org/wiki?curid=1966405
61291,Swift,a Christian Brothers School,John Swift (trade unionist),https://en.wikipedia.org/wiki?curid=53654245,4,4,8,11,"Born in Dundalk , Swift was educated at a Christian Brothers School .","Born in Dundalk, Swift was educated at a Christian Brothers School. His father ran a co-operative bakery but this closed and the family endured poverty. In 1914, Swift began an apprenticeship at a bakery in Dublin, and spent much of his spare time attending meetings where Jim Larkin was speaking. He briefly joined the Irish Volunteers, but took time out following an accident, and decided not to rejoin due to Larkin's opposition to the organisation.",https://en.wikipedia.org/wiki?curid=53654245
65627,Goh,River Valley High School,Goh Meng Seng,https://en.wikipedia.org/wiki?curid=31443632,0,0,4,7,"Goh was educated at River Valley High School and Hwa Chong Junior College , before going on to the National University of Singapore where he completed a Bachelor of Arts and Bachelor of Social Science ( Honours ) in Economics .","Goh was educated at River Valley High School and Hwa Chong Junior College, before going on to the National University of Singapore where he completed a Bachelor of Arts and Bachelor of Social Science (Honours) in Economics.",https://en.wikipedia.org/wiki?curid=31443632
66661,She,Girls School,Minimata Agam Dass Guru,https://en.wikipedia.org/wiki?curid=54683125,0,0,4,5,"She was educated at Girls School , Nawagon and Raipur .","Minimata was born in Nawagaon district in Assam in 1916. She was educated at Girls School, Nawagon and Raipur.",https://en.wikipedia.org/wiki?curid=54683125
66922,William,1719,"William Pitt, 1st Earl of Chatham",https://en.wikipedia.org/wiki?curid=33632,2,2,1,1,From 1719 William was educated at Eton College along with his brother .,"William Pitt was born at Golden Square, Westminster, on 15 November 1708. His older brother Thomas Pitt had been born in 1704. There were also five sisters: Harriet, Catherine, Ann, Elizabeth, and Mary. From 1719 William was educated at Eton College along with his brother. William disliked Eton, later claiming that ""a public school might suit a boy of turbulent disposition but would not do where there was any gentleness"". It was at school that Pitt began to suffer from gout. Governor Pitt died in 1726, and the family estate at Boconnoc passed to William's father. When he died the following year, Boconnoc was inherited by William's elder brother, Thomas Pitt of Boconnoc.",https://en.wikipedia.org/wiki?curid=33632
66922,William,Eton College,"William Pitt, 1st Earl of Chatham",https://en.wikipedia.org/wiki?curid=33632,2,2,6,7,From 1719 William was educated at Eton College along with his brother .,"William Pitt was born at Golden Square, Westminster, on 15 November 1708. His older brother Thomas Pitt had been born in 1704. There were also five sisters: Harriet, Catherine, Ann, Elizabeth, and Mary. From 1719 William was educated at Eton College along with his brother. William disliked Eton, later claiming that ""a public school might suit a boy of turbulent disposition but would not do where there was any gentleness"". It was at school that Pitt began to suffer from gout. Governor Pitt died in 1726, and the family estate at Boconnoc passed to William's father. When he died the following year, Boconnoc was inherited by William's elder brother, Thomas Pitt of Boconnoc.",https://en.wikipedia.org/wiki?curid=33632
66922,William,his brother,"William Pitt, 1st Earl of Chatham",https://en.wikipedia.org/wiki?curid=33632,2,2,10,11,From 1719 William was educated at Eton College along with his brother .,"William Pitt was born at Golden Square, Westminster, on 15 November 1708. His older brother Thomas Pitt had been born in 1704. There were also five sisters: Harriet, Catherine, Ann, Elizabeth, and Mary. From 1719 William was educated at Eton College along with his brother. William disliked Eton, later claiming that ""a public school might suit a boy of turbulent disposition but would not do where there was any gentleness"". It was at school that Pitt began to suffer from gout. Governor Pitt died in 1726, and the family estate at Boconnoc passed to William's father. When he died the following year, Boconnoc was inherited by William's elder brother, Thomas Pitt of Boconnoc.",https://en.wikipedia.org/wiki?curid=33632
68916,Jeffery,Bedford School,Anne Lenner,https://en.wikipedia.org/wiki?curid=24219862,0,0,4,5,"Jeffery was educated at Bedford School but ran away to join the Ice Follies , which came through town when he was in the 6th Form .","Lenner married a dance producer by the name of Piddock, whom she met while appearing in a review produced by him. They had one son Jeffrey, who went into show business under the name of Jeffrey Lenner. Jeffery was educated at Bedford School but ran away to join the Ice Follies, which came through town when he was in the 6th Form. Jeffrey found it difficult to obtain work after his return from Australia, where he had hosted his own television programme, and he was never able to emulate the success of his mother.",https://en.wikipedia.org/wiki?curid=24219862
70103,August Torma,St. Petersburg University,August Torma,https://en.wikipedia.org/wiki?curid=29488704,0,1,5,7,"August Torma was educated at St. Petersburg University , then attended Vladimir Military Academy .","August Torma was educated at St. Petersburg University, then attended Vladimir Military Academy.",https://en.wikipedia.org/wiki?curid=29488704
71071,He,Glasgow Academy,George Matheson,https://en.wikipedia.org/wiki?curid=2718052,0,0,4,5,"He was educated at Glasgow Academy and the University of Glasgow , where he graduated first in classics , logic and philosophy .","He was educated at Glasgow Academy and the University of Glasgow, where he graduated first in classics, logic and philosophy. In his twentieth year he became totally blind, but he held to his resolve to enter the ministry, and gave himself to theological and historical study. In 1879 the University of Edinburgh conferred upon him the honorary degree of D.D.. In 1890, he became a fellow of the Royal Society of Edinburgh, upon the proposal of Sir William Thomson, Robert Flint, Hugh Macmillan and James Lindsay.",https://en.wikipedia.org/wiki?curid=2718052
74454,He,Heywood Grammar School,Lister Tonge,https://en.wikipedia.org/wiki?curid=46212639,0,0,4,6,"He was educated at Heywood Grammar School , Salford Grammar School , King 's College London and Loyola University Chicago .","Tonge was born on 23 December 1951 in Oldham, Lancashire, England. He was educated at Heywood Grammar School, Salford Grammar School, King's College London and Loyola University Chicago. He is the second child of Edward Tonge and Dorothy Tonge (née Clough).",https://en.wikipedia.org/wiki?curid=46212639
84434,Goodhart,the Hotchkiss School,Arthur Lehman Goodhart,https://en.wikipedia.org/wiki?curid=1032821,0,0,4,6,"Goodhart was educated at the Hotchkiss School , Yale University and Trinity College , Cambridge .","Arthur Goodhart was born to a Jewish family in New York City, the youngest of three children born to Harriet ""Hattie"" (née Lehman) and Philip Julius Goodhart. His siblings were Howard Goodhart and Helen Goodhart Altschul (married to Frank Altschul). His maternal grandfather was Mayer Lehman, one of three brothers who co-founded the investment banking firm Lehman Brothers. Goodhart was educated at the Hotchkiss School, Yale University and Trinity College, Cambridge. At Yale, he was an editor of campus humor magazine ""The Yale Record"". After returning to the United States, he practised law until World War I. Following the war, he started to pursue an academic career in law, initially at Cambridge University and later at Oxford University where he became Professor of Jurisprudence and subsequently the Master of University College. He was editor of the ""Law Quarterly Review"" for fifty years.",https://en.wikipedia.org/wiki?curid=1032821
85915,Denny,St Mary Hall,Henry Berners,https://en.wikipedia.org/wiki?curid=53665931,0,0,4,6,"Denny was educated at St Mary Hall , Oxford .","Denny was educated at St Mary Hall, Oxford. He was Rector of Erwarton from 1801 to 1835.",https://en.wikipedia.org/wiki?curid=53665931
