sentence_id,Someone,somewhere,title,article_link,Someone_first_index,Someone_last_index,somewhere_first_index,somewhere_last_index,sentence_text,paragraph_text,url
556184,He,Merchant Taylors,P. P. Hutchins,https://en.wikipedia.org/wiki?curid=31442197,0,0,4,5,He was educated at Merchant Taylors ' and Haileybury .,"Hutchins was born on 28 January 1838 to William Hutchins. He was educated at Merchant Taylors' and Haileybury. In 1857, Hutchins entered the Indian civil service. Hutchins also studied law and qualified for the bar in 1875.",https://en.wikipedia.org/wiki?curid=31442197
556204,Dossor,Seaford College,Lance Dossor,https://en.wikipedia.org/wiki?curid=3327789,0,0,4,5,Dossor was educated at Seaford College and matriculated at the University of London .,"Harry Lancelot Dossor was born on 14 May 1916 in Weston-super-Mare, United Kingdom, the third child of a jeweller who was also a distinguished amateur tenor. Dossor was educated at Seaford College and matriculated at the University of London. In 1932 he obtained an open scholarship to the Royal College of Music, where he studied piano with Herbert Fryer and composition with Herbert Howells.",https://en.wikipedia.org/wiki?curid=3327789
557031,Ota,at,"Keisuke Ota (footballer, born 1979)",https://en.wikipedia.org/wiki?curid=11908618,0,0,3,3,Ota was educated at and played for Shimizu Commercial High School and Fukuoka University .,Ota was educated at and played for Shimizu Commercial High School and Fukuoka University.,https://en.wikipedia.org/wiki?curid=11908618
557424,Houri,Paris,Cyril Houri,https://en.wikipedia.org/wiki?curid=12558725,0,0,4,4,"Houri was educated in Paris before graduating with an MS degree in both engineering and computer science from the National Polytechnic Institute of Toulouse , France in 1992 .","Houri was educated in Paris before graduating with an MS degree in both engineering and computer science from the National Polytechnic Institute of Toulouse, France in 1992. He moved to New York City in 1996 to take a job designing financial software. In 1999, Houri founded InfoSplit Inc., a pioneer in IP geolocation, which identifies the geographic location of an Internet user. Houri designed and patented some of the technology that is now commonly used to geolocate website visitors. Houri’s patent is now co-owned by Microsoft and Quova.",https://en.wikipedia.org/wiki?curid=12558725
562080,John Mortimer,the Dragon School,John Mortimer,https://en.wikipedia.org/wiki?curid=171182,0,1,5,7,"John Mortimer was educated at the Dragon School in Oxford and Harrow School , where he joined the Communist Party , forming a one - member cell .","John Mortimer was educated at the Dragon School in Oxford and Harrow School, where he joined the Communist Party, forming a one-member cell. Originally Mortimer intended to be an actor (his lead role in the Dragon's 1937 production of ""Richard II"" gained glowing reviews in ""The Draconian"") and then a writer, but his father persuaded him against it, advising: ""My dear boy, have some consideration for your unfortunate wife... [the law] gets you out of the house.""",https://en.wikipedia.org/wiki?curid=171182
566977,She,her father 's school,Anna Lloyd,https://en.wikipedia.org/wiki?curid=52929160,0,0,4,7,She was educated at her father 's school .,Lloyd was born near Stroud in 1837. Her father was Benjamin Parsons who founded and led schools. She was educated at her father's school. She married Thomas Lloyd who took over her father's parish when he retired.,https://en.wikipedia.org/wiki?curid=52929160
567967,He,military science,"James Shields (politician, born 1806)",https://en.wikipedia.org/wiki?curid=256134,0,0,4,5,"He was educated in military science , fencing , and the French language by a veteran of the Napoleonic Wars , of which there were many in Ireland at the time .","The younger Shields obtained early schooling at a hedge school near his home, later at a school run by a clergyman from Maynooth College, and subsequently his uncle. He was educated in military science, fencing, and the French language by a veteran of the Napoleonic Wars, of which there were many in Ireland at the time. Shields attempted to emigrate to the United States in 1822, but failed when his ship was driven aground off the coast of Scotland, leaving him one of only either three or four survivors. He successfully made it to America around 1826, although his uncle whom he had sailed to meet had died.",https://en.wikipedia.org/wiki?curid=256134
567967,He,a veteran of the Napoleonic Wars,"James Shields (politician, born 1806)",https://en.wikipedia.org/wiki?curid=256134,0,0,14,19,"He was educated in military science , fencing , and the French language by a veteran of the Napoleonic Wars , of which there were many in Ireland at the time .","The younger Shields obtained early schooling at a hedge school near his home, later at a school run by a clergyman from Maynooth College, and subsequently his uncle. He was educated in military science, fencing, and the French language by a veteran of the Napoleonic Wars, of which there were many in Ireland at the time. Shields attempted to emigrate to the United States in 1822, but failed when his ship was driven aground off the coast of Scotland, leaving him one of only either three or four survivors. He successfully made it to America around 1826, although his uncle whom he had sailed to meet had died.",https://en.wikipedia.org/wiki?curid=256134
570900,she,Talbot Heath School,Philippa Glanville,https://en.wikipedia.org/wiki?curid=49885416,15,15,19,21,"The daughter of the Rev. Wilfred Henry Fox - Robinson and Jane Mary Home , she was educated at Talbot Heath School , Bournemouth , before going up to Girton College , Cambridge , where she read History , and taking a degree in Archives Administration at University College , London .","The daughter of the Rev. Wilfred Henry Fox-Robinson and Jane Mary Home, she was educated at Talbot Heath School, Bournemouth, before going up to Girton College, Cambridge, where she read History, and taking a degree in Archives Administration at University College, London. While at Cambridge she took part in the archaeological excavations at Winchester conducted by Martin Biddle, later Professor of Medieval Archaeology at Oxford.",https://en.wikipedia.org/wiki?curid=49885416
573535,Shi,Tamkang University,Shi Shuqing,https://en.wikipedia.org/wiki?curid=46214331,0,0,4,5,Shi was educated at Tamkang University and City University of New York .,"She was born in Lukang, Changhua and is the sister of writer Li Ang. Shi was educated at Tamkang University and City University of New York. She taught at Taipei's National Chengchi University. In 1978, Shi moved to Hong Kong where she became director of Asian programs at the Hong Kong Arts Centre, later working as a consultant there. She returned to Taiwan in 1997.",https://en.wikipedia.org/wiki?curid=46214331
582446,He,Woodstock College,Walter Humphries Montague,https://en.wikipedia.org/wiki?curid=2523402,0,0,4,5,"He was educated at Woodstock College and the Toronto School of Medicine , and received a medical degree from Victoria University in 1882 .","Montague was born in Adelaide, in Middlesex County, Canada West (now Ontario), the son of Joseph Montague. He was educated at Woodstock College and the Toronto School of Medicine, and received a medical degree from Victoria University in 1882. He practised medicine in Dunnville, Ontario and later at the General Hospital in Hamilton. He married Angie Furey. Montague was a member of the College of Physicians and Surgeons of Ontario, and a licentiate of the Royal College of Physicians in Edinburgh, Scotland.",https://en.wikipedia.org/wiki?curid=2523402
590037,Palomino,Central Saint Martins,Elisa Palomino,https://en.wikipedia.org/wiki?curid=53659970,0,0,4,6,Palomino was educated at Central Saint Martins [ http://1granary.com/interviews/elisa-palomino/ < nowiki>[4]</nowiki>](Postgraduate Textiles 1990 ),"Palomino was educated at Central Saint Martins [http://1granary.com/interviews/elisa-palomino/ <nowiki>[4]</nowiki>](Postgraduate Textiles 1990) (MA Fashion-Textiles, 1992)",https://en.wikipedia.org/wiki?curid=53659970
590037,Palomino,Textiles,Elisa Palomino,https://en.wikipedia.org/wiki?curid=53659970,0,0,11,11,Palomino was educated at Central Saint Martins [ http://1granary.com/interviews/elisa-palomino/ < nowiki>[4]</nowiki>](Postgraduate Textiles 1990 ),"Palomino was educated at Central Saint Martins [http://1granary.com/interviews/elisa-palomino/ <nowiki>[4]</nowiki>](Postgraduate Textiles 1990) (MA Fashion-Textiles, 1992)",https://en.wikipedia.org/wiki?curid=53659970
592054,He,Manchester,Louis Calvert,https://en.wikipedia.org/wiki?curid=31446172,0,0,5,5,He was educated privately in Manchester and in Germany .,"Calvert was born in Manchester, Lancashire one of eight children, and the third son, of the actors Charles Alexander Calvert and his wife Adelaide Calvert (baptised April 1836 - died 20 September 1921). He was educated privately in Manchester and in Germany. Although actively discouraged by his parents from taking up acting as a career, Louis Calvert made his theatrical debut in Natal in South Africa in 1878 before moving on to appear in Australia and then returning to Great Britain in 1880. During the 1880s he trained at Sarah Thorne's School of Acting at Margate, Kent, and went on to appear with Henry Irving at the Lyceum Theatre in London and toured with Lillie Langtry in the United States.",https://en.wikipedia.org/wiki?curid=31446172
594166,Leitch,correspondence,David Leitch (politician),https://en.wikipedia.org/wiki?curid=27933194,0,0,4,4,Leitch was educated by correspondence from All Saints College in Bathurst .,"Leitch was born in Leeton; his maternal grandfather was William Killen, a member of the Australian House of Representatives from 1922 to 1931. Leitch was educated by correspondence from All Saints College in Bathurst. He studied medicine at the University of Sydney and was subsequently appointed an honorary surgeon to the Armidale and New England Hospital. In 1942 he enlisted in the AIF; he was posted to New Guinea, where he fought the Japanese at Shaggy Ridge. After his return he returned to his medical practice.",https://en.wikipedia.org/wiki?curid=27933194
594166,Leitch,All Saints College,David Leitch (politician),https://en.wikipedia.org/wiki?curid=27933194,0,0,6,8,Leitch was educated by correspondence from All Saints College in Bathurst .,"Leitch was born in Leeton; his maternal grandfather was William Killen, a member of the Australian House of Representatives from 1922 to 1931. Leitch was educated by correspondence from All Saints College in Bathurst. He studied medicine at the University of Sydney and was subsequently appointed an honorary surgeon to the Armidale and New England Hospital. In 1942 he enlisted in the AIF; he was posted to New Guinea, where he fought the Japanese at Shaggy Ridge. After his return he returned to his medical practice.",https://en.wikipedia.org/wiki?curid=27933194
597000,He,the Whitgift School,Alastair Lyons,https://en.wikipedia.org/wiki?curid=54687683,0,0,4,6,"He was educated at the Whitgift School , and he graduated from Trinity College , Cambridge , where he earned an MA in Economics .","Alastair Lyons was born on 18 October 1953. He was educated at the Whitgift School, and he graduated from Trinity College, Cambridge, where he earned an MA in Economics.",https://en.wikipedia.org/wiki?curid=54687683
597246,He,Cumberland University,Cale Young Rice,https://en.wikipedia.org/wiki?curid=5412826,0,0,4,5,"He was educated at Cumberland University where he was a member of the Theta chapter of Kappa Sigma Fraternity and at Harvard ( A.B. , 1895 ; A.M. , 1896 ) .","He was born in Dixon, Kentucky, to Laban Marchbanks Rice, a Confederate veteran and tobacco merchant, and his wife Martha Lacy. He was a younger brother of Laban Lacy Rice, a noted educator. Cale Rice grew up in Evansville, Indiana, and Louisville, Kentucky. He was educated at Cumberland University where he was a member of the Theta chapter of Kappa Sigma Fraternity and at Harvard (A.B., 1895; A.M., 1896).",https://en.wikipedia.org/wiki?curid=5412826
598174,he,Sherborne,Alfred Wyndham,https://en.wikipedia.org/wiki?curid=60202473,23,23,27,27,"Following his great - uncle Dr Thomas Wyndham ( clergyman ) and other members of the Wyndham family since the 17th century , he was educated at Sherborne in the Dorset town of that name .","Alfred Wyndham was the second son of Captain Alexander Wadham Wyndham (d1869) and Emma (née Trevelyan) of West Lodge, Blandford in Dorset. His mother, an accomplished artist, was the daughter of Sir John Trevelyan Bt of Nettlecombe, Somerset. Following his great-uncle Dr Thomas Wyndham (clergyman) and other members of the Wyndham family since the 17th century, he was educated at Sherborne in the Dorset town of that name.",https://en.wikipedia.org/wiki?curid=60202473
598211,Most of the boys were educated,England,Alfred Wyndham,https://en.wikipedia.org/wiki?curid=60202473,0,5,7,7,Most of the boys were educated in England and continued to farm and keep a hand in military service like their father .,"Colonel and Mrs Wyndham had eleven children, Alexander (b. 1860), Agnes Stuart (b. 1862), Walter Trevelyan (b. 1864), Emma Ethel (b. 1866), Ernest Alfred (b. 1868), Spencer (b. 1869), Charles Wadham (b. 1872), Beatrice Ida Wyndham (b. 1874), Julia (b. 1876), Mary Sophia (b. 1878), and John Stuart (b. 1880). Most of the boys were educated in England and continued to farm and keep a hand in military service like their father.",https://en.wikipedia.org/wiki?curid=60202473
598329,Furber,Manchester Grammar School,Steve Furber,https://en.wikipedia.org/wiki?curid=529373,0,0,4,6,Furber was educated at Manchester Grammar School and represented the UK in the International Mathematical Olympiad in Hungary in 1970 winning a bronze medal .,"Furber was educated at Manchester Grammar School and represented the UK in the International Mathematical Olympiad in Hungary in 1970 winning a bronze medal. He went on to study the Mathematical Tripos as an undergraduate student of St John's College, Cambridge, receiving a Bachelor of Arts (BA) and Master of Mathematics (MMath - Part III of the Mathematical Tripos) degrees. In 1978, he was appointed a Rolls-Royce research fellow in aerodynamics at Emmanuel College, Cambridge and was awarded a PhD in 1980 for research on the fluid dynamics of the Weis-Fogh principle supervised by John Ffowcs Williams.",https://en.wikipedia.org/wiki?curid=529373
598429,many people of this village,Graduates,Bakulari,https://en.wikipedia.org/wiki?curid=51494495,4,8,13,13,"Addition to this , many people of this village are well educated like Graduates and Post - Graduates in Arts , Engineering , Literature and Science .","Bakulari village is good in terms of education. As of 2011 census of India, Bakulari village has higher literacy rate compared to Bihar. In 2011, literacy rate of this village was 71.87% compared to 61.80% of Bihar. The male literacy stands at 81.20% while female literacy rate was 63.38%. This village has a very old and famous school of Guthani Block namely ""राजकीय मध्य विद्यालय - बकुलारी (Govt. Middle School - Bakulari)"", which was founded in 1951, but this school is now upgraded from Middle School (up to 8th standard) to Secondary School Certificate (up to 10th standard). Now this school provides for Secondary Education to the students not only of this village but also of its various neighbouring villages. Addition to this, many people of this village are well educated like Graduates and Post-Graduates in Arts, Engineering, Literature and Science. There is also a Post Office with PIN Code 841239.",https://en.wikipedia.org/wiki?curid=51494495
601887,He,King 's College,Derek Steward,https://en.wikipedia.org/wiki?curid=24220957,0,0,4,6,He was educated at King 's College in Auckland .,"Born on Onehunga on 9 October 1928, Steward was the son of Albert de Bolton Peel Steward and Doris Steward (née Pilcher) of Paeroa. He was educated at King's College in Auckland.",https://en.wikipedia.org/wiki?curid=24220957
604267,De Saram,the Royal College,John De Saram,https://en.wikipedia.org/wiki?curid=31445586,15,16,20,22,"Born in Colombo to a family of lawyers , of Dutch and Malay ancestry , De Saram was educated at the Royal College , Colombo from where he entered the newly established Law Faculty of the University of Ceylon in 1949 and graduated with an LLB shortly he took oaths as an advocate of the Supreme Court of Ceylon .","Born in Colombo to a family of lawyers, of Dutch and Malay ancestry, De Saram was educated at the Royal College, Colombo from where he entered the newly established Law Faculty of the University of Ceylon in 1949 and graduated with an LLB shortly he took oaths as an advocate of the Supreme Court of Ceylon. Later he attended Yale Law School as a Smith-mundt Scholar and was admitted as a Barrister in the Inner Temple.",https://en.wikipedia.org/wiki?curid=31445586
606322,He,King 's College,John Percy Bayly,https://en.wikipedia.org/wiki?curid=59534629,0,0,4,6,"He was educated at King 's College in Auckland , before returning to Fiji to work for HM Customs .","Bayly was born in Levuka in 1882. He was educated at King's College in Auckland, before returning to Fiji to work for HM Customs. He resigned from HM Customs at the age of 18 when a policy for £1,000 taken out by his father matured, starting a business as a land agent, mostly buying land for cattle farms, and settled in Deuba. He started several new projects, including introducing rubber trees.",https://en.wikipedia.org/wiki?curid=59534629
606886,He,Renfrew 's St James ' Primary,Gavin Newlands,https://en.wikipedia.org/wiki?curid=46642355,0,0,4,9,He was educated at Renfrew 's St James ' Primary and Trinity High School .,"Newlands was born in the old Paisley Maternity Hospital in 1980 and raised in the town of Renfrew, where he currently resides with wife, Lynn and their two children. He was educated at Renfrew's St James' Primary and Trinity High School. While enrolled at James Watt College, Newlands was offered a promotion in his part-time job at McDonalds, and dropped out of college.",https://en.wikipedia.org/wiki?curid=46642355
608405,Macgregor,the Guildford School of Art,Miriam Macgregor,https://en.wikipedia.org/wiki?curid=60202481,6,6,10,14,"Born in Shillong , Assam , Macgregor was educated at the Guildford School of Art .","Miriam Macgregor (born 1935) is a British author, illustrator, wood engraver, and fine press compositor. Born in Shillong, Assam, Macgregor was educated at the Guildford School of Art. She began her professional career in the art department of the publisher B. T. Batsford, before becoming a freelance artist. In 1977, she began to work for the fine press publisher, Whittington Press. At the time, all type was set by hand. She still works at the Whittington Press as a compositor and illustrator. She has created images for other fine press publishers, including the Folio Society and Primrose Hill Press. Macgregor is a self-taught wood engraver and member of the Society of Wood Engravers and Royal Society of Painter-Printmakers. She has furnished wood engravings for the horticultural journal, ""Hortus"", in addition to countless wood engravings and pochoir illustrations for books and posters published by the Whittington Press. In addition to the texts she has illustrated, her subjects primarily concern English rural life, farming, architecture, botany, and felines. Macgregor has published several collections of her own images, and curated a collection of contemporary wood engravings of cats, published by Primrose Hill Press in 1999 as ""Cat cuts"".",https://en.wikipedia.org/wiki?curid=60202481
608970,Goldie,Wolverhampton Grammar School,Alfred Goldie,https://en.wikipedia.org/wiki?curid=20962143,0,0,4,6,"Goldie was educated at Wolverhampton Grammar School and then read mathematics at St John 's College , Cambridge .","Goldie was educated at Wolverhampton Grammar School and then read mathematics at St John's College, Cambridge. His studies were interrupted by war work on ballistics with the Armament Research Department of the Ministry of Supply, eventually taking his BA in 1942 and MA in 1946.",https://en.wikipedia.org/wiki?curid=20962143
610280,The son of the rector of Brisley,Rugby School,Edward Ash,https://en.wikipedia.org/wiki?curid=53659839,0,6,13,14,"The son of the rector of Brisley , Edward Ash was educated at Rugby School and at Gonville and Caius College , Cambridge .","The son of the rector of Brisley, Edward Ash was educated at Rugby School and at Gonville and Caius College, Cambridge. Having played cricket at Rugby, he appeared in matches for Cambridge University only in his final year at the university, when he was awarded his Blue by playing in the 1865 University Match against Oxford University. A right-handed middle-order batsman, Ash made scores of 18 and 8 in that game, which Cambridge lost. Earlier in the same 1865 cricket season, Ash's best first-class match had been his first one: he scored 47 (out of a total innings of 98) and 17 in the game against Cambridgeshire. He played no further first-class cricket after the University Match.",https://en.wikipedia.org/wiki?curid=53659839
610302,He,George Heriot 's School,W. F. P. McLintock,https://en.wikipedia.org/wiki?curid=54687275,0,0,4,7,"He was educated at George Heriot 's School then studied science at the University of Edinburgh , graduating with a BSc in 1907 .","He was born on 2 February 1887 the son of Peter Buchanan McLintock, a laundry owner at Deanbank in Stockbridge, Edinburgh. He was educated at George Heriot's School then studied science at the University of Edinburgh, graduating with a BSc in 1907. After University immediately started work as a geologist with HM Geological Survey under Ben Peach and John Horne. In 1911 he became Curator of the Geological Specimens at the Royal Scottish Museum. In 1921 he moved to London to the Natural History Museum. In 1930 he was involved in the relocation of the museum from Jermyn Street to South Kensington.",https://en.wikipedia.org/wiki?curid=54687275
611871,he,the military arts,Ordoño I of Asturias,https://en.wikipedia.org/wiki?curid=179850,1,1,7,9,"There he was educated , including in the military arts .","He was born in Oviedo, where he spent his early life in the court of Alfonso II. He was probably associated with the crown from an early age. He was probably raised in Lugo, capital of the province of Galicia, of which his father, Ramiro, had been named governor. There he was educated, including in the military arts.",https://en.wikipedia.org/wiki?curid=179850
612714,He,the state grammar Reading School,David Warburton,https://en.wikipedia.org/wiki?curid=46642827,0,0,4,8,"He was educated at the state grammar Reading School , and the co - educational comprehensive secondary , Waingels College .","Warburton was born on 28 October 1965 in Burnham, Lincolnshire. He was educated at the state grammar Reading School, and the co-educational comprehensive secondary, Waingels College.",https://en.wikipedia.org/wiki?curid=46642827
612714,He,"the co - educational comprehensive secondary , Waingels College",David Warburton,https://en.wikipedia.org/wiki?curid=46642827,0,0,11,19,"He was educated at the state grammar Reading School , and the co - educational comprehensive secondary , Waingels College .","Warburton was born on 28 October 1965 in Burnham, Lincolnshire. He was educated at the state grammar Reading School, and the co-educational comprehensive secondary, Waingels College.",https://en.wikipedia.org/wiki?curid=46642827
615068,a group of young children,a small Korean town,Revenge (1989 film),https://en.wikipedia.org/wiki?curid=23940845,8,12,1,4,"In a small Korean town in 1915 , a group of young children are educated in a barn by a strict instructor , Yan .","In a small Korean town in 1915, a group of young children are educated in a barn by a strict instructor, Yan. Losing his patience with the children, he takes his anger out on a young girl, scaring her into a corner of the barn and using a scythe to murder her. After realizing his error, Yan goes into hiding. News of the girl’s murder reaches her parents and the girl’s father, Tsai, vows revenge.",https://en.wikipedia.org/wiki?curid=23940845
615068,a group of young children,1915,Revenge (1989 film),https://en.wikipedia.org/wiki?curid=23940845,8,12,6,6,"In a small Korean town in 1915 , a group of young children are educated in a barn by a strict instructor , Yan .","In a small Korean town in 1915, a group of young children are educated in a barn by a strict instructor, Yan. Losing his patience with the children, he takes his anger out on a young girl, scaring her into a corner of the barn and using a scythe to murder her. After realizing his error, Yan goes into hiding. News of the girl’s murder reaches her parents and the girl’s father, Tsai, vows revenge.",https://en.wikipedia.org/wiki?curid=23940845
615068,a group of young children,a barn,Revenge (1989 film),https://en.wikipedia.org/wiki?curid=23940845,8,12,16,17,"In a small Korean town in 1915 , a group of young children are educated in a barn by a strict instructor , Yan .","In a small Korean town in 1915, a group of young children are educated in a barn by a strict instructor, Yan. Losing his patience with the children, he takes his anger out on a young girl, scaring her into a corner of the barn and using a scythe to murder her. After realizing his error, Yan goes into hiding. News of the girl’s murder reaches her parents and the girl’s father, Tsai, vows revenge.",https://en.wikipedia.org/wiki?curid=23940845
