sentence_id,Someone,somewhere,title,article_link,Someone_first_index,Someone_last_index,somewhere_first_index,somewhere_last_index,sentence_text,paragraph_text,url
327565,He,the University of Otago,Tim Jones (writer),https://en.wikipedia.org/wiki?curid=12557082,0,0,4,7,"He was educated at the University of Otago in Dunedin , and has lived in Wellington since 1993 .","Born in Cleethorpes, near Grimsby, England, Jones moved to Southland, New Zealand at a young age. He was educated at the University of Otago in Dunedin, and has lived in Wellington since 1993.",https://en.wikipedia.org/wiki?curid=12557082
336991,William Lewis,the University of Colorado,William Lewis (tenor),https://en.wikipedia.org/wiki?curid=20288459,0,1,5,8,"William Lewis was educated at the University of Colorado , Texas Christian University and New York University .","William Lewis was educated at the University of Colorado, Texas Christian University and New York University. He began his career as a writer and an athlete before deciding to pursue a career in opera. He began his voice training under Karl Kritz and Arthur Faguy Coté in Fort Worth, followed by studies with Susan Seton and Hulda and Luigi Rossini in New York. In the summer of 1951 he attended the Music Academy of the West. He made his professional opera debut in 1953 with Fort Worth Opera as Rinuccio in Puccini's ""Gianni Schicchi"". Two years later he won the Metropolitan Opera's ""Audition of the Air"" competition (precursor to the National Council Auditions). Lewis made his debut at the Metropolitan Opera as Narraboth in ""Salome"" on March 1, 1958 and subsequently sang in 234 performances in his 35 years with the company. In 1975 he made his debut at San Francisco Opera as Steuermann and Erik in ""The Flying Dutchman"" and has sung in sixteen different productions with the company in subsequent seasons. In 1981 he made his debut at the Salzburg Festival in the title role of Offenbach's ""The Tales of Hoffmann"", returning there for the following four years in such roles as Arbace in ""Idomeneo"" and the First Geharnischter in ""The Magic Flute"". In 1990 he made his debut at the Teatro Lirico in the world premiere of Azio Corghi's ""Blimunda"".",https://en.wikipedia.org/wiki?curid=20288459
337537,Charles,the local schools of Marion and Linn counties,Charles A. Johns,https://en.wikipedia.org/wiki?curid=12061766,0,0,5,12,Charles was then educated in the local schools of Marion and Linn counties .,"Charles Johns was born to James McClellan Johns and Elizabeth Ann Darby Johns in Jackson County, Missouri. In 1858, the family immigrated to the Oregon Territory and settled in the Willamette Valley. Charles was then educated in the local schools of Marion and Linn counties. For college he attended Willamette University in Salem, where he graduated in 1878 with his Bachelor of Arts. He was admitted to the bar in 1881. The following year Johns married Mabel Ellis with whom he fathered three children. He would also have three children by his second wife Elizabeth Busch.",https://en.wikipedia.org/wiki?curid=12061766
338265,He,Yale University,Edwin Arthur Burtt,https://en.wikipedia.org/wiki?curid=2362767,0,0,4,5,He was educated at Yale University .,"He was born on October 11, 1892 in Groton, Massachusetts. His missionary parents took Burtt to China for several of his teenage years. He was educated at Yale University. He graduated from Yale in 1915, where he was a member of Skull and Bones. He attended Union Theological Seminary and Columbia University. He became the Susan Linn Sage Professor of Philosophy at Cornell University in 1941.",https://en.wikipedia.org/wiki?curid=2362767
348417,who,the Burgundian court,Court music in Scotland,https://en.wikipedia.org/wiki?curid=42183672,7,7,12,14,"His marriage to Mary of Guelders , who had been educated in the Burgundian court , meant that she brought the latest ideas of music to the Scottish court .","The captivity of James I in England from 1406 to 1423, where he earned a reputation as a poet and composer, may have led him to take English and continental styles and musicians back to the Scottish court on his release. Walter Bower, abbot of Inchcolm praised him as ""another Orpheus"", including mastery of the organ, drum, flute and lyre. James II also demonstrated some musical ability. His marriage to Mary of Guelders, who had been educated in the Burgundian court, meant that she brought the latest ideas of music to the Scottish court.",https://en.wikipedia.org/wiki?curid=42183672
348505,She,Collegiate Girls ' High School,Désirée Talbot,https://en.wikipedia.org/wiki?curid=15751837,0,0,4,8,She was educated at Collegiate Girls ' High School in Port Elizabeth and afterwards at Rustenburg Girls High in Cape Town .,She was educated at Collegiate Girls' High School in Port Elizabeth and afterwards at Rustenburg Girls High in Cape Town. Her father was a civil engineer and an amateur organist and pianist. Her mother was also musical and took piano lessons with Doris Lardner at the South African College of Music in Cape Town.,https://en.wikipedia.org/wiki?curid=15751837
348665,Sterling,Trinity College,Paul Ivy Sterling,https://en.wikipedia.org/wiki?curid=39596193,0,0,4,5,"Sterling was educated at Trinity College , Dublin .","Sterling was educated at Trinity College, Dublin. He entered King's Inn, Dublin and Gray's Inn in London. He was called to the Irish Bar, Michaelmas Term, 1829.",https://en.wikipedia.org/wiki?curid=39596193
350277,he,England,William Beckford of Somerley,https://en.wikipedia.org/wiki?curid=9630987,12,12,16,16,"Born into a very prominent and wealthy slave - holding family , he was educated in England , lost his father at the age of 10 , and rounded off his gentleman 's upbringing through Westminster School and Oxford University with a Grand Tour .","Born into a very prominent and wealthy slave-holding family, he was educated in England, lost his father at the age of 10, and rounded off his gentleman's upbringing through Westminster School and Oxford University with a Grand Tour. He inherited his estates around Hertford in western Jamaica around 1765 at the age of 21. In a different mould from his colonial ancestors, he was a cultivated and personally sensitive man who, after he married and went to live in Jamaica in 1774 to supervise his affairs personally, became preoccupied with the welfare and conditions of the African workers in his estates, deplored their mistreatment and hardships and sought to deal with them humanely.",https://en.wikipedia.org/wiki?curid=9630987
357736,he,his aunt,Vespasiano I Gonzaga,https://en.wikipedia.org/wiki?curid=20796989,3,3,7,8,"Soon orphaned , he was educated under his aunt Giulia Gonzaga , who had moved to Naples to escape attempts from other members of the Colonna family to kill Vespasiano in order to obtain the fiefs he had inherited from his mother .","He was born in Fondi, a Colonna fief in the southern Latium, the son of Isabella Colonna and the condottiero Louis Gonzaga, lord of Palazzolo, a member of a cadet branch of the House of Gonzaga, Dukes of Mantua. Soon orphaned, he was educated under his aunt Giulia Gonzaga, who had moved to Naples to escape attempts from other members of the Colonna family to kill Vespasiano in order to obtain the fiefs he had inherited from his mother.",https://en.wikipedia.org/wiki?curid=20796989
358188,The son of Henry J. Parker,Maidstone,Henry Parker (cricketer),https://en.wikipedia.org/wiki?curid=44600137,0,5,24,24,"The son of Henry J. Parker who was Gresham Professor of Divinity and vicar of High Halden in Kent , Parker was educated at Maidstone and at Corpus Christi College , Cambridge .","The son of Henry J. Parker who was Gresham Professor of Divinity and vicar of High Halden in Kent, Parker was educated at Maidstone and at Corpus Christi College, Cambridge. Parker played most of his early cricket as a middle-order batsman, though he rarely seemed to make many runs; an exception was his solitary appearance in the University Match between Cambridge University and Oxford in 1839, in which he made 43, by some distance his best score in first-class cricket. After a solitary appearance for Kent in 1841, the rest of his cricket was played for the amateur Gentlemen of Kent side, and though detailed scorecards from his era are not often available, he seems to have developed as a bowler: against the Gentlemen of England in 1845, he batted at No 11 but took four wickets, though the scorecard also records he bowled 12 wides. It is not known whether batted or bowled right- or left-handed, nor his style of bowling.",https://en.wikipedia.org/wiki?curid=44600137
358188,Parker,Maidstone,Henry Parker (cricketer),https://en.wikipedia.org/wiki?curid=44600137,20,20,24,24,"The son of Henry J. Parker who was Gresham Professor of Divinity and vicar of High Halden in Kent , Parker was educated at Maidstone and at Corpus Christi College , Cambridge .","The son of Henry J. Parker who was Gresham Professor of Divinity and vicar of High Halden in Kent, Parker was educated at Maidstone and at Corpus Christi College, Cambridge. Parker played most of his early cricket as a middle-order batsman, though he rarely seemed to make many runs; an exception was his solitary appearance in the University Match between Cambridge University and Oxford in 1839, in which he made 43, by some distance his best score in first-class cricket. After a solitary appearance for Kent in 1841, the rest of his cricket was played for the amateur Gentlemen of Kent side, and though detailed scorecards from his era are not often available, he seems to have developed as a bowler: against the Gentlemen of England in 1845, he batted at No 11 but took four wickets, though the scorecard also records he bowled 12 wides. It is not known whether batted or bowled right- or left-handed, nor his style of bowling.",https://en.wikipedia.org/wiki?curid=44600137
359720,He,The King 's School,Roy Bell (politician),https://en.wikipedia.org/wiki?curid=50274878,0,0,4,7,"He was educated at The King 's School , Parramatta and owned or managed a series of Stations in Queensland and New South Wales .","Bell was born at Denman, New South Wales, the son of Federick Samuel Bell and his wife Mary Charlotte (née Mackenzie). He was educated at The King's School, Parramatta and owned or managed a series of Stations in Queensland and New South Wales.",https://en.wikipedia.org/wiki?curid=50274878
364725,Dupré,the University of Oxford,John Dupré,https://en.wikipedia.org/wiki?curid=14521898,0,0,4,7,"Dupré was educated at the University of Oxford and the University of Cambridge and taught at Oxford , Stanford University and Birkbeck College of the University of London before moving to Exeter .","Dupré was educated at the University of Oxford and the University of Cambridge and taught at Oxford, Stanford University and Birkbeck College of the University of London before moving to Exeter.",https://en.wikipedia.org/wiki?curid=14521898
375539,He,Wellington College,Eustace Mordaunt,https://en.wikipedia.org/wiki?curid=53342170,0,0,4,5,"He was educated at Wellington College where he was in the cricket XI from 1887 to 1889 , leading the school averages in his final season and captaining the side in 1888 .","Mordaunt was born at Wellesbourne Hastings in Warwickshire, the son of John Mordaunt who had played cricket for MCC. He was educated at Wellington College where he was in the cricket XI from 1887 to 1889, leading the school averages in his final season and captaining the side in 1888. He played for Hampshire County Cricket Club in 1887 whilst he was at school at a time when the county did not have first-class cricket status.",https://en.wikipedia.org/wiki?curid=53342170
376476,McKeever,Dalriada School,Bridget McKeever,https://en.wikipedia.org/wiki?curid=4940633,0,0,4,5,McKeever was educated at Dalriada School and Stranmillis University College .,McKeever was educated at Dalriada School and Stranmillis University College.,https://en.wikipedia.org/wiki?curid=4940633
381016,She,Notting Hill High School,Clara Rackham,https://en.wikipedia.org/wiki?curid=38772779,0,0,4,7,"She was educated at Notting Hill High School , St Leonards School ( 1892–93 ) , Bedford College in 1894 , and like her older sister , Margaret , attended Newnham College , Cambridge .","Clara Rackham (known as Dorothea to her family) was born in Notting Hill, the daughter of Henry Tabor, a gentleman farmer from a non-conformist family based in Bocking in Essex and Emma Tabor (née Woodcock) who came from Wigan. She was educated at Notting Hill High School, St Leonards School (1892–93), Bedford College in 1894, and like her older sister, Margaret, attended Newnham College, Cambridge.",https://en.wikipedia.org/wiki?curid=38772779
381016,She,1894,Clara Rackham,https://en.wikipedia.org/wiki?curid=38772779,0,0,19,19,"She was educated at Notting Hill High School , St Leonards School ( 1892–93 ) , Bedford College in 1894 , and like her older sister , Margaret , attended Newnham College , Cambridge .","Clara Rackham (known as Dorothea to her family) was born in Notting Hill, the daughter of Henry Tabor, a gentleman farmer from a non-conformist family based in Bocking in Essex and Emma Tabor (née Woodcock) who came from Wigan. She was educated at Notting Hill High School, St Leonards School (1892–93), Bedford College in 1894, and like her older sister, Margaret, attended Newnham College, Cambridge.",https://en.wikipedia.org/wiki?curid=38772779
381183,Miller,Malbank School,Ben Miller,https://en.wikipedia.org/wiki?curid=1167880,0,0,4,5,"Miller was educated at Malbank School and Sixth Form College , his local comprehensive school in Nantwich , Cheshire .","Miller was educated at Malbank School and Sixth Form College, his local comprehensive school in Nantwich, Cheshire. He read Natural Sciences at St Catharine's College, Cambridge. As an undergraduate, he participated in theatre with Rachel Weisz, and also dated her. He remained at Cambridge to read for a PhD in solid state physics, with his proposed thesis titled ""Novel quantum effects in low-temperature quasi-zero-dimensional mesoscopic electron systems.""",https://en.wikipedia.org/wiki?curid=1167880
381730,Julia Maud,a Church of England convent school,Maud Churton Braby,https://en.wikipedia.org/wiki?curid=63348376,0,1,5,10,"Julia Maud was educated at a Church of England convent school , then later at a finishing school in Germany .","Their daughters Constance, Lucy Madeline, and Julia Maud, and their son Stanley Douglas, were born in China, but by 1881 the family had returned to England and settled at Paignton, Devon. Julia Maud was educated at a Church of England convent school, then later at a finishing school in Germany. Her parents were by then living in London, but her mother died in January 1899 at Lewisham. In February 1901, her father married secondly, at Ladbroke Grove, Mary Anne Elizabeth Hole, daughter of a physician, and the following year was living at Catford.",https://en.wikipedia.org/wiki?curid=63348376
381730,Julia Maud,a finishing school,Maud Churton Braby,https://en.wikipedia.org/wiki?curid=63348376,0,1,15,17,"Julia Maud was educated at a Church of England convent school , then later at a finishing school in Germany .","Their daughters Constance, Lucy Madeline, and Julia Maud, and their son Stanley Douglas, were born in China, but by 1881 the family had returned to England and settled at Paignton, Devon. Julia Maud was educated at a Church of England convent school, then later at a finishing school in Germany. Her parents were by then living in London, but her mother died in January 1899 at Lewisham. In February 1901, her father married secondly, at Ladbroke Grove, Mary Anne Elizabeth Hole, daughter of a physician, and the following year was living at Catford.",https://en.wikipedia.org/wiki?curid=63348376
385591,Lawrence,Rose Hill School,Robert Lawrence (British Army officer),https://en.wikipedia.org/wiki?curid=11904608,0,0,4,6,"Lawrence was educated at Rose Hill School , Alderley and then Fettes College , but left at the age of 16 ; some accounts state that he was expelled .","Lawrence was born on 3 July 1960. His father had served in the Royal Air Force. Lawrence was educated at Rose Hill School, Alderley and then Fettes College, but left at the age of 16; some accounts state that he was expelled. He decided to join the army, largely to placate his father. After attending Royal Military Academy Sandhurst, he was commissioned into the Scots Guards as a second lieutenant with a short service commission on 4 August 1979. He was promoted to lieutenant on 4 August 1981.",https://en.wikipedia.org/wiki?curid=11904608
385933,He,Cheltenham College,Alan Cunningham,https://en.wikipedia.org/wiki?curid=715396,0,0,4,5,"He was educated at Cheltenham College and the Royal Military Academy , Woolwich before taking a commission in the Royal Artillery in 1906 .","Cunningham was born in Dublin, Ireland, the third son of Scottish Professor Daniel John Cunningham and his wife Elizabeth Cumming Browne. He was educated at Cheltenham College and the Royal Military Academy, Woolwich before taking a commission in the Royal Artillery in 1906. During the First World War, he served with the Royal Horse Artillery, and was awarded a Military Cross in 1915 and the Distinguished Service Order in 1918. For two years after the war he served as a staff officer in the Straits Settlements.",https://en.wikipedia.org/wiki?curid=715396
387620,who,the old curriculum,Chinese Filipino,https://en.wikipedia.org/wiki?curid=1167856,5,5,9,11,"The older generation Filipino Chinese who were educated in the old curriculum typically used Chinese ( e.g. , Hokkien and Cantonese ) at home , while most younger generation Filipino Chinese are more comfortable conversing in either English or Filipino admixed with Chinese .","The changes in Chinese education initiated with the 1973 Philippine Constitution led to the large shifting of mother tongues and assimilation of the Chinese Filipinos to general Philippine society. The older generation Filipino Chinese who were educated in the old curriculum typically used Chinese (e.g., Hokkien and Cantonese) at home, while most younger generation Filipino Chinese are more comfortable conversing in either English or Filipino admixed with Chinese.",https://en.wikipedia.org/wiki?curid=1167856
390712,He,Toor National School,Michael Kennedy Ryan,https://en.wikipedia.org/wiki?curid=39499931,0,0,5,7,He was educated locally at Toor National School before going to Mount Mellery .,"He was educated locally at Toor National School before going to Mount Mellery. He went to study for the priesthood in St. Patrick's College, Thurles, and from there he proceeded to Maynooth College where he was ordained in 1893.",https://en.wikipedia.org/wiki?curid=39499931
394185,He,Marlborough College,Nigel Cornwall,https://en.wikipedia.org/wiki?curid=11905383,0,0,4,5,"He was educated at Marlborough College , where his older brother Alan , a county cricketer for Gloucestershire , was later to be a housemaster .","Cornwall was the son of Alan Cornwall, who was Archdeacon of Cheltenham from 1924 to 1932. He was educated at Marlborough College, where his older brother Alan, a county cricketer for Gloucestershire, was later to be a housemaster. He then studied history at Oriel College, Oxford, obtaining a third-class degree in 1926.",https://en.wikipedia.org/wiki?curid=11905383
395240,he,this time,William Evans (ornithologist),https://en.wikipedia.org/wiki?curid=50277146,3,3,1,2,During this time he was educated at the Free Kirk School in East Linton .,"After a wonderful early exposure to botany, his family moved in 1857 to Tynefield Farm near East Linton (east of Edinburgh) where his interests continued with a more practical vein. Here though, he came under the influence of Charles Nelson of Pitcox, who extended his interests from plant life to birds, William also taking a keen interest in sculpting birds from wood from this time. During this time he was educated at the Free Kirk School in East Linton.",https://en.wikipedia.org/wiki?curid=50277146
395240,he,the Free Kirk School,William Evans (ornithologist),https://en.wikipedia.org/wiki?curid=50277146,3,3,7,10,During this time he was educated at the Free Kirk School in East Linton .,"After a wonderful early exposure to botany, his family moved in 1857 to Tynefield Farm near East Linton (east of Edinburgh) where his interests continued with a more practical vein. Here though, he came under the influence of Charles Nelson of Pitcox, who extended his interests from plant life to birds, William also taking a keen interest in sculpting birds from wood from this time. During this time he was educated at the Free Kirk School in East Linton.",https://en.wikipedia.org/wiki?curid=50277146
397360,He,Stanburn Primary School,Michael Portillo,https://en.wikipedia.org/wiki?curid=204498,0,0,4,6,"He was educated at Stanburn Primary School in Stanmore , Greater London , and Harrow County School for Boys and then won a scholarship to Peterhouse , Cambridge .","In 1961, Portillo appeared in a television advertisement for Ribena, a blackcurrant cordial drink. He was educated at Stanburn Primary School in Stanmore, Greater London, and Harrow County School for Boys and then won a scholarship to Peterhouse, Cambridge. While at school Portillo had supported the cause of the Labour Party; he attributed his embrace of conservatism at Cambridge to the influence of the right-wing Peterhouse historian Maurice Cowling. In 1999, Portillo gave an interview in which he discussed homosexual relationships he had whilst at university.",https://en.wikipedia.org/wiki?curid=204498
399754,Elisabeth,Sevenoaks School,Elisabeth von Thurn und Taxis,https://en.wikipedia.org/wiki?curid=23607533,0,0,4,5,"Elisabeth was educated at Sevenoaks School in Kent , England , and has a bachelor 's degree in media and communication studies from the American University of Paris .","Elisabeth was educated at Sevenoaks School in Kent, England, and has a bachelor's degree in media and communication studies from the American University of Paris.",https://en.wikipedia.org/wiki?curid=23607533
401547,His son,two independent schools,Jimmy Perry,https://en.wikipedia.org/wiki?curid=2341385,0,1,5,7,"His son was educated at two independent schools , Colet Court and St Paul 's School , which at the time were both based in Hammersmith in West London .","Perry was born in Barnes, Surrey. His father, Arthur, was an antiques dealer, whose shop was in South Kensington, London. He was a founder of the British Antique Dealers' Association. His son was educated at two independent schools, Colet Court and St Paul's School, which at the time were both based in Hammersmith in West London.",https://en.wikipedia.org/wiki?curid=2341385
401856,Okine,Anglican Church schools,Robert Okine,https://en.wikipedia.org/wiki?curid=25566795,0,0,4,6,"Okine was educated at Anglican Church schools in the Gold Coast and Gambia , the Methodist Boys ' High School in Bathurst , The Gambia , and Adisadel College , Ghana .","Okine was educated at Anglican Church schools in the Gold Coast and Gambia, the Methodist Boys' High School in Bathurst, The Gambia, and Adisadel College, Ghana. He was ordained deacon in 1964 and priest in 1965. He was an Assistant Curate at St Andrew's, Sekondi then Chaplain at his Adisadel College. He held incumbencies at St James, Agona-Swedru, Bishop Aglionby Memorial Parish, Tamale; St George's, London, Ontario; Holy Trinity Episcopal Church, Nashville; and Christ Church Parish, Cape Coast before being appointed Headmaster of the Academy of Christ the King in 1976. Later he was Principal of St Nicholas Theologial College and Archdeacon of Koforidua before being elevated to the Episcopate as Bishop of Koforidua-Ho, Ghana in 1981. Twelve years later he became Archbishop of West Africa, retiring from both posts in 2003.",https://en.wikipedia.org/wiki?curid=25566795
401982,Tatham,Marlborough College,"St Wilfrid's Church, Cantley",https://en.wikipedia.org/wiki?curid=53342764,25,25,29,30,"Born on 30 July 1862 in Great Ryburgh into a wealthy Norfolk family closely associated with the Catholic Revival in the Church of England , Tatham was educated at Marlborough College and Brasenose College , Oxford .","Tatham was Vicar of Cantley for 46 years from 1892 until his death on 18 October 1938. Born on 30 July 1862 in Great Ryburgh into a wealthy Norfolk family closely associated with the Catholic Revival in the Church of England, Tatham was educated at Marlborough College and Brasenose College, Oxford. A keen sportsman throughout his life, Tatham competed at the Wimbledon Championships of 1882, being defeated in the first round by the celebrated champion, Ernest Renshaw. After attending theological college at Cuddesdon, Oxford, he was ordained deacon in 1885 at the age of 23 and served his title in the parish of St Saviour's Church, Folkestone working among the poor. Tatham began his second curacy at St Agnes, Kennington Park in 1890, before leaving two years later to be presented to the living of Cantley in the then Diocese of York, later Sheffield, on 14 December 1892. Having been influenced by the Oxford Movement as an undergraduate, Tatham established St Wilfrid's firmly in the Catholic tradition, facing much opposition and courting the displeasure of his diocesan bishops, none of whom ever consented to visit the parish during his incumbency.",https://en.wikipedia.org/wiki?curid=53342764
