sentence_id,title,query number,clean_sentence,status
727057,ME-12-08-3491-22,4.0,"""הריני סבור כי בשאלה אם לקבל כראיה את חוות דעתו ועדותו של חוקר ילדים, אודות מתלונן קטן המעיד במשפט, מוטל על בית המשפט להכריע תוך התחשבות במטרת הגשתן של הראיות ועל רקע נסיבותיו העובדתיות של המקרה הנתון",not annotated
855736,ME-14-06-20061-11,4.0," מעבר לחיסכון בזמן שיפוטי של עדות של מתלוננים רבים, היה  בהודאת הנאשמת, כדי לחסוך למתלוננים הקטינים מעמד קשה במתן עדותם בבית המשפט וחשיפתם לחקירה נגדית",not annotated
6021,ME-16-11-9004-33,5.0," שתי נקודות אלה, תהליך החשיפה ומצבה הרגשי של המתלוננת בהקשר לחשיפה, מחזקות עוד את עדותה המשכנעת של המתלוננת",not annotated
6115,ME-16-11-9004-33,5.0," לכן, לו דובר בעדות שיש לה חיזוק ובוודאי אלמלא הגרסה הנגדית של המתלוננת, הרי שניתן היה בהחלט ליתן אמון בעדות הנאשם ולהכריע עובדות על פיה",not annotated
8782,ME-11-08-19586-55,5.0, המאשימה טענה כי עדותה המהימנה של המתלוננת מקבלת חיזוקים בעדויות של עדים נוספים שראו את תגובותיה מיד לאחר האירוע ,not annotated
8809,ME-11-08-19586-55,5.0," המאשימה טענה כי אל מול גרסתה העקבית והמהימנה של המתלוננת, הנתמכת בעדויות רבות נוספות, לרבות עדויות מומחים, אנשי מקצוע ואנשי משטרה, עומדת גרסתו של הנאשם לבדה",not annotated
8823,ME-11-08-19586-55,5.0," על שום כל אלה, טענה המאשימה, מן הדין שבית המשפט יאמץ את גרסתה המהימנה של המתלוננת וירשיע את הנאשם במעשים המיוחסים לו בכתב האישום",not annotated
9331,SH-10-11-34300-792,5.0,"לאחר צפייה בקלטות החקירה של המתלוננת , וכן עיון בתמלילים , התרשמתי כי הודעתה של המתלוננת אינה תוצר של הדרכה של החוקר, אלא מדובר בגרסה אותנטית של המתלוננת עצמה",not annotated
9657,SH-10-11-34300-792,5.0,"לא ניתן להתעלם מהגרסאות לאירועים מפיה של המתלוננת כפי שעלו בשתי עדויות אלה של אמה של המתלוננת ושכנתה מרים משה, גרסאות אלו הן הגרסאות הראשוניות של המתלוננת לפגיעה בה",not annotated
9670,SH-10-11-34300-792,5.0," לכך מתווסף החשש כי עדותה הראשונית של המתלוננת אינה נקייה מזיהומים שונים זאת ניתן ללמוד מכך שהמתלוננת נמצאה על ידי אחותה בביתו של הנאשם, וככל הנראה עקב צעקותיה של אחותה, למדה המתלוננת מיד כי מה שארע הינו פסול ואסור ובעקבות הצעקות של אחותה על הנאשם בחרה לספר כי הנאשם הוא זה שפגע בה",not annotated
14173,m014025,5.0," כיוון שהנאשם אינו מודה במגע המיני, ואינו טוען שהדבר נעשה בהסכמת המתלוננת, המסקנה היחידה, לאור עדותה המהימנה של המתלוננת, היא שהמגע המיני היה באינוס, וכי הנאשם הוא האנס",not annotated
17841,s00001992-109,5.0,"אף תוספת שני פרטים אלה אינם יורדים לשורש העניין, שכן הנשיקה בצוואר מתיישבת גם עם הגירסאות הראשונות של המתלוננת , ולגבי הארון – אין מחלוקת שאכן היה במקום ארון ברזל",not annotated
18416,m06003021,5.0,"מלשון הסעיף עולה כי בית-המשפט רשאי להסתמך על עדות יחידה של מתלוננת, ובלבד שיפרט מה הניע אותו להסתפק בעדות זו",not annotated
18433,m06003021,5.0," בתיק שבפנינו, כמו במרבית תיקי עבירות המין, מצויות בפנינו גרסאות סותרות, של המתלוננות מחד ושל הנאשם מאידך",not annotated
18469,m06003021,5.0," בענייננו נראה לי שלא היה זה בטוח להשתית את הרשעת המערער על עדותה היחידה של המתלוננת, הלוקה כאמור, בסתירות ובתמיהות",not annotated
19215,m06003021,5.0," כפי שציינתי בתחילת הדברים, די בעדות יחידה של המתלוננת בצירוף הנמקה כדי לבסס הרשעה בעבירות מין",not annotated
19350,m06003021,5.0," יצוין כי אין מחלוקת בין הצדדים כי אם תתקבל גרסתה העובדתית של המתלוננת, הרי שיש במעשים המיוחסים לנאשם כדי למלא את כל יסודות העבירות המיוחסות לו, ועל כן אין צורך לבחון את יסודות כל אחת ואחת מהעבירות",not annotated
19371,m06003021,5.0," על כן נראה כי לאור גילה הצעיר של המתלוננת בזמן ביצוע המעשים והזמן הרב שחלף, אין להסתפק בעדותה היחידה של המתלוננת לגבי טיב המעשים ואופיין של הנגיעות כדי להסיר כל ספק ולהרשיע את הנאשם",not annotated
23135,SH-10-10-18706-362,5.0,"על מנת לקבוע מה משקלו של מחדל החקירה של אי גביית הודעה/הודעות מחבריה של המתלוננת והאם יש בו כדי להטות את הכף לעבר זיכויו של הנאשם מחמת הספק, כעתירת באת כוחו, אשוב על מסקנותיי לגבי מהימנות גרסאות המתלוננת  מזה והנאשם מזה, כשאני מזהירה עצמי כי ראיות התביעה מבוססות על עדותה היחידה של המתלוננת",not annotated
23146,SH-10-10-18706-362,5.0,"לעומת גרסתה הברורה, החד משמעית והאמינה של המתלוננת עומדת גרסתו של הנאשם, שכפי שכבר ציינתי לעיל הייתה שחצנית, יהירה, זחוחה וארוגנטית",not annotated
23171,SH-10-10-18706-362,5.0,"לאור כל האמור לעיל ולאחר שהזהרתי עצמי כי הכרעת הדין מבוססת על עדותה היחידה של המתלוננת, לאור התרשמותי ממהימנות גרסתה ומאמינותה, אני קובעת כי המאשימה עמדה בנטל להוכיח את אשמתו של הנאשם ומרשיעה אותו בעבירה של מעשה מגונה באדם על פי  ל, התשל""ז-1977",not annotated
31066,SH-10-11-59389-630,5.0," אי  לכך אני סבורה שלו  היתה ניתנת תשומת לב  כנה ומאוזנת גם לדבריו של הנאשם ולא רק לגירסתה הבעייתית  של המתלוננת, הייתה מצטיירת תמונה מדויקת יותר, שמאפשרת  בחינת האירועים כנדרש",not annotated
31263,SH-10-11-59389-630,5.0," לעומת גרסתה הבעייתית של המתלוננת, שמחד גיסא הולכת ו""מתפתחת"", אך מאידך גיסא מלאה באי דיוקים ואי סבירות ואפילו שקרים, עומד הנאשם על גרסתו, ממנה איננו סוטה, לא בעימות, לא בחקירותיו במשטרה ולא בבית המשפט וחוזר ומתאר את האירוע המינורי שהתרחש",not annotated
32423,m00000935-103,5.0," לטענת המאשימה יש להרשיע את הנאשם בעבירות המיוחסות לו על יסוד עדותה השניה של המתלוננת, שאותה יש לקבל כמהימנה ולייחס לה את מלוא המשקל, ולאור ראיות חיזוק נוספות כמפורט להלן:",not annotated
35130,m06003045,5.0," חוקר הילדים בחוות דעתו ובעדותו בביהמ""ש, ביסס את מסקנתו תוך הפנייה לדוגמאות מעדותו המוקלטת והמתורגמת של המתלונן ",not annotated
35685,m06003045,5.0,"העובדות שנטענו בכתב האישום, הוכחו באמצעות עדותו המהימנה של המתלונן, הנתמכת במידת מה בהודעתו של הנאשם במשטרה",not annotated
35860,m06003045,5.0,"כל אלו, בגדר סתירות, פרכות ותמיהות קטנות כשלעצמן, אך במצטבר, ועל רקע הדברים עליהם עמדנו לעיל, מביאים למסקנה שאין לסמוך הרשעתו של הנאשם על סמך עדותו היחידה של המתלונן",not annotated
42916,s02001222-269,5.0,"00 נגבתה עדות נוספת מהמתלוננת  במהלכה נשאלה אודות גירסת הנאשם, הכחישה שהתנשקו, אישרה שהיו כתובות בשירותים, והיו שמועות שיש ביניהם רומן, וגם שמועות ששכבו",not annotated
46014,ME-11-10-25753-846,5.0," ראוי היה לדעתו להמתין לחוקר הדובר את שפתו של המתלונן, המבין גם את תרבותו והקודים השונים שבה, על מנת לאפשר גביית עדות שלמה, מקיפה ומהימנה של המתלונן",not annotated
46213,SH-10-04-42431-606,5.0," שום ראיה חפצית לא הובאה לתמוך בגרסתו המופרכת של המתלונן""",not annotated
48234,SH-13-08-24175-34,5.0,"מחד, עמדה עדותה המפלילה של המתלוננת ולצידה עדויות השוטרים שהגיעו למקום, על פי קריאת והכוונת המתלוננת, ועצרו את הנאשם, על בסיסם עותרת התביעה לסמוך הרשעת הנאשם ומנגד עדותו המכחישה של הנאשם",not annotated
48306,SH-13-08-24175-34,5.0,"הנאשם עומת בחקירתו הנגדית עם עדותה הברורה של המתלוננת ונשאל מדוע שתעליל עליו מעשה שכזה וכל שהשיב היה ""לא ראיתי אותה",not annotated
48352,SH-13-08-24175-34,5.0,"אל מול עדותה האמינה והאותנטית של המתלוננת, עומדת לה עדותו המתחמקת הבלתי מבוססת והמופרכת של הנאשם, שלא עוררה בי שמץ של אמון",not annotated
48380,SH-13-08-24175-34,5.0,"מכל האמור כאשר מציבה אני את עדותה החד משמעית והמהימנה של המתלוננת אל מול עדות הנאשם – המגלמת גרסה מופרכת ונעדרת כל הסבר ומניע אפשרי מצד המתלוננת לטפול כנגדו תלונה כוזבת, המסקנה היא שיש לבכרה על פניה",not annotated
50349,s03005381-402,5.0, נטען לעדות כבושה מצד המתלוננת,not annotated
57723,ME-11-06-2965-391,5.0,"שלישית, טוען ב""כ הנאשם כי גרסתה השקרית של המתלוננת נולדה לאחר שהתברר לה כי בן זוגה שאהר גילה את העובדה שהיא בילתה באותו לילה עם גבר אחר, ומתוך פחדה שלא יאונה לה כל רע מידי בן זוגה, איש אלים וחם מזג, המציאה את סיפור החטיפה והאונס, על מנת להסיט את האשמה ל""בילויה"" עם הנאשם ממנה לנאשם עצמו",not annotated
57968,ME-11-06-2965-391,5.0,איני מתעלם מן הקשיים שבעדותה הכוללת של המתלוננת,not annotated
57988,ME-11-06-2965-391,5.0,"גרסה שקרית זו של המתלוננת היא משמעותית ביותר, מאחר שהעבר המשותף שלה ושל הנאשם בוודאי מקרין לא רק על מידת המהימנות שיש ליחס למתלוננת באופן כללי, אלא אף על מידת המהימנות שיש ליחס לגרסתו של הנאשם שהשניים התחבקו והתנשקו וזרמו לקראת יחסים אינטימיים גם בליל האירוע נשוא כתב האישום",not annotated
62848,m003027a,5.0," לטענת המאשימה, אין במצב שנוצר לאחר עדותה האחרונה של המתלוננת יותר מראיה נוספת לאותם לחצים שבהם היא נתונה, ויש לראות בלחצים אלה חיזוק לגירסתה",not annotated
65052,SH-12-09-49889-43,5.0,"לאור מכלול הנתונים שפורטו לעיל, והגם שבית המשפט מוסמך לקבוע ממצאים על סמך עדות יחידה של המתלוננת, כאמור, ולמרות שהגרסא שמסרה המתלוננת הייתה עקבית ורציפה, מצאתי לנכון בנסיבות העניין לקבוע ממצאים מרשיעים בהסתמך על עדות המתלוננת רק באותם נושאים והיבטים שיש לעדות תמיכה וחיזוק, יהיו דרגתו, אופיו ומקורו של החיזוק אשר יהיו",not annotated
68595,ME-12-01-7451-55,5.0,"כאן באה עדותה העיקרית של המתלוננת, בנוגע לליבת המקרה",not annotated
69759,SH-09-2568-196,5.0,"לא נעלמה מעיני העובדה שמדובר בהרשעה על סמך עדות יחידה של המתלוננת, אך חרף זאת מצאתי שניתן להסתפק בעדות זו לצורך הרשעה",not annotated
71573,m984133,5.0," יש בעדותה המהימנה של המתלוננת, כפי שנתמכת במצבה הנפשי ובשקרי הנאשם, ובדחיית טענותיו של הנאשם הנסתרות בעליל על-ידי הדברים שמסר בהודעות ובעימות עם המתלוננת, כדי לגרום לי להצטרף לחבריי הנכבדים בהרשעתו של הנאשם",not annotated
73687,SH-15-06-23701-11,5.0," חלו לאורך זמן התפתחויות בגרסתה העובדתית של המתלוננת, ובהעדר כל ראיה מפלילה נוספת, די בכך על מנת לקבוע כי מתעוררות ספקות אשר אינן מאפשרות ביסוס ממצא וודאי על גרסתה הנוכחית",not annotated
73702,SH-15-06-23701-11,5.0," חלו לאורך זמן התפתחויות בגרסתה העובדתית של המתלוננת, ובהעדר כל ראיה מפלילה נוספת, די בכך על מנת לקבוע כי מתעוררות ספקות אשר אינן מאפשרות ביסוס ממצא וודאי על גרסתה הנוכחית",not annotated
73714,SH-15-06-23701-11,5.0," לנוכח גרסתו זו של הנאשם הובאו בפני מכלול הראיות הנוגעות לאירוע, ולאחר שנתתי דעתי להם הגעתי לכלל מסקנה כי בנסיבות העניין אין די בעדותה היחידה של המתלוננת כדי לבסס מעבר לכל ספק סביר את הטענה כי הנאשם אונן בפניה",not annotated
73832,SH-15-06-23701-11,5.0," לטעמי, בנסיבות שהובאו בפני, אין די בעדותה הנחרצת של המתלוננת בעדותה בפני כדי להסיר הספקות המתעוררים במקרה זה, ואפרט",not annotated
73841,SH-15-06-23701-11,5.0," כפי שאתאר מיד, חלו לאורך זמן התפתחויות בגרסתה העובדתית של המתלוננת, ובהעדר כל  ראיה מפלילה נוספת, די בכך לטעמי על מנת לקבוע כי מתעוררות ספקות אשר אינן מאפשרות ביסוס ממצא וודאי על גרסתה הנוכחית",not annotated
77143,m03001164,5.0," עם זאת, קבעה החוקרת חד-משמעית, כי לאחר בחינה כוללת של מְהֵימָנוּת המתלוננת, המדובר בגירסה עִקְבִית וּמדויקת של המתלוננת וּבה אלמנטים רבים המצביעים כי אין מדובר בדברים שהוכנסו לפיה או ""הושתלו"" בזיכרונה",not annotated
77678,m03001164,5.0,"שמענו את עֵדוּתָהּ הארוכה והמפורטת של המתלוננת, ויכולנו להתרשם בּאֹרַח בלתי-אמצעי מאוֹפיָיה, התנהגותה ואופן מסירת עֵדוּתָהּ, על רקע גִּילָהּ הצעיר וּמַצָּבַהּ המיוחד, וּלאורך חקירה לא-קלה",not annotated
77726,m03001164,5.0," כך עֵדוּת חוקרת-הילדים, הגב' ענת משי-הראל, והתרשמותה מהמתלוננת - מהווים חיזוק של ממש לאמיתוּת הדברים שעליהם העידה המתלוננת",not annotated
77765,m03001164,5.0," לעומת עֵדוּתָהּ הכֵּנָה, הפשוטה והמהימנה של המתלוננת, הייתה גירסתו של הנאשם רְווּיָה בסתירות משמעותיות והעלתה סימני-שְׁאֵלָה רבים שלא הוסברו",not annotated
77765,m03001164,5.0," לעומת עֵדוּתָהּ הכֵּנָה, הפשוטה והמהימנה של המתלוננת, הייתה גירסתו של הנאשם רְווּיָה בסתירות משמעותיות והעלתה סימני-שְׁאֵלָה רבים שלא הוסברו",not annotated
79239,ME-00-121-HK,5.0,גם באישום השני מדובר בעדות יחידה של מתלוננת,not annotated
80257,m02001201-a,5.0," עדותה המוקדמת של המתלוננת במקרה הנידון הוקלטה באמצעות מכשיר וידאו, בהתאם לבקשתם של הצדדים וכאמור בהחלטת בית המשפט",not annotated
80258,m02001201-a,5.0," נראה כי הטעם שעמד ביסוד ההחלטה להקליט את עדותה המוקדמת של המתלוננת, היה הצורך להבטיח שכל חברי ההרכב שיישבו בבוא העת על המדוכה, יוכלו להתרשם מן העדה באופן בלתי אמצעי ובלתי תלוי, וכך לקבוע את מידת מהימנותה",not annotated
80304,m02001201-a,5.0," נדגיש ונאמר- חלוף הזמן בין קרות האירוע ובין עדותה החוזרת של המתלוננת, מחייב התייחסות מתאימה",not annotated
80557,m02001201-a,5.0, טווח הזמן שחלף מאז עדותה הראשונה לעדותה החוזרת של המתלוננת עומד על כ-21 חודשים,not annotated
82161,m02001201-a,5.0," הפן הראייתי בכל הנוגע לעבירת האינוס ל , התשל""א- 1971, ביטל את דרישת הסיוע לעדות של קורבן עבירת מין וקבע במקומה חובת ""הנמקה"", לפיה רשאי בית המשפט להסתמך על עדות יחידה של מתלוננת ובלבד שיפרט מה הניע אותו להסתפק בעדות זו",not annotated
82891,SH-08-1069-752,5.0,"אינני נותן אמון בעדותו המגמתית של הנאשם, ויש להעדיף, באופן ברור את עדותה האמינה והעקבית של המתלוננת",not annotated
91260,ME-15-11-4139-531,5.0," לאחר עדותה המוקדמת של המתלוננת, ביקש הנאשם לתקן את תשובתו לאישום",not annotated
91332,ME-15-11-4139-531,5.0," סבורני, כי גרסתה המאוזנת של המתלוננת, והעובדה שלא העצימה את תיאוריה יתר על המידה, מצביעה על אותנטיות ואמיתות גרסתה וכי המתלוננת לא ביקשה לטפול על הנאשם מעשים שלא ביצע",not annotated
91613,ME-15-11-4139-531,5.0," רק לאחר שנשמעה עדותה המוקדמת של המתלוננת, ביקש הנאשם לתקן את תשובתו לאישום, וטען לראשונה, כי הוא נכנס לשביל העפר כדי להטיל את מימיו",not annotated
91715,ME-15-11-4139-531,5.0,"אחזור ואדגיש כאן את התזמון בו בחר הנאשם לשנות את גרסתו הראשונית לפיה טעה בדרך, לגרסה לפיה עצר להטיל את מימיו – מיד בתום עדותה המוקדמת של המתלוננת",not annotated
93600,ME-12-06-24991-111,5.0,"בנוסף חשוב להזכיר כי כיום ניתן לבסס הרשעה על עדותו היחידה של מתלונן בעבירות מין, גם מבלי שנמצא חיזוק ואפנה בענין זה לפסק דינו של השופט א' א' לוי:",not annotated
93603,ME-12-06-24991-111,5.0," כידוע, ניתן לבסס הרשעה על עדותו היחידה של מתלונן בעבירות מין, אולם על בית-המשפט להזהיר עצמו כי הוא עושה זאת בלא שנמצא חיזוק, ועליו להוסיף ולנמק את טעמיו לכך  ל , התשל""א-1971)",not annotated
96554,s00006418-192,5.0,"ב""כ הנאשם ביקש לדחות את גירסתה המתחמקת והתמוהה של המתלוננת, כדבריו",not annotated
98418,ME-09-1158-968,5.0, אין בעדויות אלה כדי לפגום בגרסה האמינה של המתלוננת,not annotated
99791,ME-12-09-12360-11,5.0," קיבלתי בעניין זה את עדותה המהימנה של המתלוננת, כי זיהתה את המכשיר, בין היתר, על פי שריטות ייחודיות עליו, ויותר מכך, עקב עובדת הימצאות תמונת אחיה על גבי בשומר המסך, שככל הנראה, הנאשם לא הצליח להסיר",not annotated
104197,ME-12-07-50126-518,5.0," למותר לציין כי, מבחינה עובדתית ומשפטית, זהו שוני מהותי, והוא מהווה שיקול נוסף ומצטבר לקושי לקבוע ממצא על יסוד עדותה היחידה של המתלוננת, שלא נחקרה חקירה נגדית מלאה",not annotated
104302,ME-12-07-50126-518,5.0,"  כמו כן, נוכח הפער הבולט בין עדותה הקולחת והחופשית של המתלוננת בחקירה הראשית, לעומת ההתרשמות ממנה בחקירה הנגדית, שנקטעה ולא הושלמה, לא ניתן לבסס על עדותה היחידה של המתלוננת ממצאים ברמה של ""מעבר לספק סביר""",not annotated
104302,ME-12-07-50126-518,5.0,"  כמו כן, נוכח הפער הבולט בין עדותה הקולחת והחופשית של המתלוננת בחקירה הראשית, לעומת ההתרשמות ממנה בחקירה הנגדית, שנקטעה ולא הושלמה, לא ניתן לבסס על עדותה היחידה של המתלוננת ממצאים ברמה של ""מעבר לספק סביר""",not annotated
104804,ME-15-03-14854-33,5.0,"מלשון הסעיף עולה כי בית-המשפט רשאי להסתמך על עדות יחידה של מתלוננת, ובלבד שיפרט מה הניע אותו להסתפק בעדות זו",not annotated
105700,ME-15-03-14854-33,5.0," חלק מהעדויות על המעשים הן עדויות יחידות של המתלוננות, ועל כן קיימת חשיבות רבה לקבוע את מהימנות העדים",not annotated
108027,SH-09-5632-185,5.0,"מסקנתי זאת נשענת על 3 אדנים מרכזיים:  עדותה המהימנה של המתלוננת;  מצבה הנפשי הנסער בעקבות האירוע;  אמרתו המפלילה של הנאשם לשוטרים בשטח, והיעדר אמון בגרסתו",not annotated
108031,SH-09-5632-185,5.0,עדותה המהימנה של המתלוננת,not annotated
114022,m07001017,5.0," עוד ציין ב""כ הנאשם, כי יש לדחות את גרסתה הבלתי מהימנה של המתלוננת, שכן בעדותה התגלו סתירות מהותיות בנוגע לפרטי האירועים המפורטים בכתב האישום, והראיות שהוצגו ע""י הנאשם, כגון שיחותיו המוקלטות עם המתלוננת, מוכיחות בעליל כי האחרונה לא מסרה אמת בבית המשפט",not annotated
114128,m07001017,5.0,"  לאחר שמיעת העדויות וסקירת הראיות הרלוונטיות, הגעתי למסקנה, כי יש לבכר את גרסתה המהימנה של המתלוננת אודות האירועים, נשוא כתב האישום, על פני גרסתו של הנאשם",not annotated
115331,ME-10-06-20601-774,5.0,"נראה לי, לסיכום, כי גרסאותיהם המהימנות והתומכות זו בזו של המתלוננת ואנדריי, משקפות את האמת כפי שהתרחשה, ואילו הנאשם שיקר וסילף דברים בעדותו, ניסה רק להרחיק עצמו מהאירוע, ועשה רושם בלתי מהימן",not annotated
123389,SH-14-08-42139-726,5.0,"נטען על ידי ב""כ הנאשם  בסיכומיו כי גרסת המתלוננת נסתרת באופן מהותי בשלוש נקודות מרכזיות על ידי ראיות חיצוניות ופורנזיות במהותן, טריקת הדלת, צעקות המתלוננת ויציאתה של המתלוננת מהמרפאה, ומאחר שהאישום נשען כולו על עדותה היחידה של המתלוננת הדבר צריך להביא לדחיית גרסתה ולזיכויו של הנאשם מהמיוחס לו",not annotated
