sentence_id,title,query number,clean_sentence,status
510440,SH-11-04-25817-739,7.0, עדות המתלוננת הייתה נקייה מסימני רצון לפגוע בנאשם או לנקום בו,not annotated
523614,m08001016,7.0," אם יחסי המין ביניהם היו בהסכמה, ובאם סבר הנאשם שהמתלוננת מאותתת לו, באמצעות חפיסת הגלולות שהיא מציגה בפניו, שהיא מוגנת, לא צריך היה לנהוג כפי שנהג, אלא אם כן גירסת המתלוננת, לפיה בכתה ואמרה לו כי היא חוששת מ""בייבי"" - היא היא הנכונה",not annotated
539528,SH-08-07-10806-898,7.0,"באשר להשתלשלות האירועים לאחר שהאוטובוס חנה בחניון, הרי לעניין זה גרסאות המתלוננת והנאשם שונות",not annotated
539533,SH-08-07-10806-898,7.0,"מאידך, גרסת המתלוננת בעדותה בבית המשפט שונה כאמור לחלוטין",not annotated
539599,SH-08-07-10806-898,7.0," בסופו של דבר, לאחר שבחנתי את העדויות בתיק, אני קובע כי עדות המתלוננת מהימנה וגרסתה שקולה והגיונית",not annotated
561687,s04002464-643,7.0,"החוקרת התרשמה, כי עדות המתלוננת ה",not annotated
563910,ME-08-1120-676,7.0,גרסת המתלוננת מעורפלת ובלתי בהירה,not annotated
566001,ME-10-09-35796-400,7.0," יתרה מזאת, גם בנקודה צרה זו גרסת המתלוננת, ולפיה השירותים שהיא נותנת לעולם תחומים בזמן, הגיונית ומסתברת יותר מטענת הנאשם כי בעבור 50 ₪ הסכימה לספק לו שירותי מין ללא כל מגבלת זמן",not annotated
566699,me-09-02-142920,7.0,מן האמור לעיל עולה כי גרסאות המתלוננת והנאשם סותרות ומנוגדות זו לזו באופן קוטבי,not annotated
566837,me-09-02-142920,7.0,"שנית, גרסת המתלוננת ברורה וכוללת הסברים מתקבלים על הדעת להתנהלותה",not annotated
566885,me-09-02-142920,7.0,"גרסת המתלוננת,  אם כן,  מהימנה וכבדת משקל היא,  לנוכח הרושם שהותירה עדותה,  ההתאמה הרבה בינה לבין יתר הראיות, עמידתה במבחן ניסיון החיים והשכל הישר והיות ""עלילת שווא"" מצדה בלתי סבירה בנסיבות העניין",not annotated
570891,ME-12-11-37527-22,7.0,"לשיטתו, גרסת המתלוננת שקרית ועדותה, לטענתו, בלתי אמינה, בנסיבות בהן ראיות שהובאו, סתרו אותה",not annotated
574607,m06003055,7.0," עדות המתלוננת גירסתה של המתלוננת הייתה עקבית בעיקרה, הגיונית ונתמכת בעדויות מהימנות חיצוניות, לכל אורכה",not annotated
577046,ME-08-1120-436,7.0,גרסת המתלוננת מעורפלת ובלתי בהירה,not annotated
590494,SH-14-06-49350-22,7.0," גרסת המתלוננת בעניין אופיים של המעשים המיניים הייתה עקבית, לפיה במפגש בחוף הצוק היא התנשקה עם הנאשם נשיקה מינית, אשר לוותה בליטופים, לרבות ליטופים בחזה , ואילו בשני המפגשים בבתי המלון קיימו יחסי מין אשר כללו חדירה",not annotated
616681,m07008007-405,7.0," לסוגיה זו נצרך בית-המשפט לאור ההקלטה שביצע עד ההגנה י’ ר’, שעל-בסיסה נטען על-ידי ההגנה כי גרסת מתלוננת 2 הינה שקרית",not annotated
623219,m99000907,7.0,"המסקנה היא, שעדות המתלוננת היא מהימנה ולא רק בגלל שהיא נתמכת בעדותה של טטיאנה שפוצ'ניקוב, אלא משום שכל הופעתה בבית המשפט היתה הופעה של בחורה, שאיננה רוצה לתאר יותר ממה שקרה לה, אבל היא מתארת בדיוק את מה שהיא זוכרת",not annotated
630816,ME-12-09-42383-690,7.0,"יש לציין כי גרסת המתלוננת בעניין זה לא היתה שונה מהגרסה שמסרה בעת חקירתה על ידי חוקרת הילדים, יום לאחר האירוע ",not annotated
630889,ME-12-09-42383-690,7.0," כפי שכבר צוין, ניתן לומר כי גרסת המתלוננת וגרסת הנאשם הינן זהות כמעט לחלוטין ביחס למרבית הפרטים ולסיפור המסגרת, ובכלל זאת ביחס להשתלשלות הבדיקה , לתנוחות בהן ישבה המתלוננת, ואף לבדיקת החזה באמצעות הסטטוסקופ",not annotated
631238,k00020198p,7.0," לא רק אמינה ובטוחה גרסת המתלונן בעינינו, אלא גם מתחזקת היא חיזוק של ממש בראיות אחרות",not annotated
635618,ME-10-08-15656-33,7.0, טענה זו אינה מתיישבת עם מימדי הגוף של הצדדים והנסיבות ,not annotated
637608,s05001698,7.0,4) גירסת המתלוננת ביחס למקום ההתרחשות אינה אחידה,not annotated
643034,m00000232-320,7.0, אכן עדות המתלוננת אינה מושלמת אך אין פירוש הדבר שהיא אינה שלמה וככל שנותרו בה ליקויים ופגמים מתגמדים הם נוכח גרעין האמת המוצק שבגרסתה,not annotated
662801,ME-11-06-51536-78,7.0," עדות המתלוננת היתה עקבית הן כשלעצמה, והן בהתייחס לעיקר האמור בעדויותיה במשטרה",not annotated
667053,m04000750-705,7.0," גרסת המתלוננת לפיה הנאשם חדר לביתה באישון לילה מבעד לחלון, והתרחשות האירועים עליהם העידה, מקובלת עליי כתיאור נכון ותואם למציאות",not annotated
683287,s05002497-207,7.0,"מעבר לכך ייאמר כי לו היה ממש בטענת העלילה אף הייתי מצפה כי גרסת      המתלוננת תהא מובנית, מדוקלמת ומתוכננת לפרטי פרטים",not annotated
693220,m01000232,7.0," במקרה זה, מאחר וגרסת המתלוננת איננה מהימנה, אין די בהתנהגותה לאחר המקרה בכדי להוות חיזוק שיש בו כדי לבסס הרשעה בפלילים",not annotated
706789,ME-07-1012,7.0, גרסת המתלוננת סבירה ומהימנה,not annotated
707532,ME-10-09-31383-790,7.0, עדות המתלוננת הייתה מהימנה לחלוטין בעיניי,not annotated
707534,ME-10-09-31383-790,7.0," עדות המתלוננת הייתה סדורה, והמתלוננת לא התבלבלה אף שסיפרה על אירוע בן שלבים אחדים",not annotated
725871,ME-12-08-3491-22,7.0,"יוער, כי גרסת המתלוננת בהודעתה זו מבולבלת, אינה עקבית, ונדמה כי היא סותרת עצמה בתשובותיה",not annotated
750880,m99000941-148,7.0,עדות המתלוננת לא נקייה מפירכות ומקטעים שמחלישים את גרסתה והסניגור היטיב לפרט קטעים אלו בסיכומים היסודיים והמקיפים שהגיש לנו,not annotated
752983,SH-09-11-34935-718,7.0,"בעוד שגרסת המתלוננת הייתה ברורה קוהרנטית והגיונית, תוך שהיא עצמה מותירה רושם אמין וחיובי, הרי שגרסת הנאשם הייתה לא עקבית, מיתממת וחסרת היגיון, כמעט אבסורדית",not annotated
768627,s993897,7.0," אמנם, הוא ממשיך ואומר שהחוקרת לא קבעה שעדות הילדה באירוע הים לא מהימנה, ולכן ניתן להרשיעה",not annotated
768639,s993897,7.0," באשר לאירוע במקלחת, מעידה החוקרת וקובעת בגיליון הערכת מהימנות  מיום 28/10/99 , שעדות הילדה מהימנה",not annotated
769832,ME-15-11-34046-11,7.0, המאשימה מבקשת כי בית המשפט ייקבע כי גרסת המתלוננת מהימנה,not annotated
769912,ME-15-11-34046-11,7.0," חוקרת הילדים התרשמה, בזמן החקירה, כי גרסת המתלוננת מהימנה, וכי חוותה את שסיפרה",not annotated
770499,ME-15-11-34046-11,7.0," כפי שציינתי עד כה, גרסת המתלוננת מהימנה עלי ואיני מטיל כל ספק במהימנותה",not annotated
773061,ME-11-08-19586-11,7.0," המאשימה טענה כי עדות המתלוננת היתה עקבית לכל אורך הדרך, וכי ניתן להתרשם שאין סתירות בין הודעותיה במשטרה  לבין עדותה בבית המשפט",not annotated
799541,ME-07-1012-886,7.0, גרסת המתלוננת סבירה ומהימנה,not annotated
801659,s00001954-407,7.0," אני קובע כי גירסת המתלוננות הינה מהימנה ומשקפת את אשר ארע בתקופה בה עבדו תחת מרותו של הנאשם, כמפורט בכתב האישום",not annotated
805639,ME-16-06-33538-22,7.0," במקרה זה עדות המתלוננת מהימנה, אך קיים ספק שמא חלק מדברי המתלוננת מהווה העצמה של האירוע הטראומתי שעבר עליה",not annotated
809332,ME-04-1064-112,7.0," ב""כ הנאשם טוען כי ההגנה הוכיחה כי הנאשם לא ביצע כל עבירות מין, כאשר גרסאות המתלוננות הינן קלושות, כבושות ובלתי אמינות",not annotated
812428,ME-12-07-40109-11,7.0,"גרסת המתלוננת מהימנה, במיוחד לגבי חלקו של נאשם 1, לגביו נמצאו חיזוקים אובייקטיביים שאינם באים מפיה של המתלוננת או מהסקת מסקנות הגיוניות מדרך פעולתה והתנהלותה",not annotated
812461,ME-12-07-40109-11,7.0,"שתיים הן השאלות שעלינו להכריע בהן; האם גירסת המתלוננת מהימנה, ובמידה והתשובה לכך חיובית, האם יש להרשיע את שלושת הנאשמים בעבירות בהן הואשמו, או שמא רק את חלקם?",not annotated
814646,ME-12-07-40109-11,7.0,"מכאן נשאלת השאלה הכיצד אפשר לומר, בנשימה אחת, כי גירסת המתלוננת היא מהימנה ובה בעת להימנע מהרשעת שני הנאשמים 2 ו- 3 כשגם מעשיהם שלובים באותה גירסה?",not annotated
814733,ME-12-07-40109-11,7.0, אני קובע כי גירסת המתלוננת מהימנה בעיקרה,not annotated
831890,ME-09-06-20584-1,7.0,לאחר מכן תשאל השאלה האם אמינה גרסת המתלוננת והאם אכן בוצעו בה עבירות מין קשות,not annotated
851238,ME-10-07-21310-4,7.0,"למעלה מכך, גרסת המתלוננת בעניין זה, הייתה חדה, ברורה ועקבית, לאורך כל חקירותיה ואף בעדותה בפנינו, והתנגדותה למעשי הנאשם בה, החל מהמגע הראשוני, הוכחה בפנינו",not annotated
852068,SH-08-9929-69,7.0, בעניין זה גרסת המתלוננת הייתה חד משמעית ואילו הנאשם שלל את הגרסה וטען שלא הייתה נסיעה כזו,not annotated
852404,s05004390-44,7.0,"לגבי הקשר הוירטואלי, גירסאות המתלוננת והנאשם דומות, וניתן לקבוע לפיהן כי השניים הכירו בצ'ט, ""שוחחו"" פעם אחת בצ'ט למשך זמן ארוך, והשיחות הבאות ביניהם היו בטלפון",not annotated
852994,s05004390-44,7.0,"השנייה - שגרסת המתלוננת אינה הגיונית גם בשל כך שלא מתקבל על הדעת שהנאשם חשף בפניה, לכאורה, את איבר מינו והכריח אותה לבצע בו מין אוראלי, והכול בחניון של קניון הראל, וזאת כאשר בהיותם בעין חמד הנאשם נבהל מאד מרכב שעבר במקרה במקום",not annotated
9351,SH-10-11-34300-792,8.0," כבר כעת אציין כי מלבד גרעין דבריה של המתלוננת כפי שהובא בעובדות כתב האישום המתלוננת סיפרה גרסאות נוספות, ופרטים רבים נוספים שאינם  מתיישבים זה עם זה  וכי יש בהודעותיה הן בפני מר הרן והן בפני בית המשפט סתירות פנימיות רבות כפי שאפרט בהמשך",not annotated
26261,s03001805-223,8.0,"1 המתלוננת מסרה עדות ארוכה, נרחבת, מפורטת וברורה, אודות מסכת האירועים הרלבנטית",not annotated
28587,SH-10-01-40299-583,8.0,"המתלוננת העידה עדות עקבית ומהימנה, לא הגזימה ולא ייחסה לנאשם אמירות או מעשים העולים על הארוע הנקודתי אותו תארה",not annotated
32490,m00000935-103,8.0," המתלוננת מסרה במשטרה ובעדותה בבית המשפט שתי גרסאות סותרות, האחת המפלילה את הנאשם, והאחרת - שחוזרת בה מגרסת ההפללה",not annotated
32686,m00000935-103,8.0,חברי השופט ב,not annotated
45202,m01001080-516,8.0," טוענת ב""כ הנאשם בסיכומיה, כי המתלוננת מסרה בהודעתה באשר לאיומי הנאשם במהלך העימות , גרסה שונה מזו שהונצחה בתמליל ",not annotated
48311,SH-13-08-24175-34,8.0,"המתלוננת מסרה לטעמי עדות סדורה, עניינית ועקבית שלא נסתרה ולא עורערה",not annotated
69201,s05001554-296,8.0, בעניין הפיטורין מסרה המתלוננת שתי גרסאות שונות לפיטוריה: האחת - הנאשם התלונן בפני בעל החנות כי היא אינה מוכנה לסחוב ולפרק סחורה ,not annotated
73701,SH-15-06-23701-11,8.0,"עלה בידי ההגנה לבסס באורח משמעותי את הטענה כי בזמן אמת, בסמוך לאחר האירוע, מסרה המתלוננת גרסאות עובדתיות המצויות בפער ממשי לזו שמסרה בעדותה בבית המשפט, ואשר במידת מה אף מאששות את גרסתו העקבית של הנאשם לפיה הטיל את מימיו ולא ביצע כל מעשה בעל קונוטציה מינית",not annotated
73840,SH-15-06-23701-11,8.0," במקרה שלפני, עלה בידי ההגנה לבסס באורח משמעותי את הטענה כי בזמן אמת, בסמוך לאחר האירוע, מסרה המתלוננת גרסאות עובדתיות המצויות בפער ממשי לזו שמסרה בעדותה בבית המשפט, ואשר במידת מה אף מאששות את גרסתו העקבית של הנאשם לפיה הטיל את מימיו ולא ביצע כל מעשה בעל קונוטציה מינית",not annotated
77682,m03001164,8.0,"5 בעת מתן עֵדוּתָהּ, מסרה גירסה מלאה בפני חוקרתהילדים, תוך פירוט מַעֲשֶׂי הנאשם וּתחושותיה; גירסה עליה חזרה בפנינו הן בחקירתה הראשית והן בחקירתה הנגדית, במשך שעות רבות",not annotated
87783,s04009041-538,8.0,"המתלוננת- למרות הקושי והמבוכה - מסרה עדות ברורה וכנה, שבה חשפה את מערכת יחסיה עם הנאשם, בישירות, בגילוי לב וללא כחל וסרק",not annotated
114129,m07001017,8.0," המתלוננת מסרה עדות עקבית, מפורטת ומדויקת דיה, אודות החוויות הקשות שעברה, ועשתה רושם אמין ביותר על בית המשפט",not annotated
114934,ME-10-06-20601-774,8.0, גם המתלוננת בעדותה מסרה גירסה דומה בענין זה ,not annotated
115679,ME-11-07-21438-1,8.0," המתלוננת מסרה עדות מאוזנת, ללא מגמת הפללה והייתה עקבית",not annotated
122947,SH-14-08-42139-726,8.0,המתלוננת העידה עדות ברורה ורציפה ונראה כי השתדלה לתאר את האירוע שחוותה כהווייתו,not annotated
123436,SH-14-08-42139-726,8.0, המתלוננת העידה עדות ברורה ורציפה ונראה כי השתדלה לתאר את האירוע שחוותה כהווייתו,not annotated
142592,ME-13-07-36795-33,8.0," אכן, בהודעתה במשטרה מסרה המתלוננת גרסה מפורטת יותר, אך הפרטים שנמסרו בגרסה זו אינם מהווים את ליבת האירועים המבססים את העבירות בהן הורשע המערער, אלא רק את המסגרת שמסביב",not annotated
156555,ME-13-10-20400-22,8.0,"הואיל ובסופו של דבר שאלת המהימנות נתונה בסופו של יום להערכת בית המשפט אומר כי לאחר צפייה ממושכת במתלוננת כפי שצולמה בתקליטורי חקירתה הובילה אותי  לאותה המסקנה, לפיה המתלוננת מסרה עדות מהימנה כפי שסברה גם חוקרת הילדים",not annotated
176890,k00011398p,8.0, המתלוננת העידה לפנינו עדות ארוכה ,not annotated
178130,s05001085-150,8.0, לאחר מסירת העדות במשטרה נסעו עם המתלוננת לבית החולים וולפסון שם מסרה המתלוננת עדות נוספת,not annotated
196945,m05000543,8.0,"לסיכום, המתלוננת מסרה גרסה שלמה, מלאה והגיונית אודות ארבעת האירועים נשוא כתב האישום",not annotated
223146,ME-09-1002-752,8.0,", מסרה גירסה נכונה, שהיא הבסיס לגירסתה כולה",not annotated
236688,SH-09-09-8105-83,8.0,"המתלוננת מסרה את גרסתה הראשונית המפורטת בדו""ח, לפיה הגיעה למועדון לבקר ידיד, נשארה במקום עד שתתחיל התחבורה הציבורית ואז ניצל הנאשם את עובדת המצאם לבדם במקום",not annotated
239973,s02003487-171,8.0," המתלוננת מסרה עדות עקבית ומהימנה עלי, ולא הסתירה לבטיה להגיש תלונה בעבירת מין בהיותה אשת איש  ממגזר מסורתי עם כל אי הנעימות שבצעד זה",not annotated
260354,s00003108,8.0," מעיון בנ/1 ניתן ללמוד שהמתלוננת מסרה בביהמ""ש גירסה דומה ועקבית בדיוק כמו שמסרה באימרתה במשטרה",not annotated
282416,s97012424,8.0,"המתלוננת העידה עדות כנה, אמיתית ומשכנעת",not annotated
298064,m05001053-441,8.0,"במשטרה  מסרה המתלוננת את העדות הבאה: ""הוא הכניס את הידיים שלו לתוך הנרתיק שלי ואחר כך הוא שפשף עם האצבעות שלו בדגדגן שלי ואמר לי כן זה טוב לך, אני יודע שאת זקוקה לזה, ואני בוכה וכל הזמן הוא ממשיך לשפשף לי את הדגדגן",not annotated
303501,s04004944-197,8.0," לגישת המאשימה, המתלוננת מסרה עדות אמינה, המגוללת את קורותיה כהוויתם",not annotated
310528,ME-11-06-2577-640,8.0," בפני חוקרת הילדים ובפני בית המשפט העידה המתלוננת עדות דומה באשר לנסיבות האירוע והתרחשותו – סבה ישב על ידה בכיסא נפרד, באולם התפילה",not annotated
311437,T630000J,8.0," היא עדות כבושה רק בתוך כדי שרותה הצבאי של המתלוננת בהיותה מעל גיל 18 שנה, הביאה המתלוננת את גירסתה החמורה והנוראה, נגד הנאשם",not annotated
324695,ME-12-09-33735-44,8.0,"המתלוננת מסרה גרסה ארוכה ומפורטת, תוך התייחסות למקומות בהם התבצעו המעשים ; לתחושות שחשה, הן תחושות פיזיות (למשל: ""הוא ריסס לי ונשכב עליי והחדיר לי את איבר המין שלו לפי הטבעת שלי",not annotated
351769,s02005082-239,8.0,"ב""כ הנאשם בסיכומיה טוענת כי מחומר הראיות עולה כי המתלוננת מסרה גירסאות שונות בפרטים עובדתיים מהותיים רבים",not annotated
359831,SH-12-215-459,8.0," התוצאה המצטברת מהאמור לעיל הנה כי המתלוננת מסרה עדות ""חיה"", מלאת פרטים ואותנטית, אשר סימני האמת נכרו בה לאורך כך הדרך",not annotated
367549,m08000502-117,8.0," מבחן ההתרשמות הישירה מהעדות, מקשה על קביעת ממצאים לחובתו של הנאשם על סמך עדותה של המתלוננת, זאת לנוכח העובדה שהמתלוננת מסרה בעדותה גרסה כללית בלבד על האירועים, ובחקירתה לפני החוקר המיוחד חזרה בה מעיקר הגרסה המפלילה",not annotated
378645,SH-16-11-39338-564,8.0,המתלוננת מסרה עדות עקבית ומפורטת,not annotated
410880,ME-20-01-13777-33,8.0, נוכחתי כי הדברים כפי שהוצגו בפני המתלוננת היו מטעים שעה שהמתלוננת מסרה גרסה זהה בנדון במשטרה ,not annotated
416542,m06003016,8.0,"לאחר שהמתלוננת מסרה בחקירה החוזרת את הגרסה המזכה , ביצעה חוקרת הילדים הערכת מהימנות חדשה ",not annotated
473033,m04001110,8.0,"בעדותה, מסרה המתלוננת גרסה שלימה, עקבית והגיונית של השתלשלות האירועים נשוא כתב האישום",not annotated
485011,s00003824-279,8.0,"המתלוננת, סטודנטית כבת 27 שנה , העידה עדות קוהרנטית ורציפה",not annotated
490595,SH-08-1102-198,8.0,"המתלוננת מסרה גרסה אמינה, סדורה ולא מוגזמת, אשר חוזרת על עצמה במדוייק בכל חקירה ללא ניסיון מצד המתלוננת להתיישר עם שאלות שנשאלה",not annotated
508352,s00012094-286,8.0," כן נטען כי המתלוננת מסרה גרסה כוזבת בכל הנוגע להטרדות שסופרו לה, כביכול, על ידי מנהל ביה""ס  שהיו כלפי מורות אחרות ובעניין זה סותרת עדותו של ע""ת 3, יצחק מרכוס, שהובא כעד מטעם התביעה, את גרסת המתלוננת",not annotated
553488,me-06-3028,8.0," גרסה נוספת מסרה המתלוננת בפני הבורר, שם תיארה את הנאשם במטבח כשבידו סכין והוא מאיים שיהרוג אותה ואז א' ופ' הגיעו ותפסו את הנאשם וגם ה' הגיעה ואז הנאשם יצא מהמטבח והכה את המתלוננת – עמ' 17-16 – לתרגום לעברית",not annotated
566803,me-09-02-142920,8.0,"   לא זו אף זו,  בעדותה בפנינו,  מסרה המתלוננת גרסה סדורה גם לעניין זה,  ועמדה עליה בחקירתה הנגדית ",not annotated
572582,ME-14-10-21304-44,8.0, המתלוננת מסרה בבית המשפט עדות סדורה שנמסרה באופן מעורר אמון,not annotated
578533,s02001435-499,8.0," כך אומרת המתלוננת בעדותה בביהמ""ש, אך במשטרה מסרה המתלוננת גירסה אחרת והיא, שהנאשם אמר לה לעמוד על ארבע עם הידיים על השק והוא שם את איבר מינו ליד איבר מינה וזז",not annotated
626777,ME-10-01-24354-12,8.0, בנקודה זו מסרה המתלוננת גרסה סותרת כמפורט להלן:,not annotated
630862,ME-12-09-42383-690,8.0," המתלוננת מסרה גרסה זהה בעת חקירתה במשטרה  וגם אם אמנם מסרה גרסה שונה בעניין זה לאמה, הרי שמדובר בעניין נקודתי ביותר ושולי יחסית, שאין בו כדי להפחית מהמהימנות החיובית הכללית שיש לייחס לעדותה",not annotated
642411,s04004265-324,8.0,"המתלוננת אומנם מסרה בבית המשפט עדות מעט מבולבלת, תוך שהיא  קופצת מעניין לעניין ומנושא לנושא, ועם זאת, מתוך מכלול דבריה, התקבלה תמונה ברורה לגבי נסיבות האירוע ומעשיו של הנאשם, תמונה, שעלתה בקנה אחד עם הגרסה שמסרה במשטרה",not annotated
689422,s05001930-158,8.0,"לא רק שמתלוננת זו מסרה גירסאות שונות לגבי מועד האירוע הנטען השני   , אלא שגם לגבי האירוע הנטען השלישי  יש אי דיוק בתאריכים הנטענים",not annotated
692509,s016253,8.0,"בעימות מסרה המתלוננת גרסה זהה לזו שבביהמ""ש והנאשם הכחיש האשמותיה",not annotated
