sentence_id,title,query number,clean_sentence,status
534396,ME-15-10-1855-55,5.0,"באשר לטענות ההגנה בסיכומים, לעניין סתירות וגרסה מתפתחת לכאורה של המתלוננת ג' נ', אין לי אלא להפנות לדברים שכתבתי לעיל בדיון בעניינה של ש' ולפסקי הדין אליהם הפניתי שעניינם הקושי הייחודי של מתלוננים ומתלוננות בעבירות מין למסור באופן מיידי גרסה סדורה ושלמה בשל הטראומה אותה הם חוו",not annotated
548390,m02001238,5.0," לכאורה, די לנו בגירסתה האמינה והמהימנה של המתלוננת בכדי להרשיע את הנאשם בעבירה המיוחסת לו",not annotated
548435,m02001238,5.0,"אין כל ספק כי מצב נפשי כזה אשר, כאמור, מחייב גם היום טיפול פסיכיאטרי תרופתי ומעקב לטווח ארוך, מהווה סיוע של ממש לגירסתה הכוללת של המתלוננת, הגם שסיוע אינו נדרש לה",not annotated
548474,m02001238,5.0," לעומת גירסתה האמינה, המהימנה והבלתי נסתרת של המתלוננת, אשר קיבלה סיוע, חיזוק ואימות מכל הראיות הנוספות כאמור לעיל, הרושם העולה מגרסאותיו של הנאשם, מעדותו בבית-המשפט ומהתנהגותו במהלך הדיונים הוא שלילי ובלתי אמין",not annotated
550284,s06002525-311,5.0," הנה כי כן, ניצבות בפנינו שתי גרסאות: האחת – גרסתה המהימנה והבלתי מקועקעת של המתלוננת, שהיא נטולת מניע, והשניה – גרסתו הבלתי מהימנה בעליל של הנאשם, שבנקודה מסוימת,  מחזק בדבריו את גרסת המתלוננת",not annotated
551194,ME-12-5501-303,5.0,"סוף דבר לעניין מעשי האינוס הרשעה בעבירת מין על סמך עדות יחידה של מתלוננת, דורשת הנמקה מיוחדת כאשר ההנמקה חלה על כל עבירה בנפרד ועוצמתה נגזרת מעוצמת העדות ועוצמת הבעיות המכרסמות בה",not annotated
553922,me-06-3028,5.0,"זאת ועוד, המדובר בעדות כבושה וכאמור למתלוננת אין הסברים לכבישת עדותה, הן ביחס לאירוע זה והן ביחס לאירועים האחרים",not annotated
558709,ME-12-10-2187-137,5.0,"הנה כי כן, יש בעדותה המהימנה של המתלוננת, שנמצאו לה חיזוקים בראיות אחרות, כדי להביא לקביעה, במחלוקת הליבה, ולפיה, הוכח, במידה הנדרשת במשפט, שהחדרת אצבעותיו ואיבר מינו של הנאשם לאיבר מינה של המתלוננת, נעשו שלא בהסכמתה החופשית, ושעה שהנאשם היה מודע להיעדר ההסכמה",not annotated
560458,ME-11-03-34914-325,5.0," לגופו של ענין, מעדותו של הנאשם במשטרה ובבית המשפט עולה כי בניגוד לעדותו הברורה והקוהרנטית של המתלונן,  עדות הנאשם היתה רצופת שקרים וסתירות, שיש בהם כדי להוות חיזוק לעדות המתלונן",not annotated
563327,m01953,5.0,"לפנינו אם כן, עדות מול עדות, עדות הנאשם המכחיש את בצוע העבירות, מול עדותה היחידה של המתלוננת",not annotated
566293,s06002247-262,5.0,"מכאן, כדי לבסס הרשעה על עדות יחידה של מתלוננת, נדרש בית המשפט ליתן הנמקה ממשית, שיהא בה כדי לסלק את החששות המלווים עדות של קרבן של עבירות מין",not annotated
566304,s06002247-262,5.0,"מידת הוכחה זו של הספק הסביר, מקבלת משנה תוקף כאשר מדובר בהרשעה על פי עדות יחידה של מתלוננת",not annotated
566725,me-09-02-142920,5.0,גרסתה המפלילה של המתלוננת כפי שבאה לידי ביטוי בעדותה בפנינו הותירה רושם מהימן וכי אמת בפיה,not annotated
567862,m98905,5.0,"לוח תצלומים זה , הוגש במהלך עדותה הראשית של המתלוננת, בהסכמה, ובלא שב""כ הנאשם ביקש לזמן לחקירה את מצלם התמונות , כדי לחוקרו על הכיתוב הנ""ל, המדבר בעד עצמו",not annotated
568002,m98905,5.0," בדומה לאופן שבו נהגנו לגבי עדותה הראשית של המתלוננת ביחס לאירוע הראשון, נביא גם עתה את עדותה של המתלוננת בעדותה הראשית, ביחס לאירוע השני בו קא עסקינן, ככתבה וכלשונה, בהיותה תמציתית, ענינית וממוקדת",not annotated
572087,SH-09-4143-158,5.0," מכאן, כי גרסתה לפיה סיפרה לחברתה השוטרת לא עמדה אולי לפני החוקרת, עם זאת, כאמור לעיל, בגרסתה הראשונה של המתלוננת, בתרשומת הראיון עם הגב' עזריאל, נכתב ביחס לאירוע האמור באישום הראשון: ""מ",not annotated
573544,ME-14-10-21304-44,5.0,"כאמור, אליבא עדותה המפורשת של המתלוננת היא לא הסכימה להיבעל על ידי הנאשם ולא הסכימה לבצע עמו מין אנאלי",not annotated
573552,ME-14-10-21304-44,5.0," עדותה האמינה של המתלוננת ושאר הראיות התומכות בה, מבססות כנגד הנאשם את העבירות שיוחסו לו בכתב האישום",not annotated
574668,m06003055,5.0,"מצבה הנפשי של המתלוננת לאורך השנים והזדקקותה לטיפול פסיכולוגי מתמשך עקב טראומת אינוס, כפי שהעידה הפסיכולוגית מ' – מתווספים לשאר הראיות שמניתי ואשר יש בהן  לתמוך, לאשש ולחזק את גירסתה האמינה של המתלוננת",not annotated
577450,s011088,5.0,"בית המשפט מזהיר עצמו כי בפניו עדות יחידה של המתלוננת, גם אם יימצאו תימוכין לעדותה, הרי החובה על פי הדין, כי בית המשפט ינקוט משנה זהירות בכל הקשור בהרשעת נאשם על סמך עדות יחידה",not annotated
577954,s011088,5.0,עדותה היחידה של המתלוננת:,not annotated
589700,SH-11-09-5689-9,5.0,"אני דוחה את הטענה לפיה בדתה המתלוננת את הסיפור כדי להצדיק בפני פן את כניסתה לסוויטה הקטנה לבד עם הנאשם, לנוכח עדותם האמינה של המתלוננת ושל פן, ובשל העדר כל בסיס לטענה",not annotated
593962,M-NoPub-ZC-5-306-L,5.0,"החוקרת תמר קניספל קבעה בחוות דעתה , כי הילדה מהימנה והמליצה לגבות עדות נוספת מהילדה על ידי חוקר/ת ילדים דובר/ת ערבית",not annotated
595344,M-NH-2-003-L,5.0,"1982:ב "" הרשיע בית-משפט על עבירה לפי סימן ה' בפרק י' ל, התשל""ז-1977, עפ""י עדות יחידה של הנפגע, יפרט בהכרעת הדין מה הניע אותו להסתפק בעדות זו""",not annotated
595346,M-NH-2-003-L,5.0,"מאחר והחלטתי להרשיע את הנאשם בעבירות המיוחסות לו בכתב האישום, וזאת על סמך עדותה היחידה של המתלוננת, העומדת בסתירה לעדותו של הנאשם, להלן נימוקיי מדוע החלטתי לעשות כן",not annotated
600198,ME-18-12-64564-33,5.0,"ראיות התביעה לביסוס האישום, מתמקדות בעדותה המוקלטת והמוסרטת של המתלוננת בפני חוקרת הילדים, ובעדותה של זו האחרונה, כאשר בשל איסור מטעמה, לא העידה הקטינה בביהמ""ש",not annotated
604834,m06007025-296,5.0," גרסתה המיידית של המתלוננת תואמת את עדותה, ובעת שמסרה את תלונתה המיידית לא ידעה כי שיחתה הוקלטה",not annotated
605316,m98386d,5.0,"החוקרת תמר קניספל קבעה בחוות דעתה , כי הילדה מהימנה והמליצה לגבות עדות נוספת מהילדה על ידי חוקר/ת ילדים דובר/ת ערבית",not annotated
609652,SH-18-05-47230-11,5.0," לעדותו המהימנה של א' מצטרפים חיזוקים משמעותיים, כפי שיפורט להלן, ומכאן שאין מדובר בעדות יחידה של מתלונן בעבירות מין",not annotated
613898,ME-09-1132-667,5.0,"ב  292) נקבעה לראשונה ההלכה, ולפיה אין סיבה שלא לראות בעדות מהימנה של ילדה, שנמסרה בפני חוקרת ילדים, ראיה נסיבתית המסייעת לעדות מהימנה אחרת של ילדה, שאף היא נמסרה בפני חוקרת ילדים",not annotated
617522,m07008007-405,5.0," בערבו של יום מצאנו, אפוא, ליתן אמון מלא בגרסתו הגולמית של מתלונן 5, כי הנאשם אילצו לבצע בו מין אוראלי ובתוך כך נגע בפי הטבעת שלו, וזאת במסגרת שני אירועים מובחנים, כשאחת הפעמים הייתה בתוככי המסגד, לשם אף הוביל את חוקרי המשטרה",not annotated
626828,ME-10-01-24354-12,5.0," גם בעדותה הנוספת של המתלוננת בביהמ""ש  מסרה כי על האינוס סיפרה בפעם הראשונה בחייה במשטרה",not annotated
628402,ME-17-09-14743-33,5.0,"לשיטת ההגנה, עדותה ""הפגומה"" של המתלוננת בנוגע לתדירות המעשים, משליכה על כל עדותה ויש לדחותה כבלתי אמינה",not annotated
628447,ME-17-09-14743-33,5.0," בהתאם להוראת  ל  התשל""א-1971, ניתן לבסס הרשעה על עדות יחידה של מתלונן בעבירת מין אך על בית המשפט לנמק את טעמיו לכך",not annotated
630689,ME-12-09-42383-690,5.0," על כל פנים, עדותו של פרופ' רכס אינה מעלה ואינה מורידה מהעיקר בתיק, שהוא עדותה הברורה של המתלוננת",not annotated
630781,ME-12-09-42383-690,5.0," יש לומר כבר עתה, כי גרסתה העובדתית של המתלוננת לאירוע, חקירותיה אצל חוקרת הילדים ועדותה בבית המשפט, הותירו כולן רושם חיובי ומהימן למדי",not annotated
630854,ME-12-09-42383-690,5.0," מהאמור לעיל עולה אפוא כי אין מדובר בסתירה של ממש בין גרסתה הישירה של המתלוננת לבין הגרסה שמסרה לאמה, אלא במקרה הנראה יותר כאי הבנה, שאין בו כדי להחליש את גרסת המתלוננת",not annotated
631076,ME-12-09-42383-690,5.0," התוצאה הינה כי חרף גרסתה המהימנה של המתלוננת ושל הוריה, הצטברו מספר תהיות ושאלות שיש בהן כדי ליצור ספק סביר, בעיקר לנוכח גרסתו העקבית והקוהרנטית של הנאשם",not annotated
635317,ME-10-08-15656-33,5.0," בהסתמך על עדותה האמינה של המתלוננת, במהלכה לא נסחפה להפליל את הנאשמים, תארה בעדינות ובנחישות רק את מה שידעה וראתה בוודאות לרבות בנושא הסכין אותו תארה לפרטי פרטים והבהירה כי לא נעשה בו שימוש, אני קובע כי הנאשם 1 החזיק בידיו סכין",not annotated
635399,ME-10-08-15656-33,5.0,"אני קובע על סמך עדותה האמינה של המתלוננת כי הוכחה גניבת כסף בנסיבות היוצרות עבירת שוד, אך לא הוכח גובה הסכום שנשדד, ",not annotated
638795,SH-10-11-13054-33,5.0," לאחר מכן, ינותחו עדויותיהן הפרטניות של המתלוננות וטענותיו השונות של הנאשם ביחס אליהן, כל זאת על רקע הדיון העקרוני בעבירות ובטענות ההגנה של הנאשם ביחס לאישומים",not annotated
647066,s993830,5.0," כפי שבואר לעיל, הנדבך המרכזי בהרשעתו של הנאשם היא עדותה האמינה והמשכנעת של המתלוננת, כשאליה מצטרפות ראיות נוספות המחזקות ומעבות אותה",not annotated
648309,m01001198-543,5.0," לאור גירסתה המהימנה של המתלוננת, שנתמכת במצבה הנפשי והפיזי לאחר האירוע ובדברי הנאשם בהודעתו, בעימות שנערך עם המתלוננת ובשיחת הטלפון ביניהם, כפי שהובאו לעיל, וּמאחר ודברי הנאשם לפיהם המתלוננת הסכימה לקיים עימו יחסי-מין אינם מהימנים עליי, אני מציע לחבריי הנכבדים שבמותב להרשיע את הנאשם בעבירה שיוחסה לו בכתב-האישום",not annotated
655317,s02003061-156,5.0," לא ניתן להצביע בבירור על אילו משני הביקורים בביתה של המתלוננת מדובר, אך לאור גירסתה הנחרצת של המתלוננת כי הביקורים בביתה אירעו במהלך יום העבודה בשעות הבוקר, עדות זו מכרסמת באמינותה",not annotated
655510,s02003061-156,5.0," לא ניתן גם להתעלם מכך שגירסתה הראשונה של המתלוננת היתה כי התנגדה למעשיו של הנאשם, וכי המעשים נכפו עליה באופן שנאנסה ממש בעוד שהחלק החמור בכתב האישום עניינו בעילה אסורה בהסכמה",not annotated
657705,m98000923-197,5.0,"כלומר, הגירסה שסיפרה מיקה כאילו נמסרה מפי המתלוננת, איננה יכולה להחשב לגירסה נוספת של המתלוננת, כפי שהסניגור ייחס לה שוב ושוב בסיכומיו, שכן אין זו גירסתה של המתלוננת, אלא גירסה ""משופצת"", אם תרצה ""מנופחת"", של מיקה",not annotated
661561,m021063,5.0,"מדֶרך הטבע, ועל-אף שבוטלה דרישת הסיוע לעדוּת יחידה של מתלוננת בעבירות-מין, הובאו בפנינו ראיות נוספות במטרה לעבּוֹת, לחזק וּלאמת את גירסת המתלוננת",not annotated
662706,m021063,5.0," לעומת גירסתה האָמינה והמהימנה של המתלוננת והראיות הנוספות התומכות וּמשלימות אותה כאמור לעיל, הרושם העולה מעדוּת הנאשם וּמניתוח מִגוון גירסותיו וטענותיו - הוא שלילי וּבלתי-אמין",not annotated
662737,m021063,5.0,"עדותה האָמינה והברורה של המתלוננת, כשאליה נוספות ראיות בעלות משקל, המחזקות, מאששות וּמאמתות אותה, כשחלק מהן עולות בגדר סיוע של ממש - גם כאשר לא נדרש כזה לענייננוּ - עומדת כנגד גירסתו הרעועה והבלתי-אמינה וטיעוניו המופרכים של הנאשם",not annotated
662788,ME-11-06-51536-78,5.0,"מלשון הסעיף עולה כי בית-המשפט רשאי להסתמך על עדות יחידה של מתלוננת, ובלבד שיפרט מה הניע אותו להסתפק בעדות זו",not annotated
662794,ME-11-06-51536-78,5.0,"ובענייננו: בנוסף לעדותה העקבית, הברורה והאמינה של המתלוננת ולפירוט מדוע ניתן להסתפק בעדות זו להרשעת הנאשם כמפורט להלן, יפורטו להלן גם ראיות חיצוניות בעלות משקל עצמאי משלהן, המחזקות את גירסת המתלוננת ונותנות לה משנה תוקף",not annotated
663603,ME-11-06-51536-78,5.0,"על כן: עדותה המהימנה של המתלוננת חוזקה איפוא בעדות הנאשם דלעיל, לכל הפחות כראשית הודייה",not annotated
664279,ME-11-06-51536-78,5.0," גם לא מצאתי, גם לא בחווה""ד נ/14, עילה או הצדקה לגרוע ממשקל עדותה העניינית והמהימנה של המתלוננת ומגירסתה",not annotated
666747,m04000750-705,5.0," לטענתו, גרסתה המפלילה של המתלוננת הנה עלילת כזב שנרקמה מתוך יצר נקמה",not annotated
666765,m04000750-705,5.0," בבואנו להכריע במחלוקות העובדתיות בעניין האירועים שהתרחשו בדירת המתלוננת, עומדת לפנינו עדותה היחידה של המתלוננת, מול הכחשתו של הנאשם את עצם נוכחותו בדירה, וממילא – את המעשים המיוחסים לו",not annotated
670450,ME-10-06-32318-4,5.0," הנאשם מסר גרסה תמימה, לפיה במהלך המפגש, המתלוננת והוא שוחחו, שיחקו עם חתוליו ועם מכשיר ה""אייפון"" שלו",not annotated
672544,ME-10-07-35429-3,5.0,עדותה המיידית של המתלוננת נתמכת בחיזוקים רבים והראשון שבהם מצבה הנפשי מיד לאחר האירוע,not annotated
674614,m014018,5.0," כנגד גרסתה האחת והמלאה של הילדה עומדת הכחשת הנאשם - וגרסת להד""ם",not annotated
674620,m014018,5.0," לסיכום, עדותה האמינה של הילדה, כשאליה מתווספות ראיות הסיוע האמורות, אינה מותירה ספק באשמת הנאשם",not annotated
688593,m98000942-192,5.0," ברי, כי אם המצב מורכב בעדות כבושה של מתלוננת בגירה בעבירות מין, על אחת כמה וכמה כאשר מדובר בקטינה",not annotated
693205,m01000232,5.0, בשני מסמכים שונים שהוצאו על ידי המחלקה לרפואה דחופה בבית החולים כרמל ניתן להבחין בשתי גרסאות שונות של המתלוננת,not annotated
693211,m01000232,5.0,"לעומת גרסתה המעורערת של המתלוננת עומדות גרסאותיהם העקביות והאמינות של שלושת הנאשמים, אשר מתיישבות זו עם זו",not annotated
694181,SH-09-11-13880-22,5.0,"סוף דבר – לאחר שבית המשפט הזהיר את עצמו שלפניו עדותה היחידה של המתלוננת, על סמך תוכנה המידתי של התלונה ואותות האמת שבה, התמיכה שתומכים בה עדויות האם והשוטר, מתבססת מסקנה שיש לקבל עדות המתלוננת במלואה ולהעדיפה על גרסתו המתכחשת של הנאשם, שנדחתה מחוסר אימון",not annotated
694628,m08001049-106,5.0,נוכח גרסתה האמינה של המתלוננת והחיזוקים לדבריה הוכח כי הנאשם בעל את המתלוננת שלא בהסכמתה החופשית ו/או בהיותה שרויה במצב בו לא היה ביכולתה ליתן הסכמה חופשית ליחסי המין,not annotated
694734,m08001049-106,5.0," יש לתת אמון בעדותה המהימנה של המתלוננת לעניין זה כי מדובר במקרים רבים של הדחה לסמים מסוכנים ולמעשה כך הייתה שגרת יומה של המתלוננת במחיצתו של הנאשם על כך יש להוסיף את בקיאותה הרבה בסמים המלמדת כי אכן בעלת ניסיון היא, בצירוף הראיות המחזקות הכל כמפורט לעיל",not annotated
695666,s00002865-124,5.0, משעה שעדותו של חמדאן נפלה – נותרנו מול עדות יחידה של מתלוננת בעבירת מין,not annotated
702351,SH-07-2293-935,5.0,"בפני מ' הוצגה הגרסה השלישית לפיה המתלוננת הח'טה לנקום בנאשם בעקבות סירובו להסיע אותה  והיא ניסתה לסחוט את הנאשם בשיחה הטלפונית עם שאול, שאם הנאשם לא יתן לה 50,000 ₪  היא תספר לא' את הסיפור והוא ירצח אותו ",not annotated
702428,SH-07-2293-935,5.0,"לענייננו, למרות שהעדפתי גרסתה של המתלוננת על פני גרסתו של הנאשם, הגעתי למסקנה כי בנסיבות המקרה, נוכח התנהלותה הלא שגרתית של המתלוננת עובר להגשת התלונה ולאחריה, לא יהיה זה בטוח לקבוע ממצאים עובדתיים מרשיעים בדבר אשמת הנאשם מעבר לכל ספק סביר על יסוד עדותה היחידה של המתלוננת",not annotated
706084,s97002328-10,5.0,"יש לזכור שלאחר שהוסף  ב, ובוטל הצורך בסיוע לעדות יחידה בעבירות מין, דרושה זהירות שלא יורשע אדם חף מפשע (ההדגשה שלי-ש",not annotated
707780,ME-10-09-31383-790,5.0," כפי שקבעתי לעיל, אני מאמץ את גרסתה המהימנה של המתלוננת באשר לכל המעשים שביצע בה הנאשם, כמתואר בכתב האישום, ודוחה כבלתי מהימנה את גרסתו של הנאשם, שלפיה כלל לא נכנס לחדר, אלא ישן במשך הלילה",not annotated
707802,ME-10-09-31383-790,5.0,"  כפי שקבעתי לעיל, אני מאמץ את גרסתה המהימנה של המתלוננת – גם לגבי אמירתו של הנאשם למתלוננת בחדר שזה סוד ושלא תגלה דבר, וגם לגבי המפגש שלו בבוקר שלמחרת עם המתלוננת בבית, שאז קרץ לה, עשה תנועה עם היד על הפה, ואמר ""ששש""",not annotated
714920,M-NoPub-ZB-8-238-L,5.0," נשיכת איבר-המין כאמור, גרסתה האחרונה של המתלוננת בעניין זה היתה, כי היא ניסתה ולא הצליחה לנשוך את איבר מינו של הנאשם",not annotated
714954,M-NoPub-ZB-8-238-L,5.0,"24צפיתי בעיון בעדותה הארוכה של המתלוננת כפי שהוקלטה במערכת הוידאו של בית המשפט, וצר לי לומר, כי אין זו העדה שיכולה לשכנע אותי מעבר לכל ספק, באמיתות סיפורה ובכנות דבריה",not annotated
715025,M-NoPub-ZB-8-238-L,5.0," אולם באלה לבדם, אין כדי להביא להרשעתו של אדם בפלילים, ואין להם משקל עצמאי אלא כשהם מתווספים לעדות אמינה של מתלוננת לגוף העניין",not annotated
715098,M-NoPub-ZB-8-238-L,5.0,"37על-פי כל המפורט והמבואר לעיל, ברור מדוע לא אוכל לפרט מה הניע אותי להסתפק בעדותה היחידה של המתלוננת, גם אם יש לה חיזוק כזה או אחר ",not annotated
715786,s03004300-278,5.0, הבנה אפשרית זו של מצב דעתה של המתלוננת מתחזקת נוכח עדותה החמקנית של המתלוננת בשאלת קיצור השירות אותו ביקשה,not annotated
717081,m021148,5.0,"התנהגותו זו של הנאשם באירוע ביער, מצאה כאמור ביסוס חד משמעי בעדותה האמינה של המתלוננת ובחיזוקים שקיבלה עדות זו, בדברי האם בפנינו, שהתיחסה למצבה הנפשי של המתלוננת כאשר שבה לביתה לאחר האירוע, ואל סימני המכות שמצאה על גופה לאחר מספר ימים",not annotated
717549,m021148,5.0,"עבירת האונס, הוכחה מעבר לספק סביר, בעדותה המהימנה של המתלוננת ובחיזוקים שהובאו לתמיכה בה, מעבר לנדרש על פי דין; הכל, כפי שהוסבר לעיל בהרחבה",not annotated
723425,ME-08-1196-55,5.0,"יש להרשיע את הנאשם על בסיס עדותה המהימנה של המתלוננת, אשר לגרסתה נמצאו חיזוקים רבים, ותוך דחיית עדות הנאשם ועדויות עדי ההגנה מטעמו בחוסר אמון, בעבירה לפי סעיף 345 לחוק, ועל יסוד העובדות שהוכחו ואשר לגביהן ניתנה לנאשם הזדמנות סבירה להתגונן, יש להרשיע את הנאשם גם בעבירה לפי סעיף 345 לחוק",not annotated
725560,ME-08-1196-55,5.0," סיכום לאור כל האמור לעיל, ולו דעתי תישמע, יש להרשיע את הנאשם על בסיס עדותה המהימנה של המתלוננת, אשר לגרסתה נמצאו חיזוקים רבים, ותוך דחיית עדות הנאשם ועדויות עדי ההגנה מטעמו בחוסר אמון, בעבירה לפי  לחוק, ועל יסוד העובדות שהוכחו ואשר לגביהן ניתנה לנאשם הזדמנות סבירה להתגונן, יש להרשיע את הנאשם גם בעבירה לפי  לחוק",not annotated
