sentence_id,title,query number,clean_sentence,status
6178,ME-16-11-9004-33,1.0," עדותה של המתלוננת אמינה כפליים, משכנעת ארבעתיים ומסתברת שבעתיים",not annotated
7658,ME-08-1045-33,1.0," התרשמתי כי עדותה של המתלוננת הייתה עקבית, בוטחת, רהוטה ומהימנה",not annotated
9670,SH-10-11-34300-792,1.0," לכך מתווסף החשש כי עדותה הראשונית של המתלוננת אינה נקייה מזיהומים שונים זאת ניתן ללמוד מכך שהמתלוננת נמצאה על ידי אחותה בביתו של הנאשם, וככל הנראה עקב צעקותיה של אחותה, למדה המתלוננת מיד כי מה שארע הינו פסול ואסור ובעקבות הצעקות של אחותה על הנאשם בחרה לספר כי הנאשם הוא זה שפגע בה",not annotated
19235,m06003021,1.0," ניתן היה להתרשם כי עדותה של המתלוננת לגבי עיקרי הדברים הייתה עקבית, וגם כאשר נעשו ניסיונות ""לבלבל"" אותה, חזרה בעקשנות ובביטחון על הגרסה",not annotated
20705,m00330,1.0," גם עדותה של המתלוננת ת', הנוגעת אמנם בעיקרה לאירוע הראשון בו הודה הנאשם בשלב הסיכומים, הנה רלוונטית בסופו של דבר גם למחלוקת שנותרה",not annotated
28593,SH-10-01-40299-583,1.0,"כפי שציינתי לעיל, עדותה של המתלוננת היתה עניינית וקוהרנטית ואפילו אניח כי אכן נטלה תרופות עובר למתן עדותה  אזי, לא מצאתי כי היה בכך כדי לפגום באותה עדות או בכושר העדתה של המתלוננת",not annotated
30217,m001062,1.0,"עדותה של המתלוננת בפני חוקרת הנוער אכן מבולבלת מעט וחסרת רצף, אך יחד עם זאת הקפידה המתלוננת לחזור על עיקרי דבריה בכל הזדמנות",not annotated
30218,m001062,1.0," אמינה עלי, כמפורט לעיל, ואני מאמצת דבריה בפני חוקרת הנוער, כמשלימים את עדותה בביהמ""ש",not annotated
30693,m001062,1.0,"זאת ועוד, כפי שנאמר לעיל עדויותיהן של המתלוננות ע",not annotated
34309,m04001134,1.0,"כאמור, עדותה של המתלוננת ר",not annotated
53240,s03001809-358,1.0, עדותה של המתלוננת בבית המשפט היתה ארוכה ומפורטת והתייחסה לכל העובדות נשוא כתב האישום,not annotated
57875,ME-11-06-2965-391,1.0,"לטענת ב""כ הנאשם, כתב האישום שהוגש נגד מרשו מבוסס רובו ככולו על עדותה של המתלוננת עצמה, וכפי שכבר עולה מתיאור עדותה לעיל, עדות זו של המתלוננת חלשה במיוחד, רצופה שקרים, ואינה ראויה למשקל הדרוש כדי להרשיע אדם בפלילים",not annotated
57988,ME-11-06-2965-391,1.0,"גרסה שקרית זו של המתלוננת היא משמעותית ביותר, מאחר שהעבר המשותף שלה ושל הנאשם בוודאי מקרין לא רק על מידת המהימנות שיש ליחס למתלוננת באופן כללי, אלא אף על מידת המהימנות שיש ליחס לגרסתו של הנאשם שהשניים התחבקו והתנשקו וזרמו לקראת יחסים אינטימיים גם בליל האירוע נשוא כתב האישום",not annotated
58037,ME-11-06-2965-391,1.0," כאמור לעיל, מקובלת עלי גרסתה של המתלוננת כי לא הסכימה כלל לנסוע עם הנאשם ולעזוב את אולם גוטניק ללא אחותה וללא מוראד, וכי הנאשם נעל עליה את דלתות הרכב, ואף מנע ממנה מלשוחח עם אלה שהתקשרו אליה, כשברצונה להודיע איפה נמצאת ומה מצבה",not annotated
59270,SH-09-2064-831,1.0,עדותה של המתלוננת נטיה ללצאשווילי הייתה אמינה מאד,not annotated
62184,ME-09-1063-277,1.0," עדותה של המתלוננת כפי שנמסרה בפנינו מפיה על דוכן העדים וכלל התנהלותה במהלך החקירה ולקראת העדות בבית המשפט, לא הייתה נקייה מקשיים",not annotated
72575,SH-09-01-10212-129,1.0," לטענת ב""כ הנאשם עדותה של המתלוננת הייתה רצופה בסתירות",not annotated
73396,m03001200,1.0, שהרי עדותה של המתלוננת עקבית היא לאורך כל הדרך,not annotated
77018,m03001164,1.0,"את מסקנתה כי גירסתה של המתלוננת מהימנה היא וכי חוותה על גופה את אשר תיארה בפניה, ביססה חוקרת-הילדים, כך העידה, על ה""פאזל"" שנבנה על-יסוד ניתוח חקירתה של המתלוננת, לאחר עיון נוסף בתִּמְלוּל וּצפייה בקלטת החקירה",not annotated
80244,m02001201-a,1.0," עדותה של המתלוננת מרכזית וחשובה לבירור אשמתו של הנאשם, אלא שהיא אזרחית פיליפינית, השוהה בישראל באופן שאינו חוקי",not annotated
81797,m02001201-a,1.0,"ראשית, עדותה של המתלוננת בעייתית, שכן אין זה מובן מדוע התביישה משותפתה לדירה, שמא זו תראה את הקונדום",not annotated
96631,s00006418-192,1.0,"מצאתי כי עדותה של המתלוננת  הינה  ""חלשה"" ביותר, ולא מצאתי בחומר הראיות כל הנמקה ""ממשית"" שתתמוך בדבריה ומכאן שאני מזכה את הנאשם מעבירת המעשה המגונה מחמת הספק",not annotated
97105,ME-14-02-9030-33,1.0,"המאשימה טוענת כי עדותה של המתלוננת הייתה עקבית, כנה ומשכנעת, וניכרים בה סימני האמת",not annotated
108051,SH-09-5632-185,1.0," מסקנתי בדבר מהימנות עדות המתלוננת מתקבלת אף לאחר שבחנתי את כל אותן סתירות עליהן הצביע הסניגור, והגם שברור כי עדותה של המתלוננת לא הייתה נטולת קשיים",not annotated
114006,m07001017,1.0," לטענתה, עדותה של המתלוננת היתה עקבית ומהימנה, ותאמה את הגרסה שמסרה במשטרה, ובהתבסס עליה יש לקבוע כי הנאשם ביצע בה את המעשים המיניים המיוחסים לו, מאז היתה המתלוננת כבת 13, וזאת ללא הסכמתה",not annotated
117945,m05001044-529,1.0,"עדויותיהן של המתלוננות היו ענייניות, ללא סתירות משמעותיות",not annotated
123787,SH-08-6572-1,1.0, עדותה של המתלוננת היתה עקבית מאד,not annotated
135266,ME-09-1010-27,1.0,"בעוד שאליבא כתב האישום, האירוע המתואר לעיל, התרחש כולו באותו יום, במועד לא ידוע, במהלך ה""תקופה"", בבית המשפט הייתה גרסתה של המתלוננת ביחס לעובדה זו לא ברורה, ומכל מקום לא זהה לאמור בכתב האישום",not annotated
136526,s06002148-239,1.0,"עדותה של המתלוננת לגבי שני האירועים, בהם נרשמו מספרי הרכב היתה מבולבלת במקצת וקשה לקבוע על פי עדותה בחקירה ראשית באיזה מן הרכבים נהג הנאשם בכל אחד משני האירועים הנ""ל , היא מוסרת שהנאשם נהג ברכב 6236382  ",not annotated
140367,ME-09-1084-867,1.0,"כאמור, גרסתה של המתלוננת בעניין מעשה הסדום הייתה עקיבה ומהימנה, בעוד שגרסתו של הנאשם בעניין זה הייתה בלתי כנה, בלתי סבירה ובלתי מהימנה",not annotated
159570,ME-09-08-8687-659,1.0," לפי קביעת חוקרת הילדים, קיים קושי לקבוע כי עדותה של המתלוננת בפניה היא מהימנה",not annotated
166116,s023469a,1.0,"מאשר כי עדותה של המתלוננת איננה חד משמעית , הודעות הנאשם היו מפורשות  ובסוף החקירה - שוחרר  על פי החלטת ק",not annotated
167746,M-NoPub-ZC-1-416-L,1.0," גם עדותה של המתלוננת ת', הנוגעת אמנם בעיקרה לאירוע הראשון בו הודה הנאשם בשלב הסיכומים, הנה רלוונטית בסופו של דבר גם למחלוקת שנותרה",not annotated
168695,s02001710-515,1.0," יודגש כי אינני קובעת שעדותו של המתלונן כולה שקרית; מובטחני כי פרטים שונים שמסר, הן באשר למפגש בחדר העבודה, כמו גם פרטים אחדים באירוע שבחדר השינה - היו גם היו",not annotated
172279,s04002016-251,1.0,"אף כל עדותה בבית המשפט של המתלוננת, עדת התביעה מס' 5, היתה מהימנה עלי ולא מצאתי כל מקום וטעם לקבוע כי לא העידה אמת בבית המשפט או כי טעתה בדרך כלשהיא בטענתה כי הנאשם הוא זה שביצע בה את המעשים המגונים, תוך הפעלת כוח כנגדה",not annotated
176475,s05003504-333,1.0,הלכה פסוקה היא כי אם עדותה של מתלוננת בעבירות מין אינה מושלמת – אין פירושו של דבר שהיא אינה שלמה,not annotated
176753,s05003504-333,1.0,"עדותה של המתלוננת בבית המשפט, היתה אמינה ולא נסתרה בחקירה נגדית בכל הקשור במעגל הפנימי המתייחס לעובדות נשוא כתב האישום",not annotated
177934,s05001085-150,1.0,"עדותה של המתלוננת בחקירתה הנגדית ארוכה ומפורטת מאוד, והיא עמדה בה בצורה ראויה ומכובדת",not annotated
178055,s05001085-150,1.0,"עדותה של המתלוננת מהימנה, וגרסתה אינה משתנה לאורך כל הדרך; הן בעימות שנערך מול הנאשם ת/9 והן בחקירות הראשית והנגדית בבית המשפט",not annotated
178486,s05001085-150,1.0,"בניגוד לעדותו של הנאשם, עדותה של המתלוננת היתה עיקבית והיא תיארה את מערכת היחסים עם הנאשם באופן ברור, הגם שהודתה כי הוא לא פעל נגד רצונה, וכי היתה זקוקה לתמיכתו ולקשר עמו מבחינה נפשית",not annotated
178685,s00009709-474,1.0,"סיכומו של דבר: עדותה של המתלוננת ברורה ומקבלת חיזוק מלא מן הראיות ובעיקר, מעדותו של הנאשם בעצמו הממקם עצמו לא רק במקום האירוע אלא גם בגוף האירוע דהיינו, בגופה של המתלוננת אותה הוא תוקף, פיזית ומינית",not annotated
196949,m05000543,1.0," זאת ועוד, הסניגור ניסה, לאורך כל החקירה הנגדית, לשכנענו כי גרסתה של המתלוננת שיקרית, בדויה ואינה מתקבלת על הדעת, אולם תשובותיה והסבריה של המתלוננת היו פשוטות, ברורות והגיוניות, תוך שהיא נותרה איתנה בגרסתה בחקירה ראשית",not annotated
198173,m06007005-401,1.0," יכול שדבריו אלה של הנאשם למתלוננת בנוגע להתמצאותו בג'ודו נאמרו לצרכי התרברבות בפניה, אך, כאמור, גירסתה של המתלוננת, כי הנאשם איים עליה בעת שהיו ברכב, ועקב כך חדלה מהתנגדות פיזית ואיפשרה לנאשם לבעול אותה, נאמנה עלינו",not annotated
199125,SH-11-11-50610-711,1.0," עדותה של המתלוננת הייתה עקבית החל מגרסתה בעימות בינה לבין הנאשם, שהתקיים במשטרה כחצי שנה לאחר האירוע  וכלה בעדותה בבית המשפט",not annotated
200458,s00003258-220,1.0,"מאחר וקבעתי כי עדותה של המתלוננת לעניין האירוע אמינה וגירסתו של הנאשם אף מחזקת אותה , באשר לקיומה של הנשיקה בלא הסכמתה הממשית פוזיטיבית של המתלוננת כנדרש עפ""י הסעיף, ולכן מתקיים היסוד הפיסי של העבירה",not annotated
203483,ME-15-07-28768-44,1.0, גרסתה של המתלוננת בעניין זה לא היתה ברורה,not annotated
224288,ME-09-1002-752,1.0," ניתן להצביע על כך שגירסתה של המתלוננת במשטרה, בחקירותיה ובמסגרת העימות, כמו גם בעדותה בבית-המשפט, הינה עקבית, ואף נתמכת בראייה חיצונית בעלת משקל של ממש   ולכן ניתן היה להעדיפה על פני עדותו של הנאשם לפיה יחסי המין נעשו בהסכמה",not annotated
226262,ME-11-10-363-44,1.0, מעשים אלו לא יוחסו לנאשם בכתב האישום וגרסתו של המתלונן בנקודה זו הייתה סותרת ומבולבלת באופן מעורר ספק,not annotated
226298,ME-11-10-363-44,1.0,"גם הפעם לא אתייחס בהכרעת דיני לאותן נגיעות נוספות עליהן העיד המתלונן, שכן הנאשם לא הואשם במעשים אלו ועדותו של המתלונן לגביהם הייתה מבולבלת ולא עקבית",not annotated
231057,ME-15-05-26580-949,1.0,התרשמתי כי עדותה של המתלוננת הנה אותנטית,not annotated
231273,ME-15-05-26580-949,1.0,לסיכום: התרשמתי כי גרסתה של המתלוננת מהימנה ועקבית,not annotated
233647,ME-08-10-6212-89,1.0," די היה לי, בנסיבות העניין, לקבוע כי גרסתה של המתלוננת מהימנה עלי וגרסת הנאשם אינה אמינה עלי ולהרשיע את הנאשם, שכן עפ""י  ל ניתן להרשיע בעבירת מין על סמך עדות יחידה תוך קיום חובת ההנמקה",not annotated
236800,SH-09-09-8105-83,1.0,"אני קובע אפוא כי גרסתה של המתלוננת אמינה לחלוטין, ובמיוחד בצירוף תכיפות התלונה והמצב הנפשי שנלווה אליה",not annotated
237389,m06003042-275,1.0,"הסיוע נדרש הן לעצם ביצוע העבירה והן לזיהויו של מבצע העבירה  385, עמ' 406) ומשקלו הראייתי משתנה בהתאם למשקל הראייתי של העדות הטעונה סיוע; כך, מקום שמהימנות עדותו של המתלונן גבוהה היא, ניתן להסתפק בראיית סיוע בעלת משקל לא רב, ולהפך  292, 302)",not annotated
243287,ME-15-02-10663-33,1.0," העדות בעבירות אלה עוסקת מעצם טבעה בנושא טראומתי ואינטימי כאחד, ועל כן מתעורר לפעמים קושי במתן עדות סדורה ורהוטה, למרות זאת עדותה של המתלוננת בתיקנו הייתה מדויקת כאמור ברורה, סדורה וקוהרנטית",not annotated
244175,s011805,1.0," למרות זאת, עדותה של המתלוננת הייתה עקבית ולא התגלו בה סתירות",not annotated
258725,ME-10-01-28729-1,1.0," חשוב לציין כבר כאן כי עדותה זו של המתלוננת בפנינו היתה רצופה שתיקות, הפסקות ובכי",not annotated
268138,s00001440-279,1.0, ניתנת האמת להיאמר – גירסתה של המתלוננת בענין זה היא מבולבלת ולא אחידה,not annotated
268927,m021212d,1.0," ביהמ""ש נדרש לשאלת מהימנות עדותה של הבת וציין כי הוא נותן בה אמון מלא וכי לפי ההלכה, גם אם עדותה של מתלוננת בעבירות מין איננה מושלמת, אין פירושו שהיא איננה שלֵמה, מה גם שמדובר בקטינה המצויה בשנים הקריטיוֹת להתפתחותה",not annotated
270606,m021212d,1.0,הֲלָכָה פסוקה היא כי גם אם עדותה של מתלוננת בעבירות-מין אינה מושלמת - אין פירוש הדבר שהיא אינה שלֵמה,not annotated
271813,s01777,1.0," גירסתה של המתלוננת, בעיקרה, בכל הקשור לאירוע אשר התרחש בצומת קסטינה, מקובלת עלי",not annotated
285942,m00925,1.0," כבר בפתח דבר ראוי לציין, כי – ולהבדיל מעדותה ביחס לאירועים נשוא האישום הראשון והשני – עדותה הראשית  של המתלוננת, ביחס לאירועים נשוא האישום השלישי, בו קא עסקינן עתה, לא היתה סדורה, כולי האי, במובן זה שבה, בלבד, לא היה כדי לבסס את כל המעשים המיוחסים לנאשם באישום זה",not annotated
286635,k00018098p,1.0," עדותה של המתלוננת, על אף הסתירות שבה, היתה מהימנה עלינו",not annotated
291528,s05002659-374,1.0,"ראשית, גירסתה של המתלוננת לעניין זה היתה עקבית",not annotated
294122,s002412,1.0,עוד טוען הנאשם כי גירסתה של המתלוננת היא בלתי אפשרית מאחר והוא אינו מכסה את בנותיו אלא אשתו,not annotated
294224,s002412,1.0,עדותה של המתלוננת הנתמכת בראיות נוספות אמינה עלי על כל חלקיה ואני מעדיפה אותה ללא סייג על עדותו של הנאשם,not annotated
302116,M-NoPub-ZB-5-282-L,1.0,"עדותה של המתלוננת, שהייתה הנדבך המרכזי בתשתית זו, הייתה אמינה ושיקפה את המציאות כפי שהתרחשה",not annotated
302913,s03001079-299,1.0,"עם זאת, עדותה של המתלוננת קוהרנטית עם עדויותיהם של ילדיה, שהיו עדים למקרה – כפי שהובאו ע""י ע""ת/5,  – גם בנוגע לזיהוי הנאשם",not annotated
308519,s015210,1.0," לטענתו כאילו אין גירסתה של המתלוננת מהימנה משום שלא הרימה קול צעקה, או משום שלא התקשרה מיד למשטרה לאו טענה היא בנסיבות",not annotated
309096,SH-09-02-15722-61,1.0,"התרשמתי כי עדותה של המתלוננת מהימנה וכי היא תיארה את האירועים כהווייתם, ללא הפרזה",not annotated
309817,ME-06-1036-45,1.0,"עדות הנאשם עדותה של המתלוננת היתה מהימנה עלינו מהסיבות שפורטו לעיל, ואנו מעדיפים אותה על פני עדות הנאשם, אשר לא הרשימה אותנו בכנותה ואמינותה, ואנו מטילים בה ספק",not annotated
322091,M-NoPub-ZB-3-117-L,1.0," כאמור, עדותה של המתלוננת מקובלת ומהימנת עלי, ונותנת ביטוי אמת למה שארע",not annotated
323902,ME-12-09-33735-44,1.0,עדותה של המתלוננת מהימנה ויש להעדיף אותה על פני עדותו של הנאשם,not annotated
323917,ME-12-09-33735-44,1.0," עדותה של המתלוננת אמינה, עקבית והגיונית, עדות אשר יש לה חיזוקים מעדים שונים, מראיות נוספות ומכוונים שונים",not annotated
324690,ME-12-09-33735-44,1.0,"  לאחר שמיעת העדויות ולאור מכלול הראיות, הגעתי לכלל מסקנה כי עדותה של המתלוננת מהימנה ואני מעדיפה אותה על פני עדותו של הנאשם",not annotated
325778,m99934,1.0," מנגד, עדותה של המתלוננת מהימנה ביותר, ויש לבסס עליה את הכרעת-הדין",not annotated
328187,m08001086-173,1.0,"אכן עדותה של המתלוננת כבושה היתה שנים הרבה, אך היא הסבירה היטב את הסיבה לכבישת הדברים",not annotated
329250,m98004159,1.0," ככלל אציין, שעדותו של המתלונן היתה דלה בפרטים, והאופן שבה הועברה תאמה, כך נראה, גם את התרשמות הגורמים המטפלים שהעידו בפנינו על אודות מאפייניו האישיים, בדגש על דבריה של הפסיכולוגית, ד""ר רות פוריסמן",not annotated
329257,m98004159,1.0," התרשמתי גם, כי לא קלה היתה עדותו של המתלונן, שדמעות נקוו בעיניו מיד עם תחילת המשפט, כשהצביע על הנאשם",not annotated
335929,ME-09-09-9012-283,1.0,  עדותה של המתלוננת לגבי  נאשם 2 איננה עקבית,not annotated
335976,ME-09-09-9012-283,1.0, העדות של המתלוננת הייתה אותנטית ולא היה בה רצון לנקמה,not annotated
336228,ME-09-09-9012-283,1.0,"עם אחר, היתה עדותה של המתלוננת חדה במיוחד, כאשר העידה כיצד היא שבה וחשה זאת באופן מדויק גם בעת עדותה, והעבירה לנו תחושה זו באופן מצמרר",not annotated
336250,ME-09-09-9012-283,1.0,"אני מצרף דעתי לדעתה של כב' השופטת רג'יניאנו לפיה עדותה של המתלוננת מהימנה, ועדותו של הנאשם 1 איננה מהימנה מהנימוקים שפרטה בחוות דעתה",not annotated
338305,s03002604-359,1.0,"מן הכלל אל הפרט גרסתה של המתלוננת אינה נטולת תמיהות  – ועל כן, לא שוכנעתי בדבר מהימנותה עד כדי מתן משקל לה שיהא בו די לבסס הרשעה בפלילים",not annotated
339635,SH-07-1532-247,1.0,"עדותו הנ""ל של המתלונן היתה מבולבלת, מתחמקת, בלתי ברורה לא  עקבית כלל",not annotated
339650,SH-07-1532-247,1.0," התרשמתי כי עדותו הנ""ל של המתלונן לא היתה מהימנה כלל, וההסבר שמסר ליישב את הסתירה בין דבריו במשטרה לבין גרסתו בבית המשפט, לא היה משכנע כלל",not annotated
339699,SH-07-1532-247,1.0," יש לציין כי עדותו של המתלונן, לעניין התלונות הקודמות הנ""ל, לא היתה עקבית כלל",not annotated
340188,ME-12-10-49947-393,1.0,"המישור האובייקטיבי לאחר שקבעתי כי עדותו של המתלונן מהימנה, כי אני מאמין למתלונן שפניו של הנאשם נחרטו בזיכרונו במהלך האירוע והוא מזהה את הנאשם באופן וודאי, אפנה לבחון את האפשרות שהמתלונן טעה טעות כנה בזיהוי",not annotated
343123,ME-10-07-44791-817,1.0,"ב""כ הנאשם טען כי עדותה של המתלוננת ""רווית סתירות"", ובהיותה עדות יחידה  נדרשת הנמקה ממשית לצורך אימוצה",not annotated
343192,ME-10-07-44791-817,1.0, עדותה של המתלוננת הייתה מאופקת,not annotated
343202,ME-10-07-44791-817,1.0,"עדותה של המתלוננת, באשר להשתלשלות האירועים בבית, נאמנה אף היא למציאות, ויש להעדיפה על פני תיאורו הבלתי סביר של הנאשם, לגבי שיתוף פעולה מיני, בהסכמה מלאה ו""זרימה"" הרמונית, כביכול, מצידה של המתלוננת",not annotated
350666,m01967,1.0," עדותה של המתלוננת היא ברורה, סדורה ומאד אמינה, היא מתארת את מהלך האירועים אליהם נקלעה כי רצתה לעזור לס', את הלחצים בהם היתה נתונה מצידו של ס' להשאר עוד ועוד, עד כי נזנחה על ידו ונאנסה על ידי הנאשם",not annotated
350714,m01967,1.0, מקובלת עלי עדותה של המתלוננת שהיתה מאד נרגשת במשטרה ויתכן ונרשם בטעות שהסכין היתה לידו ולא בידו,not annotated
351663,s02005082-239,1.0,"לטענתו, גירסתה של המתלוננת שהעידה כי נכנסה לחדר שבו היה נוכח בכדי לנטרל את האזעקה, אינה הגיונית משום שמערכת האזעקה חולשת על כל המתחם ולכן לא יכול להיות מצב שימצא מישהו בחדר מבלי שהאזעקה תפעל",not annotated
360749,m984143,1.0,"אכן עדותה של המתלוננת בביהמ""ש אינה מאורגנת ומסודרת, לא תמיד מתוארים הארועים בסדר כרונולוגי ואף לא ברורים המעברים מארוע אחד למשנהו",not annotated
362593,s98004022-339,1.0,"התרשמתי מעדות הנאשם כבלתי אמינה, שעה שעדותו של המתלונן היתה אמינה, וניכר היה במתלונן שמעשה הנאשם השאיר בו צלקות",not annotated
363038,ME-18-06-11113-33,1.0,"גרסתה של המתלוננת עקבית כפי שעולה גם מבחינת האמרות שלה במשטרה, מיד לאחר האירוע, ולא התגלו סתירות או פגמים בעדותה",not annotated
