sentence_id,תיאור,title,sentence_text,query number
648184,עקבית,ME-11-07-49775-251,"גרסת ה מתלוננת הינה עקבית , קוהרנטית ו מעוררת אמון , אשר הותירה רושם חיובי ו מהימן ו יש ליתן אמון מלא ב גרסה של היא ו ב עדות של היא ב בית ה משפט , לאור ה חיזוקים ה רבים , כפי ש יפורטו להלן : הפסקת ה עיסוי ב מפתיע - אין מחלוקת ש ה מתלוננת הפסיקה ב מפתיע את ה עיסוי כעבור כ - 15 דק' מתחילה של הוא ו יצאה מ חדר ה טיפולים .",7.0
659966,מלאה סתירות,m08000502-117,"גרסת ה מתלוננת היא כה רעועה , כה שברירית , ו מלאה סתירות ו חזרות כ רימון , ש אינני יכול לקבוע כל ממצא על פה של היא , לא כל שכן , ש אינני יכול - כ מצוות ה מחוקק - לפרט ו להסביר , כיצד הכרעת דין מרשיעה ב ה עבירות ה מין ש ב הם הואשם ה נאשם , מבוססת על עדות יחידה זו .",7.0
676462,אמוציונאלית,ME-08-1157-524,עדות ה מתלוננת ב בית ה משפט היתה מאד אמוציונאלית ו ב שלב מסוים בית ה משפט נאלץ להפסיק את ה דיון .,7.0
680474,נוספות,m04001141-a,"ודוק , ב כל ה קשור ל ה אופן מעורבות של הוא של מוטי ב מכון ב תקופה ה שניה , לא מצאנו סתירות של ממש , אם בכלל , ב עדות ה מתלוננות ה נוספות .",7.0
684455,עקבית,m07001178-65,"גרסת ה מתלוננת היא כאמור עקבית , אין ב היא כל העצמה או תחכום .",7.0
719921,"אישומים ב ה עבירות ה אינוס , גרסת ה מתלוננת לא הייתה מהימנה",ME-12-07-39094-303,"גם לגבי ה אישומים ב ה עבירות ה אינוס , גרסת ה מתלוננת לא הייתה מהימנה ב עיניי , ו ספק ב עיניי אם היא סבירה .",7.0
729106,ספציפי,SH-08-1578-228,"ה דרישות ה מיניות ש הפנה ה נאשם כלפי ה מתלוננת , ו לאחר מ כן ה מעשים ה מגונים ש ביצע ב היא , היו רק לאחר ש ה נאשם העמיד את ה מתלוננת על ה קושי ה ספציפי של היא ב קבלת תעודת זהות ישראלית ( כתב ה אישום ו כן עדות ה מתלוננת ב עמוד 9 שורות 18 - 7 ) .",7.0
744271,מרכזיות,ME-17-03-51237-11,"ראשית , ב תחילת ה דרך ה נאשם כפר ב עובדות כתב - ה אישום מקורי , ו ניהל הליך הוכחות ב מסגרת של הוא נשמעו ה עדויות ה מרכזיות ב תיק : עדות ה מתלונן , עדויות הורה של הוא ו עדות חוקרת ה ילדים .",7.0
787955,קוטביות,ME-10-07-46879-396,"דיון ו הכרעה : כאמור , ב מידה מסויימת , מדובר ב ה סיפור "" רשומון "" , שכן , מעבר להיות גרסאות ה מתלונן ו ה נאשם קוטביות זו ל זו , ו ב כך אין חריג , הרי , ב ה פרשה ש לפני אנחנו , גם סיפור של הם של ה עדים ה אובייקטיביים , ה חיצוניים , אינו תואם , ב מלוא של הוא , איזו מ ה גרסאות הללו .",7.0
799572,עקבית,SH-02-3868-814,"מ נגד , מצאתי את גירסת ה מתלוננת , הן ב חקירה של היא ב ה משטרה ו הן ב עדות של היא ב בית ה משפט , מפורטת , עקבית , מוצקה ו אמינה , העדפתי את היא על פני גירסת ה נאשם ו קבעתי כי עבירת ה מעשה ה מגונה ב מקרה דנן הן הוכחה מעבר ל כל ספק סביר .",7.0
806819,מהימנה,SH-11-11-50610-711,"מ כל ה מקובץ , אני מוצא לקבל את גרסת ה מתלוננת מהימנה ו נכונה , כפי עדות של היא ה מפורטת לעיל , ו לקבוע על בסיס של היא ממצאים ש ב ה עובדה .",7.0
828991,אמינה,SH-11-04-33622-55,"גרסת ה מתלוננת , לעומת זאת , הייתה כנה ו אמינה .",7.0
829031,עיניי כנים,SH-11-04-33622-55,"תיאורי ה מתלוננת ב יחס ל ה סערה ש פקדה את היא בעקבות ה טיפול , ו ה ביטויים ב הם השתמשה ל תיאור מצב של היא ה נפשי , תיאורים ש התעצמו ב דברי בעל של היא ו הוריה , היו ב עיניי כנים ו אוטנטיים .",7.0
847236,שקרית,s02001710-515,"מ כאן , ש עדות ה מתלונן היא שקרית , ו תלונה של הוא , כך , ל גישת ה הגנה , איננה אלא ב ה דיה ש בד היא ה מתלונן , אולי כ אמצעי ל סחיטת כספים מ ה נאשם .",7.0
848693,סבירה,s00003258-220,"מאחר ש עסקין של הן ב משפט פלילי , אין די ב כך ש עדות ה מתלוננת תהיה סבירה יותר מ עדות ה נאשם , פער עדויות כ ה זה מספיק ל הכרעה ב משפט ה אזרחי לשם עמידה ב נטל מאזן ה הסתברויות , לא כן ב דין ה פלילי ה מחייב הכרעה מעבר ל כל ספק סביר .",7.0
885392,ראשונה,SH-01-3957-HK,עדות ה מתלוננת ה ראשונה הותירה רושם מהימן ב עין של אני .,7.0
935759,מהימנה,ME-13-03-23362-44,"ל ה סיכום פרק ה דיון ב ראיות ה ישירות ( ב מובחן מ ה דיון ב מחלוקות ה רפואיות ש יובא להלן ) , דעה של אני היא , ש עדות ה מתלוננת מהימנה ו רבת משקל , ו כי , נמצאו ל היא אשושים "" פנימיים "" , מתוך אופן מתן ה עדות ו ניתוח דבר של היא , ו ב נוסף - נמצאו ל עדות של היא חיזוקים חיצוניים , מגובי ראיות של עדים נטולי פנייה ו עניין ב תוצאה , אשר מחזקים את ה מסקנה דלעיל .",7.0
944906,אחידה,ME-08-1198-419,גרסת ה מתלוננת לגבי ה אונס היא אחידה ו עקבית .,7.0
945531,עקבית,ME-08-1198-419,"גרסת ה מתלוננת לגבי אירוע ה חטיפה , כליאה של היא ב מערה ו מעשי ה אינוס ש בוצעו ב היא , כפי ש באו ל ידי ביטוי בעדות של היא ב בית ה משפט הינה עקבית ו אחידה , ו ניכר ש העידה ב פתיחות ו ב כנות .",7.0
945619,סבירה,ME-08-1198-419,"ב נסיבות ה עניין , הפללת ה נאשמים גם כאשר מדובר ב עדות אמת , הייתה כרוכה ב הסתכנות מ צידה , אך הפללה של הם כ ה עדות שקר הייתה יכולה לסכן את היא שבעתיים , ו לא נראה ל אני סביר ב נסיבות ה עניין , ש ה מתלוננת הייתה מסתכנת ב הפללת ה נאשמים ב עדות שקר , תוך נטילת סיכונים מוגברים , ו ב סוף של הוא של יום , מ כלול ה נסיבות מצביע על כך ש עדות ה מתלוננת הייתה סבירה ו מ הימנה .",7.0
945631,סבירה,ME-08-1198-419,"ב מצב זה נראה ל אני כי על אף ש יש לבחון ב זהירות את ה דברים ש מסרה , ו להתייחס ל כל אירוע פרטני ב נפרד , מ כלול ה נסיבות מצביע על כך ש עדות ה מתלוננת הייתה סבירה ו מ הימנה , ו מערערת את טענת ה נאשמים 1 - 5 כי מדובר ב עלילת שווא או מסע נקם של ה מתלוננת ב הם , על כך ש החזירו את היא ל בית של היא , ו על כך ש ריאד נרצח .",7.0
1020505,מהימנה,m01001080-516,"ל עדות ה מתלוננת ה מהימנה , מצטרפות ראיות ו עדויות נוספות ש גם ל הן רחשתי אמון ו ה מצביעות על עקביות ו אמיתות גרסת ה מתלוננת .",7.0
1036919,עקבית,ME-11-08-19586-11,"ה מאשימה טענה כי עדות ה מתלוננת היתה עקבית ל כל אורך ה דרך , ו כי ניתן להתרשם ש אין סתירות בין הודעה של היא ב ה משטרה ( ה מוצגים ת / 38 - ת / 39ג ש לעיל ) לבין עדות של היא ב בית ה משפט .",7.0
1067664,עקבית ל הודעות ה קודמות של הוא ב ה משטרה,m05002049-376,עדות ה מתלונן היתה עקבית ל הודעות ה קודמות של הוא ב ה משטרה .,7.0
1119800,"אירוע זה , כי עדות ה קטינה אמינה",s00585a,"ה תרשמותי היא , לפחות באשר ל אירוע זה , כי עדות ה קטינה אמינה ו מתקבלת על ה דעת ו אין ב שמיעת ה קלטת ו ב שמיעת התרשמות של היא של חוקרת ה ילדים , כמו גם ב תמיהות ש ניסה ה סנגור להעלות , כדי לערער זאת .",7.0
1129782,עקבית,ME-09-1143-989,"כפי ש ציינה חוקרת ה ילדים , עדות ה ילדה הייתה עקבית , מדוייקת , קוהרנטית ו מפורטת .",7.0
1137346,שונה,s99001132-160,"תאור ה מתלוננת ל ה רגע כניסה של הוא של ה נאשם שונה הוא , שכן אותה "" קפיצה "" לא היתה - גם אליבא דדברי ה מתלוננת - איך ש ה נאשם נכנס .",7.0
1212216,שונות,s98001190-19,"קודם ש אתייחס ל גרסאות ה מתלוננות ה שונות , אציין ב תמצית את גרסת ה נאשם ה מכחיש את כל ה עבירות ה מיוחסות ל הוא .",7.0
1212736,שונות,s98001190-19,"אין אלה ראיות ה חיזוק ה יחידות , ו אולם המשך ה דיון מצריך התייחסות השוואתית ל עדויות ה מתלוננות ה שונות ו מקום של הוא אך ב המשך ה דברים .",7.0
1213130,שונות,s98001190-19,"יסוד זה אכן היווה את ה בסיס ל דיון ה מפורט ב גרסאות ה מתלוננות ה שונות , כמו גם ל מסקנות בית ה משפט ב סוף של הוא של יום .",7.0
1218768,שקרית,m07008007-405,"ל סוג של היא זו נצרך בית - ה משפט לאור ה הקלטה ש ביצע עד ה הגנה י’ ר’ , ש על - בסיס של היא נטען על - ידי ה הגנה כי גרסת מתלוננת 2 הינה שקרית .",7.0
1230717,אמיתית,ME-09-1151-608,"בלית כך , לא תיתכן הרשעה , אף אם תימצא גרסת ה מתלוננת אמיתית ו בעלת משקל ממשי .",7.0
1230768,מהימנה,ME-09-1151-608,"מ כל ה אמור , מ סקנתי היא ש עדות ה מתלוננת מהימנה לחלוטין ו יש להקנות ל היא משקל מירבי .",7.0
1234771,רורה,SH-11-04-25817-739,"עדות ה מתלוננת הייתה עניינית , עקבית , מפורטת ו ב רורה , ו לא נסתרה ב חקירה נגדית ב נושאים ה מרכזיים .",7.0
1235103,נקייה מ סימני רצון,SH-11-04-25817-739,עדות ה מתלוננת הייתה נקייה מ סימני רצון לפגוע ב ה נאשם או לנקום ב הוא .,7.0
1238661,פסולה,M-NoPub-ZC-6-350-L,"ו אם ישאל ה שואל האם ה עמדה ה ראויה היא כי כל עדות קטינה בפני חוקרת ילדים אשר זוהמה , הנה בהכרח פסולה , אשיבנו כי לא בהכרח .",7.0
1252913,סבירה,s00002918-370,"ה תביעה ביקשה לקבל את עדות של היא של ה מתלוננת כ מהימנה ו כ משקפת את מה ש התרחש ב חדר ה טיפולים , בעוד ש ה סניגור טען כי גירסת ה מתלוננת היא בלתי סבירה ו רבת סתירות ( ו ראה גם רשימה ש הגיש כ חלק בלתי נפרד מ סיכום של הוא ) , ו לכן לא ניתן לבסס את הרשעה של הוא של ה נאשם על היא .",7.0
1259096,אחרות,s04001234-585,"אף מ עדויות ה מתלוננות ה אחרות , לרבות ה תחקירנית , עולה כי מעשי ה נאשם , גרמו ל הן נזקים נפשיים , נתנו , ו ימשיכו ליתן , את את הון של הם ב מתלוננות , עוד תקופה ממושכת .",7.0
1261428,מובנית,s05002497-207,"מעבר ל כך ייאמר כי לו היה ממש ב טענת ה עלילה אף הייתי מצפה כי גרסת ה מתלוננת תהא מובנית , מדוקלמת ו מתוכננת ל פרטי פרטים .",7.0
1374113,מלאים,SH-14-06-49350-22,"ב יחס ל שני ה מפגשים ב בתי ה מלון , יש להכריע האם קיימו ה שניים יחסי מין מלאים ( כ גרסת ה מתלוננת ) או שמא קיימו ה שניים יחסי מין ש אינם כוללים חדירה ( כ גרסת ה נאשם ) .",7.0
1374426,עקבית,SH-14-06-49350-22,"גרסת ה מתלוננת ב עניין אופי של הם של ה מעשים ה מיניים הייתה עקבית , לפי היא ב ה מפגש ב חוף ה צוק היא התנשקה עם ה נאשם נשיקה מינית , אשר לוות של היא ב ליטופים , לרבות ל ה יטופים ב חזה ( פרו' עמ' 50 ש' 21 , הודעת ה מתלוננת נ/2 ש' 125 ) , ו אילו ב שני ה מפגשים ב בתי ה מלון קיימו יחסי מין אשר כללו חדירה .",7.0
1526259,מהימנה,ME-18-05-19391-55,"עדות ה קטינה הייתה מהימנה ו קוהרנטית ו תשובה של היא ל ה עניין כל סדר ה אירועים כגון מתי ה טלפון של היא נשבר , מה נשמר ו מדוע היו משכנעות ו ה גיוניות מאוד ( צוין כבר ש ניכר ש הקטינה לא ביקשה להאדיר את מעשי ה נאשם ) .",7.0
1561576,מהימנה,m06003042-275,"אלא ש ב כך אין די ו יש למצוא סיוע חיצוני ב ראיות ל גרסת ה מתלוננת , מהימנה ככל ש תהיה .",7.0
1561688,אחרת,m06003042-275,"ל ה עניין גביית עדות קטינה על ידי חוקרת ילדים ו ה אפשרות כי תשמש ראיית סיוע עדות קטינה אחרת אשר אף היא נגבתה בידי חוקרת ילדים , אפנה ל נאמר ב :",7.0
1639033,"עקבית הן כש ל עצמה , ו הן ב התייחס ל עיקר ה אמור בעדות של היא ב ה משטרה",ME-11-06-51536-78,"עדות ה מתלוננת היתה עקבית הן כש ל עצמה , ו הן ב התייחס ל עיקר ה אמור בעדות של היא ב ה משטרה .",7.0
1639468,"עקבית ל עיקר ה אמור בעדות של היא ב ה משטרה ,",ME-11-06-51536-78,"עדות ה מתלוננת ב בית ה משפט היתה עקבית ל עיקר ה אמור בעדות של היא ב ה משטרה , שם ה מתלוננת סיפרה ב אימרה של היא מ יום 16.6.11 נ/ 9 - ה נאשם אנס את היא במשך שנה ו חצי ( עמ' 1 , שו' 4 ) , ו גם אחרי שבירת עצמות הוא אנס את היא ( עמ' 1 , שו' 4 - 5 ) .",7.0
1641770,בעייתית,SH-19-04-58417-55,"נפסק , כי גרסת ה מתלוננת הייתה בעייתית ו תמוהה ו לא נתמכה ב ראיות , כך ש אי אפשר לבסס על היא הרשעה פלילית .",7.0
1646416,ברורה,ME-10-07-21310-4,"הנה כי כן , מ כל ה אמור , אני מוצא את גרסת ה מתלוננת ברורה , מפורטת ו קוהרנטית , תשובה של היא ו הסבריה משנדרש של היא ל כך , הינם הסברים ה מתיישבים עם ה שכל ה ישר ו עם גרעין גרסה של היא .",7.0
1646536,"חדה , ברורה ו עקבית , לאורך כל חקירה של היא",ME-10-07-21310-4,"למעלה מ כך , גרסת ה מתלוננת ב עניין זה , הייתה חדה , ברורה ו עקבית , לאורך כל חקירה של היא ו אף ב עדות של היא ב פנין של הוא , ו התנגדות של היא ל מעשי ה נאשם ב היא , החל מ ה מגע ה ראשוני , הוכחה ב פנין של הוא .",7.0
1672899,מנוגדות,ME-12-08-3491-22,"לנוכח ה גרסאות ה מנוגדות ו ה סותרות לחלוטין זו את זו , גרסת ה מתלוננת מחד גיסא , ו גרסת ה נאשם מאידך גיסא , על אנחנו להלך ב נתיב ה צר של ראיות ה צדדים ב זהירות רבה שמא תיפול תקלה מתחת יד של אנחנו .",7.0
1672925,רצופה,ME-12-08-3491-22,"הוסיף ו טען ב""כ ה נאשם כי קיים פער בין גרסת ה מתלוננת כפי ש נמסרה תחילה ל חוקרת ה ילדים ה מיוחדת יפעת פולק - כהן , גרסה אשר על פי הגדרה של הוא , היתה "" דלה "" מ בחינה ראייתית , רצופה ב פרטים קטועים לבין זו ש נמסרה על ידי ה מתלוננת כעבור שנתיים ו אזי אז ידעה לתאר "" מעשים ב אופן מדוייק ו מעובה "" , תוצאת "" ה כתמת "" גרסתה ו זיהומה , דבר את הוא הוא מייחס ל מה ש הוא מכנה "" גורמים כ ה אלה ו אחרים "" .",7.0
1675642,עקבית,ME-11-08-19586-55,"ה מאשימה טענה כי עדות ה מתלוננת היתה עקבית ל כל אורך ה דרך , ו כי ניתן להתרשם ש אין סתירות בין הודעה של היא ב ה משטרה ( ה מוצגים ת / 38 - ת / 39ג ש לעיל ) לבין עדות של היא ב בית ה משפט .",7.0
1839016,חסרת שחר,k26398p,"ב סיכומי טענה של הוא טען ב""כ ה נאשם , כי גירסת ה מתלוננת , כפי ש היא מובאת ב כתב ה אישום , היא חסרת שחר .",7.0
1839132,"מצומצמת , למרות זאת",k26398p,"כאמור לעיל , עדות ה מתלוננת ה מתייחסת ל "" ארוע טבריה "" ו ל "" ארוע ה חדר "" הייתה מצומצמת , למרות זאת , ו למרות ש ניתן לומר כי עדות של היא ב עניין זה לא הייתה גדושה ו מפורטת , אין לומר , ש ה פירוט אינו מספק תמונה על מה ש אירע ל היא .",7.0
6156,מהימנה,ME-13-10-20400-22,"הואיל ו ב סוף של הוא של דבר שאלת ה מהימנות נתונה ב סוף של הוא של יום ל הערכת בית ה משפט אומר כי לאחר צפייה ממושכת ב מתלוננת כפי ש צולמה ב תקליטורי חקירה של היא הובילה את אני ל אותה ה מסקנה , לפי היא ה מתלוננת מסרה עדות מהימנה כפי ש סברה גם חוקרת ה ילדים .",8.0
7967,סדורה,s01777,"שנית , יש לזכור , כי ה מתלוננת חשה מיוזמה של היא ל תחנת ה משטרה ב קרית - מלאכי מייד לאחר ה אירוע , כאשר היא "" מאוד מבוהלת "" , כ הגדרת ה שוטרת אושרית אמזלג , ו ב חולצה קרועה ( עמ' 10 ל ה פרוטוקול ) , ו מסרה מייד גירסה סדורה ו מפורטת , אשר כללה גם הגעה ל ה מקום ו הצבעה ל ה שוטרים היכן לצל הם ( עדות ה שוטר שפיצר ב עמח 32 - 33 ) .",8.0
13493,מהימנה,ME-12-07-40109-11,אני סבור כי ה מתלוננת מסרה גירסה מהימנה .,8.0
16712,מפלילה,ME-15-11-34046-11,"ראינו כי ה מתלוננת סיפרה את ה גרסה ה מפלילה , או לפחות חלקים מן היא , כבר ל חברה של היא ח' ב היותן בנות 8 , סיפרה ל חוקרת ה ילדים ב שנת 2009 , ל חברות ב פנימייה ב שנת 2015 , ל עובדות ה סוציאליות , ל מדריכים , ל רופאים ש ב ה דקו את היא , ל קרובות ה משפחה ס' וק' , ב מספר הודעות ב ה משטרה ו לבסוף גם ב בית ה משפט .",8.0
25205,נוספות,SH-10-11-34300-792,"כבר כעת אציין כי מלבד גרעין דבר של היא של ה מתלוננת כפי ש הובא ב עובדות כתב ה אישום ה מתלוננת סיפרה גרסאות נוספות , ו פרטים רבים נוספים ש אינם מתיישבים זה עם זה ו כי יש ב הודעה של היא הן בפני מר הרן ו הן בפני בית ה משפט סתירות פנימיות רבות כפי ש אפרט ב המשך .",8.0
38449,עובדתי,ME-98-4125-HK,"ה מתלוננת מסרה ב עדות של היא ב ביהמ""ש תאור עובדתי ב כל ה נוגע ל נסיבות אירוע ה אונס , ו כפי ש פורט לעיל , דבר של היא ב עדות של היא ב ביהמ""ש הן ב נוגע ל אירועי ה אלימות , ו הן ב נוגע ל אירוע ה אונס מהימנים על אני לחלוטין .",8.0
38725,כנה,s97012424,"ה מתלוננת העידה עדות כנה , אמיתית ו משכנעת .",8.0
48335,שונות,s02005082-239,"ב""כ ה נאשם ב ה סיכומיה טוענת כי מ חומר ה ראיות עולה כי ה מתלוננת מסרה גירסאות שונות ב פרטים עובדתיים מהותיים רבים .",8.0
54810,שונות,m98326a,"ב נוסף ל ה אמור ב חוות דעה של הוא של ה שופט ג'רג'ורה , ב גרסאות ה שונות ש מסרה ה מתלוננת בפני בית ה משפט ו מחוצה ל הוא , ה יוטסתירות , ו אי דיוקים רבים .",8.0
54885,"נ""ל",m98326a,"בנוסף , לא נעלמו מ עיני ה נסיבות ב הן מסרה ה מתלוננת את ה גרסאות ה נ""ל , אך אין ב נסיבות ש היו בכדי לרפא את ה סתירות ה קיימות .",8.0
64586,קוהרנטית,s00003824-279,"ה מתלוננת , סטודנטית כ בת 27 שנה ( ב ה מועד ה נטען ל ביצוע ה עבירה ) , העידה עדות קוהרנטית ו רציפה .",8.0
71143,ארוכה,ME-12-09-33735-44,"ה מתלוננת מסרה גרסה ארוכה ו מפורטת , תוך התייחסות ל מקומות ב הם התבצעו ה מעשים ( ב איזו דירה , ב איזו שעה , ו ב איזה חדר ב דירה ) ; ל תחושות ש חשה , הן תחושות פיזיות ( למשל : "" הוא ריסס ל אני ו נשכב על אני ו החדיר ל אני את איבר ה מין של הוא לפי ה טבעת של אני .",8.0
71926,אינפורמטיבי,SH-12-09-49889-43,"מ בחינת תגובה של היא ו התנהלות של היא ב מהלך ה עדות , ב חלק מ מקטעי ה עדות ב פניי מסרה ה מתלוננת תיאור אינפורמטיבי דיווחי , מבלי ש ניכרה מעורבות רגשית ב תיאורים , ו לא ניתן היה להעריך אם ה ניתוק נובע מ מצבה ה רגשי או מ כך ש היא נדרשת לחזור על אותם תיאורים בפני פורומים שונים או מ סיבה אחרת .",8.0
85446,נכונה,ME-09-1002-752,"עולה איפוא חד משמעית כי ה מתלוננת י. , מסרה גירסה נכונה , ש היא ה בסיס ל גירסה של היא כולה היא .",8.0
87860,שונה,ME-08-1002-864,"מעדות של היא של מ' ( עת / 6 ) , חברה של היא של ה מתלוננת , עולה , כי ה מתלוננת סיפרה ל היא ( יום למחרת ה אירוע ) גרסה שונה ב אופן מהותי מגרסה של היא ב ביהמ""ש .",8.0
90102,מזכה,m06003016,"לאחר ש ה מתלוננת מסרה ב חקירה ה חוזרת את ה גרסה ה מזכה ( ת / 23 ) , ביצעה חוקרת ה ילדים הערכת מהימנות חדשה ( ת / 22 ) .",8.0
90109,מפלילה,m06003016,"סיכום של הוא של דבר , חוקרת ה ילדים התרשמה כי ה גרסה ה מפלילה ש מסרה ה מתלוננת הינה גרסה מהימנה , ו אילו ה גרסה ה מזכה הינה פרי של לחצים ש הופעלו על ה מתלוננת ו אינה משקפת את ה אמת .",8.0
90840,דומה,s00003108,"מ עיון בנ/1 ניתן ללמוד ש ה מתלוננת מסרה ב ביהמ""ש גירסה דומה ו עקבית בדיוק כמו ש מסרה ב אימרה של היא ב ה משטרה .",8.0
102385,ראשונה,ME-08-1047-463,"כפי ש ניתן להיווכח , מ ה גרסה ה ראשונה ש מסרה ה מתלוננת חסרים שני נושאים מרכזיים : ה חלק ה מתייחס ל התנהגות של הוא של ה נאשם , כלומר , ה התפשטות ה מהירה ו הכניסה ל ה מיטה , ו כן נשמט כל ה חלק ה מתאר את הפצרה של היא של ה מתלוננת ו ניסיונות ה שיכנוע של ה נאשם ל לוותה ל בית ה שיריון .",8.0
103714,סותרות,m00000935-103,"ה מתלוננת מסרה ב ה משטרה ו ב עדות של היא ב בית ה משפט שתי גרסאות סותרות , ה אחת ה מפלילה את ה נאשם , ו ה אחרת - ש חוזרת ב היא מ גרסת ה הפללה .",8.0
103910,ראשונה,m00000935-103,"חברי ה שופט ב. אזולאי תאר את ה שוני ב אופן ש ב הוא מסרה ה מתלוננת את עדות של היא ה ראשונה ב פנין של הוא , לעומת ה פעמיים ש לאחר מ כן .",8.0
