sentence_id,תיאור,title,sentence_text,query number
634438,מוקדמת,m02001201-a,"עדות של היא ה מוקדמת של ה מתלוננת ב מקרה ה נידון הוקלטה באמצעות מכשיר וידאו , ב התאם ל בקשה של הם של ה צדדים ו כאמור ב החלטת בית ה משפט .",5.0
634439,מוקדמת,m02001201-a,"נראה כי ה טעם ש עמד ב יסוד ה החלטה להקליט את עדות של היא ה מוקדמת של ה מתלוננת , היה ה צורך להבטיח ש כל חברי ה הרכב ש יישבו ב בוא ה עת על ה מדוכה , יוכלו להתרשם מן ה עדה ב אופן בלתי אמצעי ו בלתי תלוי , ו כך לקבוע את מידת מ הימנות של היא .",5.0
634485,חוזרת,m02001201-a,"נדגיש ו נאמר - חלוף ה זמן בין קרות ה אירוע ו בין עדות של היא ה חוזרת של ה מתלוננת , מחייב התייחסות מתאימה .",5.0
634738,חוזרת,m02001201-a,טווח ה זמן ש חלף מ אז עדות של היא ה ראשונה ל עדות של היא ה חוזרת של ה מתלוננת עומד על כ - 21 חודשים .,5.0
635205,חוזרת,m02001201-a,"דוגמא ל כך , מצאתי ב עדות של היא ה חוזרת של ה מתלוננת , כש נשאלה על ידי ה סניגור ב עניין ה קונדום : "" שאלה : אז מי שאל את מי , של מי היה ה רעיון לשים קונדום ?",5.0
635893,קודמות,m02001201-a,הסבר זה לא עלה ב גרסאה של היא ה קודמות של ה מתלוננת .,5.0
636342,יחידה,m02001201-a,"ה פן ה ראייתי ב כל ה נוגע ל עבירת ה אינוס ל [ נוסח חדש ] , ה תשל""א - 1971 , ביטל את דרישת ה סיוע ל עדות של קורבן עבירת מין ו קבע ב מקום של היא חובת "" הנמקה "" , לפי היא רשאי בית ה משפט להסתמך על עדות יחידה של מתלוננת ו בלבד ש יפרט מה הניע את הוא להסתפק ב עדות זו .",5.0
637142,יחידה,s97002328-10,"יש לזכור ש לאחר ש הוסף ב , ו בוטל ה צורך ב סיוע לעדות יחידה ב ה עבירות מין , דרושה זהירות ש לא יורשע אדם חף מ פשע ( ה הדגשה של אני - ש.ד. ) ב ענייננו נראה ל אני ש לא היה זה בטוח להשתית את הרשעת ה מערער על עדות של היא ה יחידה של ה מתלוננת , ה לוקה , כאמור , ב סתירות ו ב תמיהות .",5.0
638299,יחידה,m03000984-300,"ב דעת מיעוט , סבר כבוד ה נשיא פלפל , כי ניתן להרשיע את ה נאשם על סמך עדות של היא ה יחידה של ה מתלוננת .",5.0
638617,יחידה,m03000984-300,"ה חיזוקים ל עדות ה מתלוננת ניתן להרשיע את ה נאשם על סמך עדות של היא ה יחידה של ה מתלוננת כיון ש אני מאמין לגרסה של היא , אין ב היא פרכות , אין ב ה הטסתירות ו היא אמינה בעוד עדות של הוא של ה נאשם בלתי אמינה ו אינני מאמין ל טענה של הוא ש ה מתלוננת נבעלה ל הוא מ רצון של היא .",5.0
639245,אימה,m021148,עדות אימה של ה מתלוננת על פרשת ה אונס 10 .,5.0
639427,אמינה,m021148,"התנהגות של הוא זו של ה נאשם ב אירוע ב יער , מצאה כאמור ביסוס חד משמעי ב עדות של היא ה אמינה של ה מתלוננת ו ב חיזוקים ש קיבלה עדות זו , ב דברי ה אם ב פנין של הוא , ש התיחסה ל מצבה הנפש י של ה מתלוננת כאשר שבה ל בית של היא לאחר ה אירוע , ו אל סימני ה מכות ש מצאה על גוף של היא לאחר מספר ימים .",5.0
639895,מהימנה,m021148,"עבירת ה אונס , הוכחה מעבר ל ה ספק סביר , ב עדות של היא ה מהימנה של ה מתלוננת ו ב חיזוקים ש הובאו ל תמיכה ב היא , מעבר ל נדרש על פי דין ; הכל , כפי ש הוסבר לעיל ב הרחבה .",5.0
642098,לא קוהרנטית,ME-08-1025-33,"ה תכנון ש קדם ל ביצוע ה עבירה - בגלל ה קשיים ה ראייתיים ב תיק בשל עדות של היא ה לא קוהרנטית של ה מתלוננת אין ממצאים מדוייקים על ה תכנון , אם כי ניתן להסיק כי ה המתנה ל העדרה של ה אם מ ה בית ו הכניסה ל חדרה של ה קטינה יכולים להיחשב כ תכנון מסויים .",5.0
645769,מופרכת,SH-10-04-42431-606,"שום ראיה חפצית לא הובאה לתמוך ב גרסה של הוא ה מופרכת של ה מתלונן "" .",5.0
646394,אמינה על אני,S-NoPub-ZB-9-017-L,"10 עדות של היא של ה מתלוננת היתה אמינה על אני , ו התרשמתי כי היא תיארה את ה אירועים שחוות של היא כהוויה של הם .",5.0
649840,יחידה,m021212d,"ה באתם של אלה אינה נעוצה , כ ה ידוע , ב חובה כלשהי , שכן בוטלה דרישת ה סיוע ל עדות יחידה של מתלוננת ב ה עבירות - מין .",5.0
650553,ברורות,m021212d,"את עדות של הם ה ברורות ו ה מפורטות של ה קטינה , אים של היא ו הבנים ב עניין זה - אין ה נאשם יכול להסביר .",5.0
651073,משכנעת,m021212d,"לעומת גירסה של היא ה ברורה , ה אמינה ו ה משכנעת של ה קטינה , ו ה ראיות ה רבות ה נוספות ה מאמתות את היא , כ מפורט לעיל , אין ל גירסה של הוא של ה נאשם על מה ש תסמוך .",5.0
651841,נוספות,s04002949-420,"הוא תומך בקשה של הוא ב עדות של היא של ה מתלוננת , ב עדויות ה תביעה ה נוספות ש באו ב פניי ו ב אמירות ש באו מ פי ה נאשם ב הודעה של הוא ב ה משטרה ב מהלך ה עימות ו ב עדות של הוא ב ביהמ""ש .",5.0
652173,יחידה,s04002949-420,הייתי מגיעה ל אותה קביע של היא גם על פי עדות של היא ה יחידה של ה מתלוננת .,5.0
659009,אותנטית,m08000502-117,"לאחר צפייה ב קלטות ה חקירה ה ממושכת ( ת / 5א ו - ת / 6א ) , כמו גם עיון ב ה תמלילים ( ת / 5 ( 1 ) ו - ת / 5 ( 2 ) ) , ניתן בהחלט להתרשם , ש אין ה מדובר ב תוצר של הדרכה אלא ב גרסה אותנטית של ה מתלוננת .",5.0
659173,יחידה,m08000502-117,"שבעתיים נדרש ה דבר ב נסיבות ה מקרה דנן , שעה ש הפללת ה נאשם נסמכת על עדות של היא ה יחידה של מתלוננת ה לוקה ב פיגור שכלי , ו כאשר ה מתלוננת חזרה ב היא , פעם אחר פעם , ב מהלך חקירה של היא על - ידי ה חוקר ה מיוחד , מ מרבית ה גרסה ה מפלילה .",5.0
659355,כללית,m08000502-117,עדות של היא של ה מתלוננת ב בית - ה משפט הייתה כללית ו לא מפורטת .,5.0
659407,כללית,m08000502-117,"זאת ו עוד אחרת : עדות של היא של ה מתלוננת ב בית - ה משפט , ש הפלילה את ה נאשם ב ה מכלול ה עבירות ש יוחסו ל הוא , הן ב מוצאי שבת ו הן ב אירועים ה נוספים , הייתה כללית ו לא מפורטת .",5.0
659414,יחידה,m08000502-117,"ב נסיבות אלו , אין ב עדות של היא ה יחידה של ה מתלוננת כדי לבסס את הרשעת ה נאשם - לא ב עבירת ה מעשים ה מגונים ש אירעה על - פי ה נטען ב מוצאי שבת , ו לא ב ה עבירות ה מין ה נוספות ב אירועים ש קדמו ל אותו מועד .",5.0
659417,יחידה,m08000502-117,"סיכום של היא של הערכת ה תשתית ה ראייתית : יישום ה מבחנים ש נקבעו ב פסיקה ל הערכת עדות של הוא של עד ה לוקה ב שכל של הוא , מוביל ל ה מסקנה כי לא ניתן לבסס הרשעה ב תיק זה בהסתמך על גרסה של היא ה יחידה של ה מתלוננת .",5.0
659420,יחידה,m08000502-117,"מבחן ה גיונה ה פנימי של ה עדות , אינו יכול להועיל אף הוא ל ביסוס ה רשעה על בסיס עדות של היא ה יחידה של ה מתלוננת .",5.0
659425,יחידה,m08000502-117,"ב נסיבות ה אמורות , לא ניתן לקבוע ממצאים ל חובת ה נאשם על - יסוד עדות של היא ה יחידה של ה מתלוננת .",5.0
659436,יחידה,m08000502-117,"מסקנחי הנה , כאמור , כי לא ניתן לסמוך ממצאים על - יסוד עדות של היא ה יחידה של ה מתלוננת , ו כי ה מאשימה לא הרימה את ה נטל ל הוכחת אשמה של הוא של ה נאשם מעבר ל כל ספק סביר .",5.0
660100,"נ""ל",m08000502-117,"קל ו חומר , ש אין לבסס הרשעה פלילית על פי עדות של היא ה נ""ל של ה מתלוננת , שכן , ראינו , כי ב משפט ה עברי ה פלילי , רף ה ראיות הוא גבוה במיוחד .",5.0
664005,"טענה של היא , עדות של היא של ה מתלוננת היתה עקבית",m07001017,"ל טענה של היא , עדות של היא של ה מתלוננת היתה עקבית ו מ הימנה , ו תאמה את ה גרסה ש מסרה ב ה משטרה , ו ב התבסס על היא יש לקבוע כי ה נאשם ביצע ב היא את ה מעשים ה מיניים ה מיוחסים ל הוא , מ אז היתה ה מתלוננת כ בת 13 , ו זאת ללא הסכמה של היא .",5.0
664021,מהימנה,m07001017,"עוד ציין ב""כ ה נאשם , כי יש לדחות את גרסה של היא ה בלתי מהימנה של ה מתלוננת , שכן ב עדות של היא התגלו סתירות מהותיות ב נוגע ל פרטי ה אירועים ה מפורטים ב כתב ה אישום , ו ה ראיות ש הוצגו ע""י ה נאשם , כגון שיחה של הוא ה מוקלטות עם ה מתלוננת , מוכיחות בעליל כי ה אחרונה לא מסרה אמת ב בית ה משפט .",5.0
664127,מהימנה,m07001017,"לאחר שמיעת ה עדויות ו סקירת ה ראיות ה רלוונטיות , הגעתי ל ה מסקנה , כי יש לבכר את גרסה של היא ה מהימנה של ה מתלוננת אודות ה אירועים , נשוא כתב ה אישום , על פני גרסה של הוא של ה נאשם .",5.0
676167,שניה,ME-08-1157-524,"להבדיל מ ה גרסה ה ראשונה ב ה משטרה , ה גרסה ה שניה של ה מתלוננת הפלילה את ה נאשם ב מיוחס ל הוא .",5.0
676258,נוספת,ME-08-1157-524,ה עדה טענה ש אילו היה מצב כ ה זה היא וודאי היתה כותבת על כך מ זכר ו גובה עדות נוספת מ ה מתלוננת .,5.0
676422,מפלילה,ME-08-1157-524,"ב""כ ה נאשם טען ב סיכום של הוא , כי מסירת ה גרסה ה מפלילה על ידי ה מתלוננת ב נסיבות ש תוארו כאשר ה מתלוננת מוטעית ב מתכוון ע""י ה חוקרת , נבעו מ ה רצון לשחרר את ה נאשם מ מעצר ו לרצות את ה חוקרים ו מתעורר ל דיד של הוא חשד כבד , כי אין מדובר ב גרסת אמת .",5.0
676441,מפלילה,ME-08-1157-524,"מ כל מקום , ו זה ה חשוב , מ צפייה ב חקירה ה מתועדת אין ל אני ספק , כי גרסה של היא ה מפלילה של ה מתלוננת כפי ש נמסרה משקפת ב צורה נכונה את מה ש ארע ב ה מציאות בין היא לבין ה נאשם .",5.0
676444,נוספת,ME-08-1157-524,"אילו היה מצב כ ה זה , ל טענה של היא היא היתה כותבת על כך מזכר ו גובה עדות נוספת מ ה מתלוננת .",5.0
676594,יחידה,ME-08-1157-524,"עפ""י ל פקודה - אם ה הרשעה היא על סמך עדות של היא ה יחידה של ה מתלוננת - "" בית ה משפט יפרט ב הכרעת ה דין מה הניע את הוא להסתפק ב עדות זו .",5.0
681128,מבולבלת,m00000933-128,"ו לעומת עדות של היא ה מבולבלת של ה מתלוננת ב בית ה משפט - כאשר ניכר היה ש היא מודרכת ע""י רצון של היא לסייע ל ה נאשם , ו ליישב את גרסה של היא עם גרסה של הוא כדי לעזור ל הוא - דבר של היא ב אימרה של היא ברורים ו סדורים .",5.0
685986,ראשונית,ME-13-07-39977-22,"גרסה של היא ה ראשונית של ה מתלוננת עובדות כתב ה אישום מתבססות , רובן הן כ כולן הן , על ה דברים ש מסרה ה מתלוננת ל חוקריה ב מהלך גביית הודעה של היא ה ראשונה ב יום 10.06.13 ( ת/11 ) , ו אשר הוגשה ל בית ה משפט חלף חקירה של היא של ה מתלוננת ב חקירה ראשית .",5.0
687212,מפלילה,m03001032,ענין נוסף ש מקשה על אימוץ גרסה של היא ה מפלילה של ה מתלוננת הוא משך ש הייתם ה משותפת של ה שניים ב דירת ה נאשם .,5.0
692653,אמינה,s08000496-128,"לאור כל ה אמור : עדות של היא ה אמינה של ה מתלוננת , הודיה של הוא ה חלקית של ה נאשם , ו משדחיתי גרסת ה הגנה , שוכנעתי מעבר ל כל ספק סביר כי עבר ה עבירה ה מיוחסת ל הוא ו אני מרשיעה את הוא בהתאם .",5.0
700274,יחידה,ME-00-121-HK,גם ב אישום ה שני מדובר ב עדות יחידה של מתלוננת .,5.0
702787,איתנה,SH-15-10-46643-55,"כפי ש יפורט , ה התכתבויות לא עוררו ב אני , ב סוף של הוא של דבר , ספק ב גרסה של הוא ה איתנה של ה מתלונן כי ה קשר לא היה זוגי או מיני .",5.0
702891,מהיימנה,SH-15-10-46643-55,ה טקסטים תומכים ב עדות של הוא ה מהיימנה ממילא של ה מתלונן .,5.0
703023,מהיימנה,SH-15-10-46643-55,"גם עדות של הוא ה מהיימנה של ה מתלונן לגבי שני ה "" סשנים "" , נתמכת ב התכתבויות .",5.0
706751,רבות,ME-10-05-9677-3,"חיזוק ל גרסת ה מתלוננת נמצא ב עדויות ה רבות ש הובאו מ טעם ה תביעה , ב עדות של הוא של מו. , עד מ טעם ה הגנה , ב דברי ה נאשם ב עימות , ב הקלטה על ידי ה מתלוננת ו ב עדות של הוא , ו ב תמונות ה פגיעות ה רבות ב היא .",5.0
719739,"טענת ה מאשימה , עדות של היא של ה מתלוננת הייתה מהימנה",ME-12-07-39094-303,"ל טענת ה מאשימה , עדות של היא של ה מתלוננת הייתה מהימנה , נעדרת הגזמה ו נטולת אינטרס להפליל את ה נאשם .",5.0
719958,מאוחרת,ME-12-07-39094-303,"ב מקרה דנן הן , גם אם שיקר ה נאשם ב כך ש הכחיש ב חקירה של הוא כל מעשה אלימות מלבד ה אירוע מ ושא ה אישום ה עשירי , אפשר כי ה דבר נועד למנוע את הסתבכות של הוא ב ה עבירות ש לא ביצע , קרי ב מסכת ה קשה של עבירות אינוס , אלימות ו כליאת שווא , כ נטען ב גרסה של היא ה מאוחרת של ה מתלוננת ב חקירה .",5.0
729931,מבולבלת,ME-15-07-22187-33,"יש לציין , כי גרסה של היא של ה מתלוננת ב עדות , ב נוגע ל רכב ש נתקע , הייתה מעט מבולבלת , אך מ דו""ח ה הובלה ש ביצעה , עולה כי תיארה שם מצב , ש ב הוא ה רכב של אב של היא נתקע , ו לכן , ו על מנת ש לא יראו יחדיו , ביקש מן היא ללכת ב ה רגל ל ה חברה , ש גרה לא הרחק מן ה מקום , גרסה ש היא הגיונית ו מובנת יותר , מן ה דברים ש הובאו ב עדות של היא .",5.0
735063,מפורטת,ME-15-08-15252-33,"נוכח עדות של היא ה מפורטת של ה מתלוננת באשר ל מעשה ה אינוס ה ראשון , ו ב ה שים ל ב ל חיזוקים ה רבים ש נמצאו ב ה חומר ה ראיות , כ מפורט לעיל , אני מוצאת כי יש לאמץ את עדות של היא באשר ל מעשה ה אינוס ש ביצע ב היא נאשם 1 ב אופן מלא .",5.0
741731,יחידה,m02001206,"עם זאת ו על - אף ש בוטלה דרישת ה סיוע ל עדות יחידה של מתלוננת ב ה עבירות מין , הובאו ב פנין של הוא עדויות נוספות ב מטרה לעבות ו לאמת את גירסה של היא , ו לחזק את אמינות של היא ו מ הימנות של היא .",5.0
742693,עקבית,m02001206,"לעומת גירסה של היא ה סדורה , ה הגיונית ו ה עקבית של ה מתלוננת , ו ה חיזוקים ו אותות ה אמת ה תומכים ב היא כ ה אמור לעיל - אין גירסה של הוא של ה נאשם יכולה להתקבל כ משכנעת ו אין ב היא כדי לפגום ב ה תמונה ש הצטיירה מ ראיות ה תביעה .",5.0
743358,ראשונות,s00001992-110,"אף תוספת שני פרטים אלה אינם יורדים , ל שורש ה עניין , שכן ה נשיקה ב צוואר מתיישבת גם עם ה גירסאות ה ראשונות של ה מתלוננת ( נשיקות ב איזור ה פנים ) , ו לגבי ה ארון - אין מחלוקת ש אכן היה ב ה מקום ארון ברזל .",5.0
743373,אותנטי,s00001992-110,"תיאור ה אירוע עצמו ע""י ה מתלוננת היה אותנטי ביותר , ו עדותה של ה מתלוננת לוותה ב בכי ו ב כאב .",5.0
744889,יחידה,m021063,"מ דרך ה טבע , ו על - אף ש בוטלה דרישת ה סיוע ל עדות יחידה של מתלוננת ב ה עבירות - מין , הובאו ב פנין של הוא ראיות נוספות ב מטרה לעבות , לחזק ו לאמת את גירסת ה מתלוננת .",5.0
746034,אמינה,m021063,"לעומת גירסה של היא ה אמינה ו ה מהימנה של ה מתלוננת ו ה ראיות ה נוספות ה תומכות ו משלימות את היא כ ה אמור לעיל , ה רושם ה עולה מ עדות ה נאשם ו מניתוח מגוון גירסה של הוא ו טענה של הוא - הוא שלילי ו בלתי - אמין .",5.0
746065,אמינה,m021063,"עדות של היא ה אמינה ו ה ברורה של ה מתלוננת , כש אל של היא נוספות ראיות בעלות משקל , ה מחזקות , מאששות ו מאמתות את היא , כש חלק מן הן עולות בגדר סיוע של ממש - גם כאשר לא נדרש כ ה זה ל עניין של אנחנו - עומדת כנגד גירסה של הוא ה רעועה ו הבלתי - אמינה ו טיעון של הוא ה מופרכים של ה נאשם .",5.0
746549,מפלילה,m03001032-606,ענין נוסף ש מקשה על אימוץ גרסה של היא ה מפלילה של ה מתלוננת הוא משך ש הייתם ה משותפת של ה שניים ב דירת ה נאשם .,5.0
748167,מהימנה,m025022,"כוח של הן ה מצטבר של ה ראיות ש הובאו להלן , כאשר הן מתווספות ל עדות של הוא ה מהימנה של ה מתלונן ו ל עדות של הוא ה סדוקה של ה נאשם , אינן מותירות , ל שיטה של אני , כל מקום לספק באשר ל אמיתות גרסה של הוא של ה מתלונן .",5.0
751318,מפורשת,ME-14-10-21304-44,"כאמור , אליבא עדות של היא ה מפורשת של ה מתלוננת היא לא הסכימה להיבעל על ידי ה נאשם ו לא הסכימה לבצע עם הוא מין אנאלי .",5.0
751326,אמינה,ME-14-10-21304-44,"עדות של היא ה אמינה של ה מתלוננת ו שאר ה ראיות ה תומכות ב היא , מבססות כנגד ה נאשם את ה עבירות ש יוחסו ל הוא ב כתב ה אישום .",5.0
753008,מהימנה,m03001164,"מסקנה של היא הייתה כי גירסה של היא של ה קטינה מהימנה , ו כך כתבה ב נימוקיה :",5.0
753091,מהימנה,m03001164,"את מסקנה של היא כי גירסה של היא של ה מתלוננת מהימנה היא ו כי חוותה על גוף של היא את אשר תיארה ב פנים של היא , ביססה חוקרת - ה ילדים , כך העידה , על ה "" פאזל "" ש נבנה על - יסוד ניתוח חקירה של היא של ה מתלוננת , לאחר עיון נוסף ב תמלול ו צפייה ב קלטת ה חקירה .",5.0
753216,עקבית,m03001164,"עם זאת , קבעה ה חוקרת חד - משמעית , כי לאחר בחינה כוללת של מהימנות ה מתלוננת , ה מדובר ב גירסה עקבית ו מדויקת של ה מתלוננת ו ב היא אלמנטים רבים ה מצביעים כי אין מדובר ב ה דברים ש הוכנסו לפי היא או "" הושתלו "" ב זיכרון של היא .",5.0
753748,יחידה,m03001164,"כ ה ידוע , כאשר מדובר ב ה עבירות מין אין צורך ב קיום של הוא של סיוע ל עדות יחידה של מתלוננת , ו בלבד ש מסקנת בית - ה משפט תנומק כ דבעי , כ מצוות ל [ נוסח חדש ] , ה תשל""א - 1971 .",5.0
753751,ארוכה,m03001164,"שמענו את עדות של היא ה ארוכה ו ה מפורטת של ה מתלוננת , ו יכולנו להתרשם ב ארח בלתי - אמצעי מ אופייה , התנהגות של היא ו אופן מסירת עדות של היא , על רקע גיל של היא ה צעיר ו מצבה ה מיוחד , ו לאורך חקירה לא - קלה .",5.0
753799,אמינה,m03001164,חיזוקים ל עדות של היא ה אמינה של ה מתלוננת מצאתי ב ראיות ה נוספות ש הובאו ב פנין של הוא .,5.0
753838,מהימנה,m03001164,"לעומת עדות של היא ה כנה , ה פשוטה ו ה מהימנה של ה מתלוננת , הייתה גירסה של הוא של ה נאשם רוויה ב סתירות משמעותיות ו העלתה סימני - שאלה רבים ש לא הוסברו .",5.0
758067,עקבית,SH-19-01-11020-11,"גם ב גרסה של היא ה בלתי עקבית של ה מתלוננת ב דבר "" רצינות "" ה קשר בין היא ו בין ה נאשם ( ר' לשם השוואה עמ' 9 ש' 32 - 33 אל מול עמ' 12 ש' 13 ל ה פרוטוקול ) יש כדי להצביע על רצינות ה קשר ו כוונה של הם ב עת ה אירוע להתחתן ב המשך ה דרך .",5.0
763404,מוקדמת,ME-15-11-4139-531,"לאחר עדות של היא ה מוקדמת של ה מתלוננת , ביקש ה נאשם לתקן את תשובה של הוא ל אישום .",5.0
763476,מאוזנת,ME-15-11-4139-531,"סבורני , כי גרסה של היא ה מאוזנת של ה מתלוננת , ו ה עובדה ש לא העצימה את תיאוריה יתר על ה מידה , מצביעה על אותנטיות ו אמיתות גרסה של היא ו כי ה מתלוננת לא ביקשה לטפול על ה נאשם מעשים ש לא ביצע .",5.0
763757,מוקדמת,ME-15-11-4139-531,"רק לאחר ש נשמעה עדות של היא ה מוקדמת של ה מתלוננת , ביקש ה נאשם לתקן את תשובה של הוא ל אישום , ו טען לראשונה , כי הוא נכנס ל שביל ה עפר כדי להטיל את מימה של הוא .",5.0
763859,מוקדמת,ME-15-11-4139-531,"אחזור ו אדגיש כאן את ה תזמון ב הוא בחר ה נאשם לשנות את גרסה של הוא ה ראשונית לפי היא טעה ב דרך , ל גרסה לפי היא עצר להטיל את מימה של הוא - מיד ב תום עדות של היא ה מוקדמת של ה מתלוננת .",5.0
765994,יחידה,ME-12-5501-303,"סוף דבר ל ה עניין מעשי ה אינוס הרשעה ב עבירת מין על סמך עדות יחידה של מתלוננת , דורשת הנמקה מיוחדת כאשר ה הנמקה חלה על כל עבירה בנפרד ו עוצמה של היא נגזרת מ עוצמת ה עדות ו עוצמת ה בעיות ה מכרסמות ב היא .",5.0
771142,אמינה,k00414598p,עדות של היא של ה מתלוננת היתה אמינה על אני .,5.0
781320,מפורטת,ME-08-5014-44,"אפנה תחילה ל עדות של היא ה ארוכה ו ה מפורטת של ה מתלוננת כפי ש מצאה את ב ה יטויה , הן ב חקירה של היא ה ראשית ו הן ב חקירה נגדית נוקבת של באת כח ה נאשם .",5.0
