sentence_id,תיאור,title,sentence_text,query number
102028,מפורטת,ME-12-10-49947-393,"סיכום של הוא של דבר , לאחר שמיעת עדות של הוא של ה מתלונן ו התרשמותי ה בלתי אמצעית מן הוא ו לאור ה אמור , אני קובע כי עדות של הוא ה מפורטת , ה עקבית ו הכנה של ה מתלונן היא עדות אמת ו ניתן לקבוע ממצאים ודאיים על סמך עדות של הוא ה אמינה .",5.0
102161,מהימנה,ME-12-10-49947-393,"מעבר ל כל ה אמור ניצבת עדות של הוא ה מהימנה של ה מתלונן ש לא מותירה מקום ל ה ספק באשר לזיהויו את הוא של ה נאשם ב אופן וודאי ו בלי קשר ל "" מוניטין "" ש היה ל ה נאשם .",5.0
102394,ראשונית,ME-08-1047-463,"גם כאן , גרסה של היא ה ראשונית של ה מתלוננת מסתברת יותר ו מתיישבת עם יתר ה ראיות ו עם ה תמונה ה כללית כפי ש זו משתקפת מ ה עובדות ה מוסכמות ו מתיאורי ה רקע ב עדות של היא של היא .",5.0
103647,שניה,m00000935-103,"ל טענת ה מאשימה יש להרשיע את ה נאשם ב ה עבירות ה מיוחסות ל הוא על יסוד עדות של היא ה שניה של ה מתלוננת , ש אותו היא יש לקבל כ מהימנה ו לייחס ל היא את מלוא ה משקל , ו לאור ראיות חיזוק נוספות כ מפורט ל הלן :",5.0
103744,שניה,m00000935-103,"ב יחס ל עדות ה שניה של ה מתלוננת ב בית ה משפט מ יום 12.12.00 , ב היא חזרה ה מתלוננת על ה גרסה ה מפלילה את ה נאשם , קדמה ל עדות של היא בקשת ב""כ ה מאשימה לאפשר ל היא להעיד פעם נוספת את ה מתלוננת , ב נימוק ש אם ה מתלוננת פנתה אל היא , ו ביקשה לאפשר ל מתלוננת לשוב ו להעיד , ו כן ש יש ב כך כדי לגרום ל ה גילוי ה אמת .",5.0
103830,מפלילה,m00000935-103,"לאחר ש שקלתי את ה שיקולים ה אמורים , הגעתי ל ה מסקנה ש יש לקבל את גרסה של הם ה מפלילה של ה מתלוננת , אם של היא ו אחיה , לאור ה הסברים ש ניתנו ב קשר ל כך ו לאור הגיון של הם של דברים .",5.0
104681,אמינה,ME-08-10-6212-89,ל עדות ה אמינה של ה מתלוננת ב מקרה דנן מצטרפות ראיות ב עניין מצב של היא ה נפשי ו התנהגות של היא של ה מתלוננת ב סמוך לאחר ביצוע ה מעשים .,5.0
107039,אחרת,ME-10-04-32059-862,"מ כל מקום , גם על ה הגנה מקובל כי אדם היה רק עד שמיעה , הן ל דברי א' ו הן ל דברי ה מתלוננת , ו לא עלתה טענה , כי ב שלב כלשהו שמע גרסה אחרת , ו סותרת , מ פי ה מתלוננת או מפי של היא של א' .",5.0
111555,מבולבלת ב מקצת,s06002148-239,"עדות של היא של ה מתלוננת לגבי שני ה אירועים , ב הם נרשמו מספרי ה רכב היתה מבולבלת ב מקצת ו קשה לקבוע על פי עדות של היא ב חקירה ראשית ב איזה מן ה רכבים נהג ה נאשם ב כל אחד מ שני ה אירועים ה נ""ל ( כך למשל , לגבי ה אירוע מ יום שישי 3 /2 / 06 ) , היא מוסרת ש ה נאשם נהג ב רכב 6236382 ( עמ' 16 , שורה 23 ) ( ש אין חולק ש הוא רכב וולוו של ה נאשם ) .",5.0
114761,ברורה,SH-19-11-32007-294,"ל ה עניין זה , אני מוצאת לאמץ את גרסה של היא ה ברורה ו ה בטוחה של ה מתלוננת ו לפי היא התקשרה ל יחיאל על מנת להשיג את ס' בן זוג של היא ש שכח את מכשיר ה טלפון של הוא ב דירה .",5.0
117895,חלופיות,ME-12-07-17416-33,"כבר עתה אומר , כי נוכח ה מורכבות ה עובדתית ש בתיק זה ו לאור ה עובדה ש ה מתלוננת חזרה ב היא מספר פעמים מ תלונה של היא נגד ה נאשם , בחנתי את ה ראיות ו ה עדויות ב תיק זה ב משנה זהירות , תוך ש שמתי ליבי ל רגישות ה מייחדת את ה מקרה ו תוך בחינה דקדקנית של גרסאה של היא ה חלופיות של ה מתלוננת .",5.0
121096,עניינית,SH-10-01-40299-583,"כפי ש ציינתי לעיל , עדות של היא של ה מתלוננת היתה עניינית ו קוהרנטית ו אפילו אניח כי אכן נטלה תרופות עובר ל מתן עדות של היא ( ה מתלוננת עצמה הכחישה זאת , ראה ע' 27 ל ה פרוטל ב של 5 - 8 ) אזי , לא מצאתי כי היה ב כך כדי לפגום ב אותה עדות או ב כושר העדה של היא של ה מתלוננת .",5.0
121501,שונות,m01000232,"סתירה זו בין גרסאה של היא ה שונות של ה מתלוננת מצביעה על כך כי ה מתלוננת מנסה להציג בפני ב יהמ""ש מצג לפי הוא ה נאשמים כלל לא מצאו חן ב עין של היא מלכתחילה ו כי לא הייתה מעונינת ב כל מגע עם הם , אך מצג זה אינו מתיישב עם ה עובדה כי ה מתלוננת בילתה עם ה נאשמים ב שני מועדים שונים ו נפגשה עם הם ב ה פעם ה שניה ב פאב ה פונזי ב פגישה יזומה .",5.0
121587,מלאת סתירות,m01000232,"כפי ש פורט לעיל , גרסה של היא של ה מתלוננת הינה מלאת סתירות ו מעלה תמיהות ו תהיות רבות .",5.0
121659,אמיתית,m01000232,"אין זה הגיוני כי חברה של היא של ה מתלוננת תשקר ב עדות של היא ו סביר להניח כי לו אכן גרסה של היא של ה מתלוננת הייתה אמיתית , חברה של היא הייתה תומכת ב גרסה של היא ו מעידה על ה דברים כפי ש התרחשו באמת .",5.0
121850,"אמור לעיל , עדות של היא של ה מתלוננת הייתה בלתי מהימנה",m01000232,"כ ה אמור לעיל , עדות של היא של ה מתלוננת הייתה בלתי מהימנה .",5.0
121883,שונות,m01000232,ב שני מסמכים שונים ש הוצאו על ידי ה מחלקה ל רפואה דחופה ב בית ה חולים כרמל ניתן להבחין ב שתי גרסאות שונות של ה מתלוננת .,5.0
121889,מעורערת,m01000232,"לעומת גרסה של היא ה מעורערת של ה מתלוננת עומדות גרסא של הם ה עקביות ו ה אמינות של שלושת ה נאשמים , אשר מתיישבות זו עם זו .",5.0
122008,"ענייננו , כפי ש פורט לעיל , גרסה של היא של ה מתלוננת הינה בלתי מהימנה",m01000232,"ב ענייננו , כפי ש פורט לעיל , גרסה של היא של ה מתלוננת הינה בלתי מהימנה ו לא ניתן לקבל את טענה של היא כי התנגדה ל קיום יחסי ה מין עם ה נאשמים ו זאת לאור ה סתירות ו התמיהות ה עולות מגרסה של היא .",5.0
123263,יחידה,SH-09-2568-196,"לא נעלמה מ עיני ה עובדה ש מדובר ב הרשעה על סמך עדות יחידה של ה מתלוננת , אך חרף זאת מצאתי ש ניתן להסתפק ב עדות זו ל צורך ה רשעה .",5.0
124103,"גישת ה תובעת , עדות של היא של ה מתלוננת הייתה קולחת",ME-08-1012-33,"ל גישת ה תובעת , עדות של היא של ה מתלוננת הייתה קולחת ו עקבית ו היא השיבה ל כל ה שאלות ש הוטחו ב היא , ו הסבריה ל עיכוב ב הגשת ה תלונה היו הסברים הגיוניים .",5.0
124127,מהימנה,ME-08-1012-33,"נטען כי לעומת עדות של היא ה מהימנה של ה מתלוננת , הייתה גרסת ה נאשם בלתי אמינה , כאשר ל דעת ה תביעה "" דבר של הוא מלאים ב תמיהות , גרסה של הוא כבושה ו מלאה ב פרטים נוספים ש העלה לראשונה ב עדות של הוא ב בית ה משפט ... "" .",5.0
124158,"גישת ה סנגור , עדות של היא של ה מתלוננת הינה בעייתית",ME-08-1012-33,"ל גישת ה סנגור , עדות של היא של ה מתלוננת הינה בעייתית ו בלתי מהימנה , ו אין ניתן להשתית על היא הרשעה פלילית , ו בעיקר כש מדובר ב עדות יחידה .",5.0
124201,יחידה,ME-08-1012-33,"ל ה סיכום , טוען ב""כ ה נאשם כי עדות של היא ה יחידה של ה מתלוננת הינה בעייתית ביותר ו אין כל אפשרות להשתית על היא הרשעה .",5.0
126950,סותרות,k00018098p,"אך יודגש , כ מצויין גם ב ראשית דבר של אנחנו , כי עיקר מלאכה של הוא של בית ה משפט ב תיק זה תהא להכריע בין ה גירסאות ה סותרות של ה מתלוננת מ זה ו של ה נאשמים מ זה , ו לקבוע מי מן הם דובר אמת ו מי נמנע מ כך .",5.0
127161,מהימנה על אנחנו,k00018098p,"עדות של היא של ה מתלוננת , על אף ה סתירות ש ב היא , היתה מהימנה על אנחנו .",5.0
128122,אמינה,ME-08-04-4869-1,"עדות של הוא ה אמינה של ה מתלונן ה נתמכת , בין ה יתר , ב נזק ה נפשי ה חמור ש נגרם ל הוא , מצביעה כי אכן חווה פגיעה מינית חמורה .",5.0
128136,קשה,ME-08-04-4869-1,"עיקר טענת ה נאשם , כבר ב חקירה ב ה משטרה , היא כי ה עלילה נרקמה על ידי מ. , ו הטענה , ש הועלתה לראשונה ב בית ה משפט , היא ניסיון נואש של ה נאשם ליתן מענה ל עדות של הוא ה קשה ו ה נוקבת של ה מתלונן .",5.0
128175,אמינה,ME-08-04-4869-1,"עם זאת , מ ה נסיבות ה אופפות את ה מעשים , כפי ש תוארו ב עדות של הוא ה אמינה של ה מתלונן , עולות נסיבות ה לוואי של ה מעשים ה מצביעות לפחות על ניסיון להחדיר את איברט של אנחנו לפי ה טבעת של ה מתלונן .",5.0
128299,שונות,ME-08-04-4869-1,"קביעה של הוא של בית ה משפט ה מחוזי , לפי היא ה סתירות בין גרסאה של היא ה שונות של ה מתלוננת ש על הן הצביע ה מערער אינן מהותיות , מקובלות על אני .",5.0
128727,מיידית,ME-10-07-35429-3,עדות של היא ה מיידית של ה מתלוננת נתמכת ב חיזוקים רבים ו ה ראשון ש ב הם מצב של היא ה נפשי מיד לאחר ה אירוע .,5.0
130752,מהימנה,SH-09-5632-185,"מ סקנתי זאת נשענת על 3 אדנים מרכזיים : ( 1 ) עדות של היא ה מהימנה של ה מתלוננת ; ( 2 ) מצב של היא ה נפשי ה נסער בעקבות ה אירוע ; ( 3 ) אמרה של הוא ה מפלילה של ה נאשם ל ה שוטרים ב ה שטח , ו ה יעדר אמון ב גרסה של הוא .",5.0
130756,מהימנה,SH-09-5632-185,עדות של היא ה מהימנה של ה מתלוננת,5.0
130776,נטולת קשיים,SH-09-5632-185,"מ סקנתי ב דבר מהימנות עדות ה מתלוננת מתקבלת אף לאחר ש ב חנתי את כל אותן סתירות על הן הצביע ה סניגור , ו ה גם ש ברור כי עדות של היא של ה מתלוננת לא הייתה נטולת קשיים .",5.0
132519,תמימה,ME-10-06-32318-4,"ה נאשם מסר גרסה תמימה , לפי היא ב מהלך ה מפגש , ה מתלוננת ו הוא שוחחו , שיחקו עם חתול של הוא ו עם מכשיר ה "" אייפון "" של הוא .",5.0
132522,סותרות,ME-10-06-32318-4,"על מנת להכריע בין גרסא של הם ה סותרות של ה נאשם ו ה מתלוננת , נפנה אפוא לבחון מהימנות גרסאות אלו , ו כן את מידת השתלבות של הן ב מארג יתר ה ראיות ש הובאו ב פנין של הוא .",5.0
133597,שקרית,ME-11-06-2965-391,"שלישית , טוען ב""כ ה נאשם כי גרסה של היא ה שקרית של ה מתלוננת נולדה לאחר ש התברר ל היא כי בן זוג של היא שאהר גילה את ה עובדה ש היא בילתה ב אותו לילה עם גבר אחר , ו מתוך פחד של היא ש לא יאונה ל היא כל רע מ ידי בן זוג של היא , איש אלים ו חם מזג , ה מציאה את סיפור ה חטיפה ו ה אונס , על מנת להסיט את ה אשמה ל "" בילויה "" עם ה נאשם מן היא ל ה נאשם עצמו .",5.0
133842,כוללת,ME-11-06-2965-391,איני מתעלם מן ה קשיים ש ב עדות של היא ה כוללת של ה מתלוננת .,5.0
133862,שקרית,ME-11-06-2965-391,"גרסה שקרית זו של ה מתלוננת היא משמעותית ביותר , מאחר ש ה עבר ה משותף של היא ו של ה נאשם בוודאי מקרין לא רק על מידת ה מהימנות ש יש ל יחס ל מתלוננת ב אופן כללי , אלא אף על מידת ה מהימנות ש יש ל יחס ל גרסה של הוא של ה נאשם ש ה שניים התחבקו ו התנשקו ו זרמו לקראת יחסים אינטימיים גם ב ליל ה אירוע נשוא כתב ה אישום .",5.0
135219,יחידה,SH-07-4824-71,"( עמ' 44 ש' 5 - 10 ) הערכת מהימנות ו קביעת ממצא של אני עובדה כבר עתה אומר כי לאחר ש האזנתי ל דברי ה עדים ו בחנתי את עדות של הם ב פני , אני מעדיף ללא היסוס את גירסת ה מתלוננת ל אירועים ו דוחה לחלוטין את גירסת ה נאשם , ו זאת לאחר ש הזהרתי עצמי כ מתחייב מ הוראת ל כי ה מדובר ב הכרעה על בסיס עדות יחידה של מתלוננת ב עבירת מין .",5.0
135358,מהימנה,SH-07-4824-71,סיכום ה תרשמותי מ ה מתלוננת אין ספק ב עין של אני כי עדות של היא של ה מתלוננת הינה מהימנה ו בעלת מידת אמינות גבוהה .,5.0
135631,נוספת,ME-11-06-2577-640,"דעה של היא של ה עדה לא השתנתה גם לאחר גביית עדות נוספת מ ה ילדה , ש נכפתה על היא כעבור קרוב ל חודשיים מ גביית ה ראשונה ו אחרי הגשת כתב ה אישום .",5.0
135872,יחידה,ME-11-06-2577-640,"לכן די עתה ב עדות יחידה של ה מתלונן / ת ב ה עבירות מין לשם הרשעה , אך מ צד שני גם ב מקרה כ ה זה מוטל על בית ה משפט להקפיד כי ה הנמקה ה נדרשת תתמודד כראוי , ב אופן הולם , הוגן ו ממצה , עם כל ה קושי ש עלול לעורר מתן ה אמון ב עדות יחידה של ה נפגע "" .",5.0
136185,יחידה,ME-11-06-2577-640,"ב מוקד ראיות ה תביעה עומדת , כ דבר מובן מ אל הוא , עדות של היא ה יחידה של ה מתלוננת ו ב התאם ל מידת ה אמון ש יינתן ב היא , ב סוף של הוא של יום , יקום ו ייפול דבר .",5.0
136200,סותרות,ME-11-06-2577-640,"ה עובדות ה נוגעות ל לבישת ה גרביונים ב אותו אירוע נותרו עמומות , כאשר הוצגו ב פנין של הוא גרסאות סותרות ב נושא , חלק של הן מ פי ה מתלוננת .",5.0
136331,יחידה,s00012094-286,"כן מציין ה סניגור כי ה מתלוננת לא אמרה ב עדות של היא ב ביהמ""ש דבר ב עניין צביטה בלחי ו על כן , ל דעת ה סניגור , אין להשתית הרשעה בהסתמך על עדות של היא ה יחידה של ה מתלוננת .",5.0
137695,רצופת סתירות,SH-07-2293-935,עדות של היא של ה מתלוננת היתה לא עקבית ו רצופת סתירות .,5.0
138046,שלישית,SH-07-2293-935,"בפני מ' הוצגה ה גרסה ה שלישית לפי היא ה מתלוננת ה חחטה לנקום ב ה נאשם בעקבות סירוב של הוא להסיע את היא ( עמ' 170 - 171 ) ו היא ניסתה לסחוט את ה נאשם ב ה שיחה ה טלפונית עם שאול , ש אם ה נאשם לא יתן ל היא 50,000 ₪ היא תספר לא' את ה סיפור ו הוא ירצח את הוא ( את ה נאשם ) .",5.0
138123,יחידה,SH-07-2293-935,"ל עניין של אנחנו , למרות ש העדפתי גרסה של היא של ה מתלוננת על פני גרסה של הוא של ה נאשם , הגעתי ל ה מסקנה כי ב נסיבות ה מקרה , נוכח התנהלות של היא ה לא שגרתית של ה מתלוננת עובר ל הגשת ה תלונה ו לאחריה , לא יהיה זה בטוח לקבוע ממצאים עובדתיים מרשיעים ב דבר אשמת ה נאשם מעבר ל כל ספק סביר על יסוד עדות של היא ה יחידה של ה מתלוננת .",5.0
139479,יחידה,s015840,"באשר ל מקרה ב מוסך : ה סנגור הדגיש , ש כתב ה אישום תלוי כולו הוא ב עדות של היא ה יחידה של ה מתלוננת , ש אין ל הוא כל חיזוק או סיוע .",5.0
143168,ברורה,SH-07-1532-247,"עדות של הוא ה נ""ל של ה מתלונן היתה מבולבלת , מתחמקת , בלתי ברורה לא עקבית כלל .",5.0
143183,מהימנה,SH-07-1532-247,"התרשמתי כי עדות של הוא ה נ""ל של ה מתלונן לא היתה מהימנה כלל , ו ה הסבר ש מסר ליישב את ה סתירה בין דבר של הוא ב ה משטרה לבין גרסה של הוא ב בית ה משפט , לא היה משכנע כלל .",5.0
143232,עקבית,SH-07-1532-247,"יש לציין כי עדות של הוא של ה מתלונן , ל ה עניין ה תלונות ה קודמות ה נ""ל , לא היתה עקבית כלל .",5.0
144751,מהימנה,M003032,"אין אנו מאמינים ל עדות ה נאשם , ו אנו מעדיפים את עדות של היא ה מהימנה של ה מתלוננת על פני הכחשה של הוא ה כוללת של ה נאשם .",5.0
145014,ארוכה,s993830,עדות של היא של ה מתלוננת היתה ארוכה ו מפורטת ו ניתן היה להתרשם מן היא ו מאישיות של היא במשך ה שעות ה רבות ב הן עמדה על דוכן ה עדים .,5.0
145628,אמינה,s993830,"כפי ש בואר לעיל , ה נדבך ה מרכזי ב הרשעה של הוא של ה נאשם היא עדות של היא ה אמינה ו ה משכנעת של ה מתלוננת , כש אל של היא מצטרפות ראיות נוספות ה מחזקות ו מעבות את היא .",5.0
146293,אמינה על אני,s021336a,גירסה של הוא של ה מתלונן היתה אמינה על אני ו נמצאו ל היא ראיות מסייעות ו מחזקות .,5.0
149705,שיקרית,m97000952-7,"שכן , לא מתקבל על ה דעת ש ב חורה ש בוצעו ב היא מעשים מיניים בניגוד ל רצון של היא ו ב ה כפיה , פעמיים , ל טענה של היא , תמשיך להיפגש עם מי ש כפה על היא יחסים אלו , ו לקיים איתו הוא יחסי מין מ רצון כאילו לא אירע דבר ; ו היא הנותנת - כך על פי ה טענה - כי גירסה של היא של ה מתלוננת הינה שיקרית .",5.0
150343,אותנטית,ME-09-09-9012-283,ה עדות של ה מתלוננת הייתה אותנטית ו לא היה ב היא רצון ל נקמה .,5.0
150562,יחידה,ME-09-09-9012-283,"ב היות עדות ה מתלוננת עדות יחידה , כרסום זה מתווסף ל תהיות ש עלו ב עדות של היא לגבי נ / 5 , ו אלה הביאו את אני ל ה מסקנה ש לא ניתן לבסס ממצאים מרשיעים על יסוד עדות של היא ה יחידה של ה מתלוננת לגבי ה עבירות ה מיוחסות ל ה נאשם 2 .",5.0
150595,חדה,ME-09-09-9012-283,"עם אחר , היתה עדות של היא של ה מתלוננת חדה במיוחד , כאשר העידה כיצד היא שבה ו חשה זאת ב אופן מדויק גם ב עת עדות של היא , ו ה עבירה ל אנחנו תחושה זו ב אופן מצמרר .",5.0
151488,סותרות,m02001067-568,"עדות של הוא של שבי היא ה עדות ה יחידה של מי ש היה קרוב ל אירועים ב עת התרחשות של הם , מלבד עדות של הם ה סותרות של ה מתלוננת ו ה נאשם .",5.0
151690,יחידה,m02001067-568,"על - אף ש בוטלה דרישת ה סיוע ל עדות יחידה של מתלוננת ב עבירת - מין , הובאו ב פנין של הוא ע""י ה מאשימה עדויות נוספות ב מטרה לתמוך ו לאמת את גרסת ה מתלוננת , ו לחזק את אמינות של היא .",5.0
154611,אמינה,M-NoPub-ZC-5-306-L,"הבאתי את תמצית עדות של הן של ה אם ו של ה מורה , כדי להראות עד כמה אמינה , עקבית ו מאופקת היתה גירסה של היא של ה קטינה .",5.0
154625,נוספת,M-NoPub-ZC-5-306-L,"ה חוקרת תמר קניספל קבעה ב חוות דעה של היא ( ת / 92 ) , כי ה ילדה מהימנה ו ה מליצה לגבות עדות נוספת מ ה ילדה על ידי חוקר / ת ילדים דובר / ת ערבית .",5.0
155591,עקבית,m02001242,"סתירות מהותיות אלו מצביעות על כך ש ה נאשם שיקר , בעיקר לאור בחינת גרסה של הוא ה עקבית ו ה הגיונית של ה מתלונן , ש נתמכת ב דברי חבר של הוא ו אנשי ה משטרה , רס""ר שלמה ממן ו משה פורשר , אשר דבר של הם משלימים ו מאששים כאמור , אלה את אלה .",5.0
156992,מהימנה,ME-10-09-31383-790,"כמו כן , על פי גרסה של היא ה מהימנה של ה מתלוננת , ה נאשם נכנס ו יצא מן ה חדר כמה פעמים ; הוא יצא מ ה חדר , כש ה אחות בכתה או כש ביקש ש ה מתלוננת תצא ל שירותים , ו חזר לאחר מ כן ל חדר ; ו מכאן ש גם הייתה ל הוא אפשרות להימנע מ מעש של הוא ( ל מקרים נוספים ש ב הם הועלתה טענת שכרות , ראו למשל ו ה שוו : ( 3 ) 83 , ב ה פסקה 5 .",5.0
157003,מהימנה,ME-10-09-31383-790,"כפי ש קבעתי לעיל , אני מאמץ את גרסה של היא ה מהימנה של ה מתלוננת באשר ל כל ה מעשים ש ביצע ב היא ה נאשם , כ מתואר ב כתב ה אישום , ו דוחה כבלתי מהימנה את גרסה של הוא של ה נאשם , ש לפי היא כלל לא נכנס ל חדר , אלא ישן במשך ה לילה .",5.0
157025,מהימנה,ME-10-09-31383-790,"כפי ש קבעתי לעיל , אני מאמץ את גרסה של היא ה מהימנה של ה מתלוננת - גם לגבי אמירה של הוא של ה נאשם ל מתלוננת ב חדר ש זה סוד ו שלא תגלה דבר , ו גם לגבי ה מפגש של הוא ב ה בוקר ש למחרת עם ה מתלוננת ב בית , ש אז קרץ ל היא , עשה תנועה עם ה יד על ה פה , ו אמר "" ששש "" .",5.0
163434,אמינה,m02001238,"לכאורה , די ל אנחנו ב גירסה של היא ה אמינה ו ה מהימנה של ה מתלוננת בכדי להרשיע את ה נאשם ב עבירה ה מיוחסת ל הוא .",5.0
163479,כוללת,m02001238,"אין כל ספק כי מצב נפשי כ ה זה אשר , כאמור , מחייב גם היום טיפול פסיכיאטרי תרופתי ו מעקב ל טווח ארוך , מהווה סיוע של ממש ל גירסה של היא ה כוללת של ה מתלוננת , הגם ש סיוע אינו נדרש ל היא .",5.0
163518,הבלתי נסתרת,m02001238,"לעומת גירסה של היא ה אמינה , ה מהימנה ו הבלתי נסתרת של ה מתלוננת , אשר קיבלה סיוע , חיזוק ו אימות מ כל ה ראיות ה נוספות כ ה אמור ל עיל , ה רושם ה עולה מגרסאה של הוא של ה נאשם , מ עדות של הוא ב בית - ה משפט ו מ התנהגות של הוא ב מהלך ה דיונים הוא שלילי ו בלתי אמין .",5.0
164413,מהימנה,s002301,"אלא ש ב בואי לברור את ה מוץ מן ה תבן , מצאתי כי גרסה של היא של ה קטינה , באשר ל ה מעשים ש ביצע ה נאשם ב גופה , הינה מהימנה .",5.0
